stories_id,publish_date,title,url,language,ap_syndicated,themes,media_id,media_name,media_url,media_pub_country,media_pub_state,media_language,media_about_country,media_media_type
"656043067","2017-07-12 07:40:56","Kremlin denies reaching out to Trump Jr. via developer","https://www.washingtonpost.com/world/europe/kremlin-denies-reaching-out-to-trump-jr-via-developer/2017/07/12/88435f04-66f4-11e7-94ab-5b1f0ff459df_story.html","en","True","politics and government","2","Washington Post","http://washingtonpost.com","United States","DC, USA","English","United States","Print Native"
"669424765","2017-07-17 17:26:09","What the Heck Is a Russian 'Crown Prosecutor'?","https://www.theatlantic.com/international/archive/2017/07/russian-crown-prosecutor/533295/","en","False","politics and government, news and news media, media, ethics","1110","The Atlantic","http://www.theatlantic.com/","United States","","English","United States","Print Native"
"658784553","2017-07-17 11:45:25","Why Donald Trump Jr. Was Skeptical Of Goldstone&#8217;s Claims In Email","http://dailycaller.com/2017/07/17/why-donald-trump-jr-was-skeptical-of-goldstones-claims-in-email/","en","False","politics and government, news and news media, media, ethics","18775","Daily Caller","http://dailycaller.com","United States","","English","United States","Digital Native"
"746857213","2017-12-15 07:14:50","Report: Music Promoter Offered To Set Up Putin, Trump Meeting During Campaign","https://www.huffingtonpost.com/entry/music-promoter-putin-trump-meet_us_5a336a53e4b040881be9342f?utm_hp_ref=donald-trump","en","False","politics and government, united states politics and government, elections, presidents and presidency (us), presidential elections (us), news and news media","27502","Huffington Post","http://www.huffingtonpost.com/#","United States","","English","United States",""
"715454817","2017-10-27 16:13:40","What we know about Yuri Chaika — the Kremlin's 'master of kompromat' who's behind the notorious Trump Tower meeting","http://feedproxy.google.com/~r/businessinsider/~3/JtRhd-euIQI/who-is-yuri-chaika-2017-7","en","False","politics and government, law and legislation, united states politics and government, lobbying and lobbyists, ethics, international relations, international trade and world market, embargoes and economic sanctions, freedom and human rights","18710","Business Insider","http://www.businessinsider.com","United States","","English","United States","Digital Native"
"717850848","2017-11-01 15:57:09","Paul Manafort is entangled in a vast web of connections to Russia — here's everything we know about so far","http://feedproxy.google.com/~r/businessinsider/~3/NkumFc1yVLc/paul-manafort-russia-ties-2017-10","en","False","politics and government, finances, united states politics and government, elections, ethics, frauds and swindling","18710","Business Insider","http://www.businessinsider.com","United States","","English","United States","Digital Native"
"763480063","2017-09-08 09:25:29","7 Dubious Things About Donald Trump Jr's Russia Testimony'","http://www.huffingtonpost.co.uk/2017/09/08/donald-trump-jrs-russia-testimony_n_17936776.html","en","False","politics and government, united states politics and government, armament, defense and military forces, terrorism, united states international relations, international relations","27502","Huffington Post","http://www.huffingtonpost.com/#","United States","","English","United States",""
"667396787","2017-07-11 00:00:00","THE EMAILS: Trump Jr. posts exchange that promised dirt on Clinton as 'part of Russia and its government's support for Mr. Trump'","http://www.businessinsider.com/donald-trump-jr-posted-rob-goldstone-emails-russia-2017-7","en","False","politics and government, united states politics and government, elections, presidents and presidency (us), presidential elections (us)","18710","Business Insider","http://www.businessinsider.com","United States","","English","United States","Digital Native"
"686495476","2017-09-07 12:03:32","Donald Trump Jr.: I met with the Russians to learn about Clinton's 'fitness' for office","http://feedproxy.google.com/~r/businessinsider/~3/2ONR0ObVvxI/donald-trump-jr-explains-why-he-met-with-russians-at-trump-tower-2017-9","en","False","politics and government, united states politics and government, elections","18710","Business Insider","http://www.businessinsider.com","United States","","English","United States","Digital Native"
"909159744","2017-08-01 00:00:00","Donald Trump Jr.'s meeting revelations: A timeline - CNNPolitics","https://www.cnn.com/2017/08/01/politics/timeline-donald-trump-jr-/index.html","en","False","politics and government, united states politics and government","1095","CNN","http://www.cnn.com/","United States","GA, USA","English","United States","Video Broadcast"
"747384813","2017-07-15 11:44:00","Another player in Trump Jr.'s meeting with a Kremlin-connected lawyer has been identified","http://www.businessinsider.com/anatoli-samachornov-in-trump-jr-meeting-with-kremlin-connected-lawyer-2017-7","en","False","politics and government, ethics","18710","Business Insider","http://www.businessinsider.com","United States","","English","United States","Digital Native"
"747415564","2017-07-11 11:43:38","Donald Trump Jr Releases Emails Proving Russia Was Supporting His Father | HuffPost UK","http://www.huffingtonpost.co.uk/entry/donald-trump-jr-emails_uk_5964eb36e4b09b587d62398b?utm_hp_ref=uk-donald-trump","en","False","politics and government, computers and the internet, united states politics and government, ethics","27502","Huffington Post","http://www.huffingtonpost.com/#","United States","","English","United States",""
"660576151","2017-07-20 11:53:22","Mueller has expanded the Russia probe to include Trump's business dealings — here's what he's looking at","http://feedproxy.google.com/~r/businessinsider/~3/HnHvfkec3qs/mueller-russia-investigation-trump-business-follow-money-2017-7","en","False","politics and government, finances, ethics, frauds and swindling","18710","Business Insider","http://www.businessinsider.com","United States","","English","United States","Digital Native"
"634956990","2017-05-17 10:32:18","Here’s A Closer Look At Donald Trump’s Disturbingly Deep Ties To Russia","http://fortune.com/2017/05/17/donald-trump-russia-2/","en","False","suits and litigation","1095","CNN","http://www.cnn.com/","United States","GA, USA","English","United States","Video Broadcast"
"681637571","2017-08-29 00:33:30","Mueller's team is reportedly examining Trump's role in drafting Trump Jr.'s statement on the Russia meeting","http://feedproxy.google.com/~r/businessinsider/~3/jDzNAYp3_RY/mueller-examines-trumps-role-in-responding-to-trump-jrs-russia-meeting-2017-8","en","False","politics and government, united states politics and government, news and news media, media","18710","Business Insider","http://www.businessinsider.com","United States","","English","United States","Digital Native"
"495879913","2016-08-01 08:55:08","The Daily 202: Koch summit showcases surprising theme: Income Inequality","https://www.washingtonpost.com/news/powerpost/paloma/daily-202/2016/08/01/daily-202-koch-summit-showcases-surprising-theme-income-inequality/579e9b0fcd249a787ffb126c/","en","False","politics and government, united states politics and government, presidents and presidency (us)","2","Washington Post","http://washingtonpost.com","United States","DC, USA","English","United States","Print Native"
"840612448","2018-03-05 00:00:00","Former Trump aide refusing Mueller subpoena: 'Screw that' - CNNPolitics","https://www.cnn.com/2018/03/05/politics/sam-nunberg-robert-mueller/index.html?sr=twCNN030518sam-nunberg-robert-mueller0338PMStory","en","False","politics and government, blacks, ethics","1095","CNN","http://www.cnn.com/","United States","GA, USA","English","United States","Video Broadcast"
"739660573","2017-12-07 15:58:46","Exclusive: Previously undisclosed emails show follow-up after Trump Tower meeting","http://rss.cnn.com/~r/rss/cnn_latest/~3/Fog2pWzQYZ4/index.html","en","False","politics and government, united states politics and government","1095","CNN","http://www.cnn.com/","United States","GA, USA","English","United States","Video Broadcast"
"939184821","2018-07-27 18:30:23","The Case for a Trump-Russia Conspiracy Just Got a Little Stronger","https://www.theatlantic.com/politics/archive/2018/07/trump-michael-cohen-trump-tower-meeting/566303/?utm_source=feed","en","False","politics and government, united states politics and government, elections, biographical information","1110","The Atlantic","http://www.theatlantic.com/","United States","","English","United States","Print Native"
"877637745","2018-05-17 15:23:43","Trump Jr. called a blocked number before and after the Trump Tower meeting. Whom did he call?","http://rss.cnn.com/~r/rss/cnn_latest/~3/_p42ONM892M/index.html","en","False","politics and government, united states politics and government, armament, defense and military forces, terrorism","1095","CNN","http://www.cnn.com/","United States","GA, USA","English","United States","Video Broadcast"
"659365618","2017-07-18 12:20:00","A California businessman born in former Soviet Union also attended Trump Jr. meeting","http://feeds.latimes.com/~r/latimes/sports/basketball/nba/~3/dn60DovZUjo/la-app-california-businessman-trump-jr-meeting-20170718-story.html","en","False","politics and government","6","LA Times","http://www.latimes.com/","United States","California, United States","English","United States","Print Native"
"755869933","2017-12-26 19:19:29","U.S. lawmakers question businessman at 2016 Trump Tower meeting: sources","http://feeds.reuters.com/~r/Reuters/PoliticsNews/~3/hYAM-SRSNyU/u-s-lawmakers-question-businessman-at-2016-trump-tower-meeting-sources-idUSKBN1EL009","en","False","politics and government, united states politics and government","4442","Reuters","http://www.reuters.com","United States","PA, USA","English","none","Other"
"999643539","2018-09-21 14:45:07","Documents Show Suspicious Transfers Began Six Days Before Infamous Meeting","https://www.buzzfeednews.com/article/anthonycormier/mueller-investigation-money-trump-tower-meeting","en","False","politics and government, finances, united states politics and government, elections, ethics","6218","Buzzfeed","http://www.buzzfeed.com","United States","","English","none","Digital Native"
"983662464","2018-09-12 13:51:29","A Series Of Suspicious Money Transfers Followed The Trump Tower Meeting","https://www.buzzfeednews.com/article/anthonycormier/trump-tower-meeting-suspicious-transactions-agalarov","en","False","politics and government, finances","6218","Buzzfeed","http://www.buzzfeed.com","United States","","English","none","Digital Native"
"1017586698","2018-09-21 00:00:00","How a British music publicist ended up in the middle of the Russia storm","https://www.washingtonpost.com/politics/how-a-british-music-publicist-ended-up-in-the-middle-of-the-russia-storm/2018/09/21/d1449a40-ba83-11e8-a8aa-860695e7f3fc_story.html?noredirect=on&utm_term=.2619f2a6bf25","en","False","politics and government, recordings (audio), crime and criminals","2","Washington Post","http://washingtonpost.com","United States","DC, USA","English","United States","Print Native"
"997771537","2017-12-29 00:00:00","Is Donald Trump’s dark Russian secret hiding in Deutsche Bank’s vaults?","https://www.newsweek.com/2017/12/29/donald-trump-russia-secret-deutsche-bank-753780.html","en","False","finances, suits and litigation, banks and banking, economic conditions and trends, credit","2","Washington Post","http://washingtonpost.com","United States","DC, USA","English","United States","Print Native"
"959483500","2018-08-21 03:00:05","Rudy Giuliani’s Pinocchio-laden interview on NBC’s ‘Meet the Press’","https://www.washingtonpost.com/politics/rudy-giulianis-pinocchio-laden-interview-on-nbcs-meet-the-press/2018/08/21/dbfbcc98-bb60-4e5e-9084-9d5232c735dc_story.html","en","False","politics and government","2","Washington Post","http://washingtonpost.com","United States","DC, USA","English","United States","Print Native"
"817682838","2018-03-08 14:48:37","Trump received a mysterious letter from Putin in 2013 — and no one knows what was in it","http://feedproxy.google.com/~r/businessinsider/~3/q095FJ-77Y0/trump-2013-letter-from-putin-2018-3","en","False","politics and government, books and literature, united states politics and government, news and news media, media, international relations","18710","Business Insider","http://www.businessinsider.com","United States","","English","United States","Digital Native"
"860806786","2018-04-27 19:57:10","Russians reached out to Trump team about Magnitsky Act sanctions after election, Democrats say","http://rss.cnn.com/~r/rss/cnn_latest/~3/G6IlVsOP8ec/index.html","en","False","politics and government, united states politics and government, united states international relations, international relations, freedom and human rights","1095","CNN","http://www.cnn.com/","United States","GA, USA","English","United States","Video Broadcast"
"708607589","2017-07-19 09:53:39","Trump Terrible 10 -- Made In China Edition | HuffPost","https://www.huffingtonpost.com/entry/trump-terrible-10-made-in-china-edition_us_596f641be4b07f87578e6d63","en","False","politics and government, editorials","27502","Huffington Post","http://www.huffingtonpost.com/#","United States","","English","United States",""
"912598213","2018-06-26 14:30:02","Russian pop star who arranged Trump Tower meeting makes music video about colluding with Trump","https://www.vox.com/2018/6/26/17506586/emin-agalarov-music-video-trump-russia","en","False","politics and government, recordings (audio), music","104828","Vox","http://www.vox.com","United States","","English","United States","Digital Native"
"656140258","2017-07-12 10:36:25","Trump Jr. Emails Prove Russia Collusion Story Is Even Dumber Than You Thought","http://dailycaller.com/2017/07/12/trump-jr-emails-prove-russia-collusion-story-is-even-dumber-than-you-thought/","en","False","politics and government, news and news media, media","18775","Daily Caller","http://dailycaller.com","United States","","English","United States","Digital Native"
"878152298","2018-05-18 05:45:06","A Comprehensive List Of Everything Don Jr. Doesn't Know About That Infamous Meeting","https://www.huffingtonpost.com/entry/everything-donald-trump-jr-doesnt-know-about-meeting_us_5afc5fd4e4b0779345d52258","en","False","politics and government, crime and criminals, biographical information","27502","Huffington Post","http://www.huffingtonpost.com/#","United States","","English","United States",""
"929568010","2018-07-16 16:26:00","Putin dismisses question about whether Russia has compromising information on Trump","https://www.washingtonpost.com/politics/putin-dismisses-question-about-whether-russia-has-compromising-information-on-trump/2018/07/16/19e29f90-8915-11e8-85ae-511bc1146b0b_story.html","en","False","politics and government, united states politics and government, elections, international relations","2","Washington Post","http://washingtonpost.com","United States","DC, USA","English","United States","Print Native"
"801294195","2018-02-18 12:20:53","Probers want to talk to the 8th person in the Trump-Russian meeting","https://www.nbcnews.com/news/us-news/amp/ike-kaveladze-named-eighth-person-trump-meeting-n784216","en","False","politics and government, united states politics and government, lobbying and lobbyists, ethics, international relations","25499","NBC News","http://www.nbcnews.com","United States","","English","United States",""
"861114567","2018-04-28 06:54:26","Week 49: Cohen Took a Bullet and Trump Fired It","https://www.politico.com/magazine/story/2018/04/28/trump-michael-cohen-aide-distance-218111","en","False","politics and government, finances, crime and criminals, ethics, frauds and swindling","18268","Politico","http://politico.com","United States","","English","United States","Print Native"
"657584778","2017-07-14 16:02:00","Russian pop singer's attorney attacks publicist in Trump Jr. email saga","http://feeds.foxnews.com/~r/foxnews/politics/~3/8aPEBVQ-eBU/russian-pop-singers-attorney-attacks-publicist-in-trump-jr-email-saga.html","en","False","politics and government, united states politics and government","1092","FOX News","http://www.foxnews.com/","United States","GA, USA","English","United States","Video Broadcast"
"763456040","2017-10-16 18:42:34","New memo suggests Russian lawyer at Trump Tower meeting was acting 'as an agent' of the Kremlin","http://www.businessinsider.com/veselnitskaya-memo-trump-tower-russia-meeting-2017-10","en","False","politics and government, taxation, frauds and swindling, freedom and human rights","18710","Business Insider","http://www.businessinsider.com","United States","","English","United States","Digital Native"
"877279258","2018-05-17 08:28:20","The Cybersecurity 202: Google wants to help political groups fight these cheap but disruptive cyberattacks","https://www.washingtonpost.com/news/powerpost/paloma/the-cybersecurity-202/2018/05/17/the-cybersecurity-202-google-wants-to-help-political-groups-fight-these-cheap-but-destructive-cyberattacks/5afc6e8830fb04258879954d/","en","False","politics and government, computers and the internet, united states politics and government, elections","2","Washington Post","http://washingtonpost.com","United States","DC, USA","English","United States","Print Native"
"885227487","2018-05-26 06:52:29","Week 53: Trump Goes Spy Hunting and Gets Skunked","https://www.politico.com/magazine/story/2018/05/26/swamp-diary-trump-spy-hunter-218545","en","False","politics and government, united states politics and government, armament, defense and military forces, news and news media, media, united states international relations, international relations","18268","Politico","http://politico.com","United States","","English","United States","Print Native"
"861942075","2018-04-29 14:47:53","Trump may have let something slip about the Russian lawyer from the Trump Tower meeting","http://feedproxy.google.com/~r/businessinsider/~3/OZXSQ6elazY/trump-rally-natalia-veselnitskaya-putin-trump-tower-meeting-2018-4","en","False","politics and government, united states politics and government","18710","Business Insider","http://www.businessinsider.com","United States","","English","United States","Digital Native"
"999066532","2018-05-01 00:00:00","Mueller dropped a bombshell in his list of questions for Trump in the Russia probe","https://www.businessinsider.com/mueller-questions-bombshell-manafort-collusion-trump-russia-investigation-2018-5","en","False","politics and government, united states politics and government, elections, crime and criminals, ethics","18710","Business Insider","http://www.businessinsider.com","United States","","English","United States","Digital Native"
"655273715","2017-07-10 22:36:55","Timeline of a story about Donald Trump Jr. and Russia that keeps getting worse","https://www.washingtonpost.com/news/the-fix/wp/2017/07/10/timeline-of-a-story-about-donald-trump-jr-and-russia-that-keeps-getting-worse/","en","False","politics and government, united states politics and government","2","Washington Post","http://washingtonpost.com","United States","DC, USA","English","United States","Print Native"
"543013034","2016-11-17 22:03:00","When Donald Trump brought Miss Universe to Moscow","http://www.politico.com/story/2016/05/donald-trump-russia-moscow-miss-universe-223173#ixzz4MdzlcVd1","en","False","politics and government, united states politics and government","18268","Politico","http://politico.com","United States","","English","United States","Print Native"
"687064747","2017-06-28 13:55:10","Russia Hacking timeline - How Obama handled Putin's election interference - Washington Post","https://www.washingtonpost.com/graphics/2017/world/national-security/russia-hacking-timeline/","en","False","politics and government, no index terms from nytimes, united states politics and government","2","Washington Post","http://washingtonpost.com","United States","DC, USA","English","United States","Print Native"
"659408891","2017-07-18 13:34:00","Eighth participant in Trump Tower meeting identified","http://feeds.foxnews.com/~r/foxnews/politics/~3/IrIDlUMovGI/eighth-participant-in-trump-tower-meeting-identified.html","en","False","politics and government","1092","FOX News","http://www.foxnews.com/","United States","GA, USA","English","United States","Video Broadcast"
"912676844","2018-06-26 16:34:00","Russian pop star linked to Trump family releases bizarre music video","https://www.nbcnews.com/politics/donald-trump/russian-pop-star-linked-trump-family-releases-bizarre-music-video-n886696?cid=public-rss_20180626","en","False","politics and government, recordings (audio), music","25499","NBC News","http://www.nbcnews.com","United States","","English","United States",""
"659793769","2017-07-19 07:21:21","The Daily 202: Teflon Trump gets blamed less by base for Obamacare fail than Senate GOP","https://www.washingtonpost.com/news/powerpost/paloma/daily-202/2017/07/19/daily-202-teflon-trump-gets-blamed-less-by-base-for-obamacare-fail-than-senate-gop/596e9f9c30fb04367954319f/","en","False","politics and government, united states politics and government, elections","2","Washington Post","http://washingtonpost.com","United States","DC, USA","English","United States","Print Native"
"957481663","2018-08-18 03:47:07.332599","CNN.com - Transcripts","http://transcripts.cnn.com/TRANSCRIPTS/1707/12/acd.01.html","en","False","politics and government, united states politics and government, television","1095","CNN","http://www.cnn.com/","United States","GA, USA","English","United States","Video Broadcast"
"738681443","2017-12-06 23:37:14","Trump Jr. Won&#x2019;t Provide Details of a Call With His Father","https://www.nytimes.com/2017/12/06/us/donald-trump-jr-intel-committee.html?partner=rss&emc=rss","en","False","politics and government, united states politics and government","1","New York Times","http://nytimes.com","United States","NY, USA","English","United States","Print Native"
"805618694","2017-07-11 00:00:00","Donald Trump Jr. was told campaign meeting would be with ‘Russian government attorney,’ according to emails","https://www.washingtonpost.com/politics/donald-trump-jr-was-told-campaign-meeting-would-be-with-russian-government-lawyer-according-to-emails/2017/07/11/70b957e2-664c-11e7-9928-22d00a47778f_story.html?utm_term=.88cbcc20bb74","en","False","politics and government, united states politics and government","2","Washington Post","http://washingtonpost.com","United States","DC, USA","English","United States","Print Native"
"1000398391","2018-09-22 08:00:00","How a British music publicist ended up in the middle of the Russia storm","https://www.washingtonpost.com/politics/how-a-british-music-publicist-ended-up-in-the-middle-of-the-russia-storm/2018/09/21/d1449a40-ba83-11e8-a8aa-860695e7f3fc_story.html","en","False","politics and government, united states politics and government","2","Washington Post","http://washingtonpost.com","United States","DC, USA","English","United States","Print Native"
"661598744","2017-07-22 05:11:25","The man who drives Trump’s Russia connection","https://www.washingtonpost.com/world/europe/the-man-who-drives-trumps-russia-connection/2017/07/21/43485a0e-6c98-11e7-abbc-a53480672286_story.html","en","False","politics and government, united states politics and government, lobbying and lobbyists","2","Washington Post","http://washingtonpost.com","United States","DC, USA","English","United States","Print Native"
"1000715748","2018-09-22 22:42:09.139134","CNN.com - Transcripts","http://transcripts.cnn.com/TRANSCRIPTS/1803/17/smer.01.html","en","False","politics and government, computers and the internet","1095","CNN","http://www.cnn.com/","United States","GA, USA","English","United States","Video Broadcast"
"876636201","2018-05-16 15:15:34","As the plot thickens, President Trump is running out of excuses","http://www.washingtonpost.com/blogs/right-turn/wp/2018/05/16/as-the-plot-thickens-president-trump-is-running-out-of-excuses/","en","False","politics and government, united states politics and government, lobbying and lobbyists, armament, defense and military forces, united states international relations, international relations, biographical information","2","Washington Post","http://washingtonpost.com","United States","DC, USA","English","United States","Print Native"
"866930560","2018-05-05 06:51:57","Week 50: Rudy Steps In It and Trump Makes Him Squirm","https://www.politico.com/magazine/story/2018/05/05/swamp-diary-giuliani-trump-218321","en","False","politics and government, news and news media","18268","Politico","http://politico.com","United States","","English","United States","Print Native"
"655551455","2017-07-11 10:39:19","What happened and when: The timeline leading up to Donald Trump Jr.'s fateful meeting","https://www.washingtonpost.com/news/politics/wp/2017/07/11/what-happened-and-when-the-timeline-leading-up-to-donald-trump-jr-s-fateful-meeting/","en","False","politics and government","2","Washington Post","http://washingtonpost.com","United States","DC, USA","English","United States","Print Native"
"1018911880","2018-10-09 07:06:34.937050","Rob Goldstone wishes he'd never set up that Trump Tower meeting with the Russians","https://www.nbcnews.com/politics/national-security/rob-goldstone-wishes-he-d-never-set-trump-tower-meeting-n911851","en","False","politics and government, united states politics and government, armament, defense and military forces, television, news and news media, media, international relations","25499","NBC News","http://www.nbcnews.com","United States","","English","United States",""
