stories_id,publish_date,title,url,language,ap_syndicated,themes,media_id,media_name,media_url,media_pub_country,media_pub_state,media_language,media_about_country,media_media_type
"717368081","2017-10-31 20:33:32","House Panel to Interview Russian Who Was at Trump Tower Meeting","https://www.bloomberg.com/news/articles/2017-11-01/house-panel-to-interview-russian-who-was-at-trump-tower-meeting","en","False","politics and government, united states politics and government, armament, defense and military forces, united states international relations, international relations","40944","Bloomberg","http://bloomberg.com","United States","","English","United States","Digital Native"
"774418864","2018-01-18 17:37:45","Fusion GPS interview with House panel leaves huge pile of breadcrumbs for Trump-Russia investigators","http://feedproxy.google.com/~r/businessinsider/~3/QIlqGhsG2-Y/read-fusion-gps-glenn-simpson-interview-with-house-intelligence-committee-2018-1","en","False","politics and government, united states politics and government, crime and criminals, ethics","18710","Business Insider","http://www.businessinsider.com","United States","","English","United States","Digital Native"
"494924371","2016-07-29 06:28:11","Here’s what we know about Donald Trump and his ties to Russia","https://www.washingtonpost.com/politics/heres-what-we-know-about-donald-trump-and-his-ties-to-russia/2016/07/29/1268b5ec-54e7-11e6-88eb-7dda4e2f2aec_story.html","en","False","politics and government, finances, united states politics and government, elections, taxation","2","Washington Post","http://washingtonpost.com","United States","DC, USA","English","United States","Print Native"
"607536882","2016-10-23 16:42:00","Putin’s Long Shadow in U.S. Campaign Fuels New Red Scare","https://www.bloomberg.com/news/articles/2016-10-23/putin-s-long-shadow-in-u-s-campaign-fuels-new-red-scare","en","False","politics and government, united states politics and government, elections, presidents and presidency (us), presidential elections (us), editorials, election issues, immigration and refugees","40944","Bloomberg","http://bloomberg.com","United States","","English","United States","Digital Native"
"603852488","2016-05-03 04:00:00","Trump says he has ‘nothing to do with Russia.’ The past 30 years show otherwise.","https://www.washingtonpost.com/politics/trump-says-he-has-nothing-to-do-with-russia-thirty-years-of-history-shows-otherwise/2017/01/11/b7f20c5a-d829-11e6-b8b2-cb5164beba6b_story.html?tid=pm_politics_pop&utm_term=.530c1aa703aa","en","False","politics and government, finances, elections","2","Washington Post","http://washingtonpost.com","United States","DC, USA","English","United States","Print Native"
"685258765","2017-08-01 08:00:00","Donald Trump Jr. Russia meeting - Washington Post","https://www.washingtonpost.com/graphics/2017/politics/russia-meeting/?utm_term=.7ded883b6fa9","en","False","politics and government, finances","2","Washington Post","http://washingtonpost.com","United States","DC, USA","English","United States","Print Native"
"722845733","2017-11-09 19:06:23","Former security chief says he rejected offer of women for Trump during Moscow trip","https://www.washingtonpost.com/politics/former-security-chief-says-he-rejected-offer-of-women-for-trump-during-moscow-trip/2017/11/09/55531270-c585-11e7-aae0-cb18a8c29c65_story.html","en","False","politics and government, united states politics and government, prostitution","2","Washington Post","http://washingtonpost.com","United States","DC, USA","English","United States","Print Native"
"659440191","2017-07-18 15:26:00","Eighth man at Trump Tower meeting was the focus of a Congressional probe of Russian money laundering in 2000","http://feeds.latimes.com/~r/latimes/entertainment/news/music/~3/-TrYw6wj09E/la-na-essential-washington-updates-eighth-man-at-trump-tower-meeting-also-1500404743-htmlstory.html","en","False","politics and government, finances, crime and criminals, ethics, international relations, banks and banking, frauds and swindling","6","LA Times","http://www.latimes.com/","United States","California, United States","English","United States","Print Native"
"659439587","2017-07-18 15:08:26","What you should know about Ike Kaveladze from Trump Tower meeting","http://feeds.nydailynews.com/~r/NydnRss/~3/GHcxdxs_7pM/ike-kaveladze-trump-tower-meeting-article-1.3335851","en","False","politics and government","8","Daily News","http://www.nydailynews.com/","United States","NY, USA","English","United States","Print Native"
"659393327","2017-07-18 13:04:54","Here Is The 8th Person Who Was At Trump Jr.’s Meeting With Russians","http://www.huffingtonpost.com/entry/eighth-person-donald-trump-jr-meeting_us_596e3648e4b0e983c05949fb?ncid=inblnkushpmg00000009","en","False","politics and government, ethics","27502","Huffington Post","http://www.huffingtonpost.com/#","United States","","English","United States",""
"693809614","2017-07-18 00:00:00","The 8 people who were in the room when Donald Trump Jr. met with the Russian lawyer to get dirt on Clinton","http://www.businessinsider.com/who-else-was-in-the-room-when-trump-jr-met-with-the-russian-lawyer-2017-7#/#4-jared-kushner-trumps-senior-adviser-and-son-in-law-4","en","False","politics and government, united states politics and government, elections, lobbying and lobbyists","18710","Business Insider","http://www.businessinsider.com","United States","","English","United States","Digital Native"
"670067248","2017-07-10 00:00:00","Trump once made a cameo in a music video for the Russian pop star at the center of the Donald Trump Jr. controversy","http://www.businessinsider.com/trump-emin-agalarov-russia-music-video-2017-7#comments","en","False","recordings (audio), music","18710","Business Insider","http://www.businessinsider.com","United States","","English","United States","Digital Native"
"715426232","2017-07-14 20:58:28","Gorelick Steps Back, But Her Task Remains Troubling | HuffPost","https://www.huffingtonpost.com/entry/gorelick-steps-back-but-her-task-remains-troubling_us_5969684ae4b06a2c8edb468e","en","False","politics and government, law and legislation, united states politics and government, ethics, legal profession","27502","Huffington Post","http://www.huffingtonpost.com/#","United States","","English","United States",""
"907633371","2018-06-21 05:00:00","I 15 miliardari russi che si stanno arricchendo grazie ai Mondiali 2018","https://www.forbes.com/sites/it/2018/06/21/i-15-miliardari-russi-mondiali-2018/","it","False","","1104","Forbes","http://www.forbes.com/","United States","","English","United States","Print Native"
"655797579","2017-07-11 20:25:00","The Russians at the Center of the Donald Trump, Jr., E-mails","http://www.newyorker.com/news/news-desk/the-russians-at-the-center-of-the-donald-trump-jr-e-mails","en","False","politics and government","1101","New Yorker","http://www.newyorker.com/","United States","","English","United States","Print Native"
"577441186","2016-01-18 14:40:43","Inside Trump’s financial ties to Russia and his unusual flattery of Vladimir Putin","https://www.washingtonpost.com/politics/inside-trumps-financial-ties-to-russia-and-his-unusual-flattery-of-vladimir-putin/2016/06/17/dbdcaac8-31a6-11e6-8ff7-7b6c1998b7a0_story.html?utm_term=.3cb5c7051e73","en","False","politics and government, finances, biographical information","2","Washington Post","http://washingtonpost.com","United States","DC, USA","English","United States","Print Native"
"577428826","2016-01-18 19:40:43","Trump says he has ‘nothing to do with Russia.’ The past 30 years show otherwise.","https://www.washingtonpost.com/politics/trump-says-he-has-nothing-to-do-with-russia-thirty-years-of-history-shows-otherwise/2017/01/11/b7f20c5a-d829-11e6-b8b2-cb5164beba6b_story.html?utm_term=.9ae99fcbcc57","en","False","politics and government, finances, elections","2","Washington Post","http://washingtonpost.com","United States","DC, USA","English","United States","Print Native"
"912683071","2018-06-26 16:35:35","Hold Onto Your Butts (Maybe): Report Says Mueller Wants to Conclude Trump-Russia Collusion Probe “by Fall”","https://slate.com/news-and-politics/2018/06/report-mueller-collusion-results-by-fall.html","en","False","politics and government, crime and criminals, ethics","19643","Slate.com","http://www.slate.com","United States","","English","United States","Digital Native"
"914596056","2018-06-27 12:30:00","Russian pop singer linked to Trump says music video was &apos;satire&apos;","https://www.yahoo.com/news/russian-pop-singer-linked-trump-says-music-video-satire-163000893.html","en","False","recordings (audio), news and news media, music","751082","Yahoo News - Latest News & Headlines","https://www.yahoo.com/news/","","","","",""
"915192679","2016-03-01 00:00:00","The Full List Of Every American Billionaire 2016","https://www.forbes.com/sites/chasewithorn/2016/03/01/the-full-list-of-every-american-billionaire-2016/","en","False","finances","1104","Forbes","http://www.forbes.com/","United States","","English","United States","Print Native"
"494805429","2016-07-28 21:13:33","Donald Trump and Vladimir Putin tried to meet in 2013","http://www.nydailynews.com/news/national/donald-trump-vladimir-putin-meet-2013-article-1.2730352","en","False","politics and government, television, biographical information","8","Daily News","http://www.nydailynews.com/","United States","NY, USA","English","United States","Print Native"
"582475632","2017-02-17 10:16:05","One Press Conference, Two Audiences","https://www.theatlantic.com/politics/archive/2017/02/break-on-through-to-the-other-side/517098/?utm_source=feed","en","False","politics and government, united states politics and government, elections, presidents and presidency (us), presidential elections (us), news and news media, election issues, presidential election of 2004","1110","The Atlantic","http://www.theatlantic.com/","United States","","English","United States","Print Native"
"694572923","2017-09-22 14:34:35","Donald Trump, Jr.,’s Love for Russian Dirt","https://www.newyorker.com/news/amy-davidson/donald-trump-jrs-love-for-russian-dirt?mbid=social_twitter","en","False","politics and government, law and legislation, united states politics and government, elections, presidents and presidency (us), presidential elections (us), gun control, presidential election of 2004, biographical information, conventions, national (us), conventions and conferences","1101","New Yorker","http://www.newyorker.com/","United States","","English","United States","Print Native"
"872699005","2017-07-18 13:07:01","Playbook Power Briefing: Senate GOP health care ‘Plan B’ on verge of failure","https://www.politico.com/tipsheets/playbook-power-briefing/2017/07/18/senate-gop-health-care-plan-b-on-verge-of-failure-eighth-person-in-don-jr-meeting-identified-business-down-at-some-trump-properties-rachel-whetstone-to-facebook-221394","en","False","politics and government","18268","Politico","http://politico.com","United States","","English","United States","Print Native"
"934058353","2017-07-11 21:50:39","Meet The Billionaire Russian Family At The Center Of The Trump-Russia Controversy","https://www.forbes.com/sites/danalexander/2017/07/11/meet-the-billionaire-russian-family-at-the-center-of-the-trump-russia-controversy/#1809cc6c1e4a","en","False","quotation of the day","1104","Forbes","http://www.forbes.com/","United States","","English","United States","Print Native"
"934367532","2017-07-15 00:00:00","The email exchange Trump Jr. released, in chronological order","http://www.cnn.com/interactive/2017/07/politics/donald-trump-jr-full-emails/?iid=EL","en","False","finances, biographical information","1095","CNN","http://www.cnn.com/","United States","GA, USA","English","United States","Video Broadcast"
"660027070","2017-07-19 08:00:33","Tax reform state of play","http://www.politico.com/tipsheets/morning-money/2017/07/19/tax-reform-state-of-play-221402","en","False","politics and government, finances, taxation","18268","Politico","http://politico.com","United States","","English","United States","Print Native"
"940223395","2018-07-27 18:35:08","What We Know About the Controversial 2016 Trump Tower Meeting With Russian Officials","https://www.yahoo.com/news/know-controversial-2016-trump-tower-223508036.html","en","False","politics and government, united states politics and government, biographical information","751082","Yahoo News - Latest News & Headlines","https://www.yahoo.com/news/","","","","",""
"660708668","2017-07-20 12:28:14","Trump Accuses Comey of Attempting to Leverage ‘Peeing Russia Prostitutes’ Dossier","http://feedproxy.google.com/~r/breitbart/~3/sD4GOFe_sAE/","en","False","politics and government, united states politics and government, armament, defense and military forces, news and news media, crime and criminals, international relations, biographical information, espionage","19334","Breitbart","http://www.breitbart.com","United States","","English","United States","Digital Native"
"670476435","2017-07-11 08:00:00","Analysis | Who’s who in the stunning Russia-conspiracy emails released by Donald Trump Jr.","https://www.washingtonpost.com/news/politics/wp/2017/07/11/whos-who-in-the-stunning-russia-conspiracy-emails-released-by-donald-trump-jr/?utm_term=.5e7c92c56f43","en","True","","2","Washington Post","http://washingtonpost.com","United States","DC, USA","English","United States","Print Native"
"604205008","2016-05-03 04:00:00","Trump’s claim that ‘I have nothing to do with Russia’","https://www.washingtonpost.com/news/fact-checker/wp/2016/07/27/trumps-claim-that-i-have-nothing-to-do-with-russia/?tid=a_inl&utm_term=.10f515c6d500","en","False","politics and government, finances, united states politics and government, elections, presidents and presidency (us)","2","Washington Post","http://washingtonpost.com","United States","DC, USA","English","United States","Print Native"
"655648020","2017-07-11 13:28:24","Donald Trump, Jr.,’s Love for Russian Dirt","http://www.newyorker.com/news/amy-davidson/donald-trump-jrs-love-for-russian-dirt","en","False","politics and government, law and legislation, united states politics and government, elections, presidents and presidency (us), presidential elections (us), gun control, presidential election of 2004, biographical information, conventions, national (us), conventions and conferences","1101","New Yorker","http://www.newyorker.com/","United States","","English","United States","Print Native"
"494306678","2016-07-27 16:26:28","Trump's claim that 'I have nothing to do with Russia'","https://www.washingtonpost.com/news/fact-checker/wp/2016/07/27/trumps-claim-that-i-have-nothing-to-do-with-russia/","en","False","politics and government, computers and the internet, finances, united states politics and government","2","Washington Post","http://washingtonpost.com","United States","DC, USA","English","United States","Print Native"
"946076732","2017-11-09 00:00:00","Former security chief says he rejected offer of women for Trump during Moscow trip","https://www.washingtonpost.com/politics/former-security-chief-says-he-rejected-offer-of-women-for-trump-during-moscow-trip/2017/11/09/55531270-c585-11e7-aae0-cb18a8c29c65_story.html?utm_term=.a860fc17a461","en","False","politics and government, women","2","Washington Post","http://washingtonpost.com","United States","DC, USA","English","United States","Print Native"
"947654323","2017-12-27 00:19:29","U.S. lawmakers question businessman at 2016 Trump Tower meeting:.","https://www.reuters.com/article/us-usa-trump-russia-kaveladze/u-s-lawmakers-question-businessman-at-2016-trump-tower-meeting-sources-idUSKBN1EL009?feedType=RSS&amp;feedName=politicsNews&amp;utm_source=Twitter&amp;utm_medium=Social","en","False","","4442","Reuters","http://www.reuters.com","United States","PA, USA","English","none","Other"
"659408894","2017-07-18 13:26:00","Least surprising failure ever","http://feeds.foxnews.com/~r/foxnews/politics/~3/ej_O7Sm7-gc/least-surprising-failure-ever.html","en","False","politics and government, law and legislation, finances, united states politics and government","1092","FOX News","http://www.foxnews.com/","United States","GA, USA","English","United States","Video Broadcast"
"660000914","2017-07-19 14:00:57","With Trump and Russia, it's all about the money","https://www.washingtonpost.com/blogs/plum-line/wp/2017/07/19/with-trump-and-russia-its-all-about-the-money/","en","False","politics and government, finances, ethics","2","Washington Post","http://washingtonpost.com","United States","DC, USA","English","United States","Print Native"
"494222094","2016-07-27 11:58:55","The Trump-Russia-money question, in 24 steps","https://www.washingtonpost.com/news/the-fix/wp/2016/07/27/the-trump-russia-money-question-in-24-steps/","en","False","politics and government, finances, united states politics and government, elections, presidents and presidency (us), presidential elections (us), primaries, news and news media, media, presidential election of 2004, biographical information","2","Washington Post","http://washingtonpost.com","United States","DC, USA","English","United States","Print Native"
"694437725","2017-09-22 10:31:42","Will Robert Mueller Explore Trump’s Russian Business Ties?","https://www.newyorker.com/business/adam-davidson/will-robert-mueller-explore-trumps-russia-business-ties?mbid=social_twitter","en","False","politics and government, armament, defense and military forces, crime and criminals, ethics, frauds and swindling","1101","New Yorker","http://www.newyorker.com/","United States","","English","United States","Print Native"
"746209434","2017-05-30 08:00:00","Analysis | Timeline: What we know about Trump’s campaign, Russia and the investigation of the two","https://www.washingtonpost.com/news/politics/wp/2017/05/30/timeline-what-we-know-about-trumps-campaign-russia-and-the-investigation-of-the-two/?update&utm_term=.14801bbb1b7a","en","True","politics and government, united states politics and government, elections","2","Washington Post","http://washingtonpost.com","United States","DC, USA","English","United States","Print Native"
"798162689","2017-07-11 15:05:21","Russian Dirt on Clinton? ‘I Love It,’ Donald Trump Jr. Said","https://www.nytimes.com/2017/07/11/us/politics/trump-russia-email-clinton.html?smid=tw-nytpolitics&smtyp=cur","en","False","politics and government, recordings (audio)","1","New York Times","http://nytimes.com","United States","NY, USA","English","United States","Print Native"
"691977485","2017-07-18 08:00:00","8th person at Trump Tower meeting identified","https://amp.cnn.com/cnn/2017/07/18/politics/eighth-man-trump-tower-meeting-russia/index.html","en","False","","1095","CNN","http://www.cnn.com/","United States","GA, USA","English","United States","Video Broadcast"
"658652742","2017-07-17 06:15:07","Republican Party, Wimbledon, &#x2018;Game of Thrones&#x2019;: Your Monday Briefing","https://www.nytimes.com/2017/07/17/briefing/republican-party-wimbledon-game-of-thrones.html?partner=rss&emc=rss","en","False","politics and government, united states politics and government","1","New York Times","http://nytimes.com","United States","NY, USA","English","United States","Print Native"
"568195061","2017-01-17 03:59:44","Morning Agenda: Inequality at Davos, Trump and Russia, Women in Governance","http://www.nytimes.com/2017/01/17/business/dealbook/world-economic-forum-davos-inequality-trump.html?partner=rss&emc=rss","en","False","politics and government, finances, economic conditions and trends","1","New York Times","http://nytimes.com","United States","NY, USA","English","United States","Print Native"
"699108707","2017-07-12 10:10:00","The Full Exclusive Interview: Emin Agalarov, Russian Scion At Center Of Trump Controversy","https://www.forbes.com/sites/noahkirsch/2017/07/12/the-full-exclusive-interview-emin-agalarov-russian-donald-trump-jr-controversy/#71c3f1ba69d0","en","False","","1104","Forbes","http://www.forbes.com/","United States","","English","United States","Print Native"
"692275118","2017-09-18 21:13:30","Analysis: Paul Manafort Wiretapping Raises New Questions About ‘Peeing Russian Prostitutes’ Dossier","http://feedproxy.google.com/~r/breitbart/~3/TIB5Umd0oiA/","en","False","politics and government, united states politics and government, elections, ethics","19334","Breitbart","http://www.breitbart.com","United States","","English","United States","Digital Native"
"670447234","2017-07-14 00:00:00","A Soviet military officer turned lobbyist attended the Trump Jr. meeting — and there may have been a 6th person, too","http://www.businessinsider.com/donald-trump-jr-meeting-natalia-veselnitskaya-rinat-akhmetshin-2017-7#comments","en","False","politics and government, united states politics and government, lobbying and lobbyists, armament, defense and military forces, united states international relations, international relations","18710","Business Insider","http://www.businessinsider.com","United States","","English","United States","Digital Native"
"657581440","2017-07-14 16:45:00","Is Trump's Russian Pal Emin Agalarov Really An International Pop Star?","http://www.forbes.com/sites/zackomalleygreenburg/2017/07/14/is-trump-pal-emin-agalarov-really-an-international-pop-star/","en","True","politics and government","1104","Forbes","http://www.forbes.com/","United States","","English","United States","Print Native"
"656672950","2017-07-12 18:38:24","America Relieved It Didn't Elect The Reckless Email Candidate","http://www.huffingtonpost.com/entry/america-relieved-it-didnt-elect-the-reckless-email-candidate_us_5966a368e4b0a0c6f1e5c650?section=us_politics","en","False","politics and government, united states politics and government, elections, appointments and executive changes","27502","Huffington Post","http://www.huffingtonpost.com/#","United States","","English","United States",""
"659394228","2017-07-18 13:40:01","Robert Mueller is now the ninth person in Donald Trump Jr.'s Russia meeting","https://www.washingtonpost.com/news/the-fix/wp/2017/07/18/robert-mueller-is-now-the-ninth-person-in-donald-trump-jr-s-russia-meeting/","en","False","politics and government, united states politics and government","2","Washington Post","http://washingtonpost.com","United States","DC, USA","English","United States","Print Native"
"655228264","2017-07-10 19:11:12","How Trump ended up in a 2013 Europop video connected to the latest Russia controversy","https://www.washingtonpost.com/news/arts-and-entertainment/wp/2017/07/10/how-trump-ended-up-in-a-2013-europop-video-connected-to-the-latest-russia-controversy/","en","False","politics and government, recordings (audio), television, music, biographical information","2","Washington Post","http://washingtonpost.com","United States","DC, USA","English","United States","Print Native"
"721679840","2016-05-15 07:45:00","When Donald Trump brought Miss Universe to Moscow","https://www.politico.com/story/2016/05/donald-trump-russia-moscow-miss-universe-223173","en","False","apparel, contests and prizes","18268","Politico","http://politico.com","United States","","English","United States","Print Native"
"961104158","2017-07-12 14:05:31","Meet Aras Agalarov, The Russian Developer Connecting The Trumps And Putin","https://www.forbes.com/sites/bisnow/2017/07/12/meet-aras-agalarov-the-russian-developer-connecting-the-trumps-and-putin/3/#5decf6f46cca","en","False","","1104","Forbes","http://www.forbes.com/","United States","","English","United States","Print Native"
"961117671","2017-07-10 20:48:20","The Story Behind The Trump Team-Russian Lawyer Meeting Is Like A Bad Movie Script | HuffPost","https://www.huffingtonpost.com/entry/trump-team-russian-lawyer-meeting-bad-script_us_5963df40e4b03f144e2cfe27?ncid=tweetlnkushpmg00000016&section=politics","en","False","","27502","Huffington Post","http://www.huffingtonpost.com/#","United States","","English","United States",""
"661069316","2017-03-20 08:00:00","Exclusive: Powerful Russian Partner Boasts Of Ongoing Access To Trump Family","https://www.forbes.com/sites/noahkirsch/2017/03/20/russian-billionaire-family-trump-ties-ongoing/#2d97ceb469b3","en","False","politics and government","1104","Forbes","http://www.forbes.com/","United States","","English","United States","Print Native"
"747371358","2016-05-03 08:00:00","Trump and the oligarch","http://www.politico.eu/article/donad-trump-and-the-oligarch-russia-dmitry-rybolovlev-house-vladimir-putin-us-presidential-election-america-2016/","en","False","finances, travel and vacations, housing","18268","Politico","http://politico.com","United States","","English","United States","Print Native"
"659432168","2017-07-18 14:59:41","Eighth man in Trump Tower meeting was linked to money laundering","http://www.politico.com/story/2017/07/18/irakly-kaveladze-trump-tower-russia-eighth-man-240679","en","False","politics and government, united states politics and government, news and news media, media, ethics","18268","Politico","http://politico.com","United States","","English","United States","Print Native"
"693430936","2017-09-01 00:00:00","Manafort's notes from Russian meeting refer to political contributions","https://www.nbcnews.com/news/us-news/amp/manafort-notes-russian-meet-contain-cryptic-reference-donations-n797816","en","False","politics and government, united states politics and government, elections, armament, defense and military forces, united states international relations, international relations","25499","NBC News","http://www.nbcnews.com","United States","","English","United States",""
