stories_id,publish_date,title,url,language,ap_syndicated,themes,media_id,media_name,media_url,media_pub_country,media_pub_state,media_language,media_about_country,media_media_type
"537294540","2016-07-27 13:53:36","The controversy over Donald Trump's ties to Russia, explained","http://www.vox.com/2016/7/27/12271042/donald-trump-russia-putin-hack-explained?utm_medium=email&utm_campaign=81516%20Vox%20Sentences&utm_content=81516%20Vox%20Sentences+CID_3fcacf5270a09861fba5ef5745e055c7&utm_source=cm_email&utm_term=Vox%20%20Zack%20Beauchamp","en","False","politics and government, computers and the internet, united states politics and government, elections, international relations, espionage","104828","Vox","http://www.vox.com","United States","","English","United States","Digital Native"
"540443305","2016-07-27 13:59:00","Trump urges Russia to hack Clinton's email","http://www.politico.com/story/2016/07/trump-putin-no-relationship-226282#ixzz4FdGjV8nf","en","False","politics and government, computers and the internet, united states politics and government, elections, presidents and presidency (us), presidential elections (us), election issues, united states international relations, international relations, espionage","18268","Politico","http://politico.com","United States","","English","United States","Print Native"
"548358198","2016-07-07 08:00:00","Trump’s Russia adviser criticizes U.S. for ‘hypocritical focus on democratization’","https://www.washingtonpost.com/world/europe/trumps-russia-adviser-criticizes-us-for-hypocritical-focus-on-democratization/2016/07/07/804a3d60-4380-11e6-a76d-3550dba926ac_story.html?postshare=2511467931527039&tid=ss_tw","en","False","politics and government, no index terms from nytimes, united states politics and government, elections, ethics, united states international relations, international relations","2","Washington Post","http://washingtonpost.com","United States","DC, USA","English","United States","Print Native"
"466998460","2016-05-15 07:45:58","When Donald Trump brought Miss Universe to Moscow","http://www.politico.com/story/2016/05/donald-trump-russia-moscow-miss-universe-223173","en","False","politics and government, united states politics and government","18268","Politico","http://politico.com","United States","","English","United States","Print Native"
"550261364","2016-08-07 08:00:00","Russians: Trump more 'fun' than Clinton and would improve U.S.-Russia ties","http://www.usatoday.com/story/news/world/2016/08/07/russians-trump-more-fun-than-clinton-and-would-improve-us-russia-ties/88363710/?utm_source=dlvr.it&utm_medium=twitter","en","False","politics and government, united states politics and government, elections, presidents and presidency (us), public opinion, united states international relations, international relations, international trade and world market","64866","USAToday","http://usatoday.com/","United States","Ohio, United States","English","United States","Print Native"
"431225713","2016-03-03 11:19:00","Richest People In Europe","http://www.forbes.com/sites/denizcam/2016/03/03/richest-people-in-europe/","en","False","finances, oil (petroleum) and gasoline, economic conditions and trends","1104","Forbes","http://www.forbes.com/","United States","","English","United States","Print Native"
"486849210","2016-07-07 16:53:47","Trump’s Russia adviser criticizes U.S. for ‘hypocritical focus on democratization’","https://www.washingtonpost.com/world/europe/trumps-russia-adviser-criticizes-us-for-hypocritical-focus-on-democratization/2016/07/07/804a3d60-4380-11e6-a76d-3550dba926ac_story.html","en","False","politics and government, no index terms from nytimes, united states politics and government, elections, ethics, united states international relations, international relations","2","Washington Post","http://washingtonpost.com","United States","DC, USA","English","United States","Print Native"
"589661980","2016-05-15 07:45:00","When Donald Trump brought Miss Universe to Moscow","http://www.politico.com/story/2016/05/donald-trump-russia-moscow-miss-universe-223173#ixzz48l9TN9LE","en","False","politics and government, united states politics and government","18268","Politico","http://politico.com","United States","","English","United States","Print Native"
"600933558","2017-03-29 09:15:00","Russian Billionaires, Including Several Tied To Putin, Are Up $104 Billion In The Last Year","http://www.forbes.com/sites/danalexander/2017/03/29/putin-vladimir-donald-trump-russia-billionaires-oligarchs/","en","False","politics and government, finances, economic conditions and trends","1104","Forbes","http://www.forbes.com/","United States","","English","United States","Print Native"
"599865488","2016-02-08 21:00:00","Inside Trump’s financial ties to Russia and his unusual flattery of Vladimir Putin","https://www.washingtonpost.com/politics/inside-trumps-financial-ties-to-russia-and-his-unusual-flattery-of-vladimir-putin/2016/06/17/dbdcaac8-31a6-11e6-8ff7-7b6c1998b7a0_story.html?utm_term=.9880c4c26cb8","en","False","finances, biographical information, contests and prizes","2","Washington Post","http://washingtonpost.com","United States","DC, USA","English","United States","Print Native"
"577441147","2016-01-18 14:40:43","Inside Trump’s financial ties to Russia and his unusual flattery of Vladimir Putin","https://www.washingtonpost.com/politics/inside-trumps-financial-ties-to-russia-and-his-unusual-flattery-of-vladimir-putin/2016/06/17/dbdcaac8-31a6-11e6-8ff7-7b6c1998b7a0_story.html?tid=a_inl&utm_term=.c5dc451cea01","en","False","finances, biographical information, contests and prizes","2","Washington Post","http://washingtonpost.com","United States","DC, USA","English","United States","Print Native"
"626544596","2017-05-17 10:32:18","Here’s A Closer Look At Donald Trump’s Disturbingly Deep Ties To Russia","https://finance.yahoo.com/news/closer-look-donald-trump-disturbingly-143218628.html","en","False","suits and litigation","18840","finance.yahoo.com","http://finance.yahoo.com","United States","","English","United States","Digital Native"
"636653572","2016-03-01 09:43:00","The Full List Of Every American Billionaire 2016","http://www.forbes.com/sites/chasewithorn/2016/03/01/the-full-list-of-every-american-billionaire-2016/","en","False","finances, oil (petroleum) and gasoline, international trade and world market, economic conditions and trends","1104","Forbes","http://www.forbes.com/","United States","","English","United States","Print Native"
"655615135","2017-07-11 12:35:48","Email to Trump Jr. Says Clinton Info Was Part of Moscow's Trump Support","https://www.wsj.com/articles/donald-trump-jr-releases-emails-on-setting-up-meeting-with-russian-lawyer-1499786937?mod=rss_US_News","en","False","politics and government, united states politics and government, biographical information","1150","Wall Street Journal","http://online.wsj.com/","United States","New York, United States","English","United States","Print Native"
"655621228","2017-07-11 12:48:26","Capitol Report: Trump Jr. emails show how Russia’s government communicated to president’s campaign","http://www.marketwatch.com/news/story.asp?guid=%7B16AE045E-6652-11E7-A176-5A2FCB9C892E%7D&siteid=rss&rss=1","en","False","politics and government, united states politics and government, elections","1150","Wall Street Journal","http://online.wsj.com/","United States","New York, United States","English","United States","Print Native"
"655682380","2017-07-11 14:38:44","Don Trump Jr.’s Emails Are the Smoking Gun","http://www.slate.com/articles/news_and_politics/politics/2017/07/don_trump_jr_s_emails_are_the_smoking_gun.html","en","False","computers and the internet","19643","Slate.com","http://www.slate.com","United States","","English","United States","Digital Native"
"655744060","2017-07-11 18:05:27","Email to Trump Jr. Says Clinton Info Was Part of Moscow's Trump Support","https://www.wsj.com/articles/donald-trump-jr-releases-emails-on-setting-up-meeting-with-russian-lawyer-1499786937?mod=fox_australian","en","False","politics and government, united states politics and government, elections","18839","blogs.wsj.com","http://blogs.wsj.com","United States","","English","United States","Print Native"
"655922043","2017-07-12 02:18:13","Emails Show Trump Jr. Embraced Help Said to Be from the Kremlin","http://feedproxy.google.com/~r/timeblogs/swampland/~3/jG8mMyMepGw/","en","True","politics and government, united states politics and government, elections, presidents and presidency (us), ethics","4419","Time","http://time.com","United States","","English","United States",""
"656126176","2017-07-12 10:05:00","Meet Aras Agalarov, The Russian Developer Connecting The Trumps And Putin","http://www.forbes.com/sites/bisnow/2017/07/12/meet-aras-agalarov-the-russian-developer-connecting-the-trumps-and-putin/","en","False","politics and government","1104","Forbes","http://www.forbes.com/","United States","","English","United States","Print Native"
"658002975","2017-07-15 11:44:00","Another player in Trump Jr.'s meeting with a Kremlin-connected lawyer has been identified","https://finance.yahoo.com/news/another-player-trump-jr-meeting-154400828.html","en","True","politics and government, armament, defense and military forces, biographical information","18840","finance.yahoo.com","http://finance.yahoo.com","United States","","English","United States","Digital Native"
"634741401","2017-06-01 08:00:00","Trump campaign’s Russia ties: Who’s involved - Washington Post","https://www.washingtonpost.com/graphics/national/trump-russia/?utm_term=.91ad695fcbb2","en","False","","2","Washington Post","http://washingtonpost.com","United States","DC, USA","English","United States","Print Native"
"659404855","2017-07-18 13:38:58","The New York Post: Eighth person at Trump Jr.’s meeting with Russian lawyer identified ","http://www.marketwatch.com/news/story.asp?guid=%7B935F8A7C-6BDE-11E7-99F0-C2BCD13EB4FF%7D&siteid=rss&rss=1","en","False","politics and government, united states politics and government, elections, presidents and presidency (us), conventions and conferences","1150","Wall Street Journal","http://online.wsj.com/","United States","New York, United States","English","United States","Print Native"
"605470746","2017-04-03 08:00:00","Trump campaign’s Russia ties: Who’s involved - Washington Post","https://www.washingtonpost.com/graphics/national/trump-russia/?utm_term=.431563464eb0&tid=sm_tw","en","False","","2","Washington Post","http://washingtonpost.com","United States","DC, USA","English","United States","Print Native"
"661971504","2017-07-22 16:33:48","'Out and out political warfare': Trump claims 'complete power to pardon' amid the White House's escalating war on Russia investigation","https://finance.yahoo.com/news/political-warfare-trump-claims-complete-203348043.html","en","True","politics and government, united states politics and government, armament, defense and military forces, news and news media, media, crime and criminals, ethics, united states international relations, international relations","18840","finance.yahoo.com","http://finance.yahoo.com","United States","","English","United States","Digital Native"
"634740659","2017-05-10 12:27:53","Trump campaign’s Russia ties: Who’s involved - Washington Post","https://www.washingtonpost.com/graphics/national/trump-russia/","en","False","","2","Washington Post","http://washingtonpost.com","United States","DC, USA","English","United States","Print Native"
"683043343","2017-08-31 15:58:02","Trump’s Real Campaign","http://www.slate.com/articles/news_and_politics/politics/2017/08/trump_s_long_campaign_to_make_trump_tower_moscow_happen.html","en","False","politics and government, united states politics and government, united states international relations, international relations","19643","Slate.com","http://www.slate.com","United States","","English","United States","Digital Native"
"596640083","2017-03-20 07:45:00","Exclusive: Powerful Russian Partner Boasts Of Ongoing Access To Trump Family","http://www.forbes.com/sites/noahkirsch/2017/03/20/russian-billionaire-family-trump-ties-ongoing/","en","False","politics and government, finances","1104","Forbes","http://www.forbes.com/","United States","","English","United States","Print Native"
"694490586","2017-07-11 10:53:00","That's that: The Trump campaign welcomed Russian meddling","https://www.washingtonpost.com/amphtml/news/politics/wp/2017/07/11/thats-that-the-trump-campaign-welcomed-russian-meddling/","en","False","politics and government, united states politics and government","2","Washington Post","http://washingtonpost.com","United States","DC, USA","English","United States","Print Native"
"693410445","2017-03-20 08:00:00","Exclusive: Powerful Russian Partner Boasts Of Ongoing Access To Trump Family","https://www.forbes.com/sites/noahkirsch/2017/03/20/russian-billionaire-family-trump-ties-ongoing/amp/","en","False","politics and government, finances","1104","Forbes","http://www.forbes.com/","United States","","English","United States","Print Native"
"659365086","2017-07-18 12:38:05","Eighth person in Trump Tower meeting is identified","https://www.washingtonpost.com/politics/eighth-person-in-trump-tower-meeting-is-identified/2017/07/18/e971234a-6bce-11e7-9c15-177740635e83_story.html","en","False","politics and government, united states politics and government","2","Washington Post","http://washingtonpost.com","United States","DC, USA","English","United States","Print Native"
"694662540","2017-09-22 17:37:04","What the Heck Is a Russian 'Crown Prosecutor'?","https://www.theatlantic.com/international/archive/2017/07/russian-crown-prosecutor/533295/?utm_source=twb","en","False","politics and government, news and news media, media","1110","The Atlantic","http://www.theatlantic.com/","United States","","English","United States","Print Native"
"692683201","2017-09-06 00:00:00","Russian lawyer in Trump Tower meeting says Mueller hasn't called","https://www.nbcnews.com/news/us-news/russian-lawyer-trump-tower-meeting-says-mueller-hasn-t-called-n798781?cid=public-rss_20170906","en","False","","25499","NBC News","http://www.nbcnews.com","United States","","English","United States",""
"611177155","2016-04-10 00:00:00","Inside Trump’s financial ties to Russia and his unusual flattery of Vladimir Putin","https://www.washingtonpost.com/politics/inside-trumps-financial-ties-to-russia-and-his-unusual-flattery-of-vladimir-putin/2016/06/17/dbdcaac8-31a6-11e6-8ff7-7b6c1998b7a0_story.html?utm_term=.ef828844e704","en","False","finances, biographical information, contests and prizes","2","Washington Post","http://washingtonpost.com","United States","DC, USA","English","United States","Print Native"
"689982908","2017-09-14 10:27:04","Why Didn't Trump Build Anything in Russia?","https://www.theatlantic.com/international/archive/2017/09/why-didnt-trump-build-anything-in-russia/539274/?utm_source=feed","en","False","politics and government, united states politics and government","1110","The Atlantic","http://www.theatlantic.com/","United States","","English","United States","Print Native"
"690605137","2017-09-07 08:00:00","Trump campaign’s Russia ties: Who’s involved - Washington Post","https://www.washingtonpost.com/graphics/national/trump-russia/?tid=ss_tw&utm_term=.3ed3de7cfc6d","en","False","politics and government, smoking and tobacco","2","Washington Post","http://washingtonpost.com","United States","DC, USA","English","United States","Print Native"
"669794892","2017-08-03 08:00:00","Trump campaign’s Russia ties: Who’s involved - Washington Post","https://www.washingtonpost.com/graphics/national/trump-russia/?utm_term=.64f83e09a61a","en","False","politics and government, smoking and tobacco","2","Washington Post","http://washingtonpost.com","United States","DC, USA","English","United States","Print Native"
"659479589","2017-07-18 20:33:54","Lawyer: Russian developer’s staffer also at Trump Tower meeting","http://www.cbsnews.com/news/lawyer-russian-developers-staffer-also-at-trump-tower-meeting/","en","False","politics and government, news and news media, media","1752","cbs news","http://www.cbsnews.com/","United States","NY, USA","English","United States","Video Broadcast"
"659828847","2017-07-18 08:00:00","Trump campaign’s Russia ties: Who’s involved - Washington Post","https://www.washingtonpost.com/graphics/national/trump-russia/?utm_term=.dfb13aaf83b7","en","False","politics and government, smoking and tobacco","2","Washington Post","http://washingtonpost.com","United States","DC, USA","English","United States","Print Native"
"663393141","2017-07-24 08:00:00","Trump campaign’s Russia ties: Who’s involved - Washington Post","https://www.washingtonpost.com/graphics/national/trump-russia/?utm_term=.b06f4fd5114c","en","False","politics and government, smoking and tobacco","2","Washington Post","http://washingtonpost.com","United States","DC, USA","English","United States","Print Native"
"686378881","2017-08-28 08:00:00","Trump campaign’s Russia ties: Who’s involved - Washington Post","https://www.washingtonpost.com/graphics/national/trump-russia/?utm_term=.f4bf9458c43b","en","False","politics and government, smoking and tobacco","2","Washington Post","http://washingtonpost.com","United States","DC, USA","English","United States","Print Native"
"669934463","2017-07-10 08:00:00","How Trump ended up in a 2013 Europop video connected to the latest Russia controversy","https://www.washingtonpost.com/news/arts-and-entertainment/wp/2017/07/10/how-trump-ended-up-in-a-2013-europop-video-connected-to-the-latest-russia-controversy/?utm_term=.715ccec4557d","en","False","politics and government, united states politics and government","2","Washington Post","http://washingtonpost.com","United States","DC, USA","English","United States","Print Native"
"599189987","2016-01-19 00:13:37","Here’s what we know about Donald Trump and his ties to Russia","https://www.washingtonpost.com/politics/heres-what-we-know-about-donald-trump-and-his-ties-to-russia/2016/07/29/1268b5ec-54e7-11e6-88eb-7dda4e2f2aec_story.html?utm_term=.8bae796a68c6","en","False","politics and government, finances, no index terms from nytimes, united states politics and government, elections, presidents and presidency (us), taxation, international relations","2","Washington Post","http://washingtonpost.com","United States","DC, USA","English","United States","Print Native"
"605316414","2016-05-06 11:06:49","Here’s what we know about Donald Trump and his ties to Russia","https://www.washingtonpost.com/politics/heres-what-we-know-about-donald-trump-and-his-ties-to-russia/2016/07/29/1268b5ec-54e7-11e6-88eb-7dda4e2f2aec_story.html?utm_term=.6da30acdfef0","en","False","politics and government, finances, no index terms from nytimes, united states politics and government, elections, presidents and presidency (us), taxation, international relations","2","Washington Post","http://washingtonpost.com","United States","DC, USA","English","United States","Print Native"
"494306665","2016-07-27 16:26:28","Trump invites Russia to meddle in the U.S. presidential race with Clinton’s emails","https://www.washingtonpost.com/politics/trump-invites-russia-to-meddle-in-the-us-presidential-race-with-clintons-emails/2016/07/27/a85d799e-5414-11e6-b7de-dfe509430c39_story.html","en","False","politics and government, computers and the internet, united states politics and government, elections, presidents and presidency (us), presidential elections (us), united states international relations, international relations","2","Washington Post","http://washingtonpost.com","United States","DC, USA","English","United States","Print Native"
"657494622","2017-07-11 08:00:00","Russian Dirt on Clinton? ‘I Love It,’ Donald Trump Jr. Said","https://www.nytimes.com/2017/07/11/us/politics/trump-russia-email-clinton.html?&contentID=65556520&module=ArrowsNav&contentCollection=Politics&action=keypress&region=FixedLeft&pgtype=article","en","False","politics and government, computers and the internet, united states politics and government, armament, defense and military forces","1","New York Times","http://nytimes.com","United States","NY, USA","English","United States","Print Native"
"720194996","2017-10-30 08:00:00","Trump campaign’s Russia ties: Who’s involved - Washington Post","https://www.washingtonpost.com/graphics/national/trump-russia/?utm_term=.1230c92c0735","en","False","politics and government, smoking and tobacco","2","Washington Post","http://washingtonpost.com","United States","DC, USA","English","United States","Print Native"
"655765818","2017-07-11 19:05:21","What the Heck is a Russian 'Crown Prosecutor'?","http://feedproxy.google.com/~r/TheAtlantic/~3/nfgEpXHquTM/","en","False","politics and government, news and news media, media","1110","The Atlantic","http://www.theatlantic.com/","United States","","English","United States","Print Native"
"720152896","2017-10-25 08:00:00","Analysis | What the Trump dossier says — and what it doesn’t","https://www.washingtonpost.com/news/politics/wp/2017/10/25/what-the-trump-dossier-says-and-what-it-doesnt/?utm_term=.27890e45f9ec","en","False","politics and government, united states politics and government, elections, ethics","2","Washington Post","http://washingtonpost.com","United States","DC, USA","English","United States","Print Native"
"655782873","2017-07-11 19:40:26","Trump Jr. 'probably would have done things a little differently'","http://www.nydailynews.com/news/national/trump-jr-differently-article-1.3318839","en","False","politics and government, united states politics and government, ethics","8","Daily News","http://www.nydailynews.com/","United States","NY, USA","English","United States","Print Native"
"655664293","2017-07-11 14:05:00","Donald Trump Jr. emails reveal knowledge of Russian government offer to aid father's campaign","http://www.latimes.com/nation/politics/la-na-pol-trump-russia-20170711-story.html","en","False","politics and government, finances, united states politics and government, international relations","6","LA Times","http://www.latimes.com/","United States","California, United States","English","United States","Print Native"
"655575248","2017-07-11 11:09:18","THE EMAILS: Trump Jr. posts exchange that promised dirt on Clinton as 'part of Russia and its government's support for Mr. Trump'","http://feedproxy.google.com/~r/businessinsider/~3/SmmNSrymCOo/donald-trump-jr-posted-rob-goldstone-emails-russia-2017-7","en","False","politics and government, united states politics and government, elections, presidents and presidency (us), biographical information","18710","Business Insider","http://www.businessinsider.com","United States","","English","United States","Digital Native"
"655731275","2017-07-11 16:29:36","Trump&#8217;s Russian business partner had said his election would be &#8216;an amazing breakthrough&#8217;","http://www.washingtonpost.com/blogs/worldviews/wp/2017/07/11/trumps-russian-business-partner-had-said-his-election-would-be-an-amazing-breakthrough/","en","False","politics and government, united states politics and government, elections, united states international relations, international relations, biographical information","2","Washington Post","http://washingtonpost.com","United States","DC, USA","English","United States","Print Native"
"658748619","2017-07-14 08:00:00","Trump campaign’s Russia ties: Who’s involved - Washington Post","https://www.washingtonpost.com/graphics/national/trump-russia/?utm_term=.2813f6eaae05","en","False","politics and government, smoking and tobacco","2","Washington Post","http://washingtonpost.com","United States","DC, USA","English","United States","Print Native"
"661469271","2017-03-31 08:00:00","Trump campaign’s Russia ties: Who’s involved - Washington Post","https://www.washingtonpost.com/graphics/national/trump-russia/?utm_term=.90ccfce4acad","en","False","politics and government, smoking and tobacco","2","Washington Post","http://washingtonpost.com","United States","DC, USA","English","United States","Print Native"
"734911286","2017-11-23 07:00:00","Trump campaign’s Russia ties: Who’s involved - Washington Post","https://www.washingtonpost.com/graphics/national/trump-russia/?utm_term=.ea8c9b4748c0","en","False","politics and government, smoking and tobacco","2","Washington Post","http://washingtonpost.com","United States","DC, USA","English","United States","Print Native"
"694524817","2017-09-20 08:00:00","Trump campaign’s Russia ties: Who’s involved - Washington Post","https://www.washingtonpost.com/graphics/national/trump-russia/?utm_term=.d246ffc2eb2c","en","False","politics and government, smoking and tobacco","2","Washington Post","http://washingtonpost.com","United States","DC, USA","English","United States","Print Native"
"740860146","2017-12-06 07:00:00","Trump campaign’s Russia ties: Who’s involved - Washington Post","https://www.washingtonpost.com/graphics/national/trump-russia/?utm_term=.b5c62edb4338","en","False","politics and government, smoking and tobacco","2","Washington Post","http://washingtonpost.com","United States","DC, USA","English","United States","Print Native"
"659400856","2017-07-18 17:52:35","Live Updates: Republican Effort To Repeal Obamacare Dies In The Senate","https://www.buzzfeed.com/buzzfeednews/live-updates-republican-effort-to-repeal-obamacare-dies-in","en","False","politics and government, united states politics and government","6218","Buzzfeed","http://www.buzzfeed.com","United States","","English","none","Digital Native"
"655241859","2017-07-10 20:07:04","Happy Hour Roundup","https://www.washingtonpost.com/blogs/plum-line/wp/2017/07/10/happy-hour-roundup-1149/","en","False","politics and government","2","Washington Post","http://washingtonpost.com","United States","DC, USA","English","United States","Print Native"
