stories_id,publish_date,title,url,language,ap_syndicated,themes,media_id,media_name,media_url,media_pub_country,media_pub_state,media_language,media_about_country,media_media_type
"684350580","2017-03-07 15:32:00","Bloomberg Billionaires Index - Dmitry Rybolovlev","https://www.bloomberg.com/billionaires/profiles/dmitry-rybolovlev/","en","False","finances, medicine and health, biographical information","40944","Bloomberg","http://bloomberg.com","United States","","English","United States","Digital Native"
"907127027","2016-02-02 00:00:00","Matt Levine's Money Stuff: Secret Summits and Muppet Ventures","https://www.bloomberg.com/view/articles/2016-02-02/secret-summits-and-muppet-ventures","en","False","finances, labor, stocks and bonds, executives and management","40944","Bloomberg","http://bloomberg.com","United States","","English","United States","Digital Native"
"577428826","2016-01-18 19:40:43","Trump says he has ‘nothing to do with Russia.’ The past 30 years show otherwise.","https://www.washingtonpost.com/politics/trump-says-he-has-nothing-to-do-with-russia-thirty-years-of-history-shows-otherwise/2017/01/11/b7f20c5a-d829-11e6-b8b2-cb5164beba6b_story.html?utm_term=.9ae99fcbcc57","en","False","politics and government, finances, elections","2","Washington Post","http://washingtonpost.com","United States","DC, USA","English","United States","Print Native"
"912353498","2016-03-09 03:00:02","The Da Vinci Markup? Europe's Art Scandal Comes to America","http://www.bloomberg.com/news/articles/2016-03-09/the-da-vinci-markup-europe-s-art-scandal-comes-to-america","en","False","art, frauds and swindling","40944","Bloomberg","http://bloomberg.com","United States","","English","United States","Digital Native"
"606157412","2016-01-20 03:50:54","Russian Billionaire Takes 74% Loss on $85 Million Gauguin","https://www.bloomberg.com/news/articles/2017-02-28/that-85-million-painting-bought-as-an-investment-now-down-74","en","False","finances, art, prices (fares, fees and rates), auctions","40944","Bloomberg","http://bloomberg.com","United States","","English","United States","Digital Native"
"601754639","2016-03-09 08:57:36","https://www.bloomberg.com/view/articles/2016-03-09/social-loans-and-creeping-fraud","https://www.bloomberg.com/view/articles/2016-03-09/social-loans-and-creeping-fraud","en","False","computers and the internet, finances, banks and banking, frauds and swindling, stocks and bonds, credit","40944","Bloomberg","http://bloomberg.com","United States","","English","United States","Digital Native"
"594399112","2017-03-15 19:45:37","'Area Man Is President'","https://www.buzzfeed.com/stevenperlberg/how-palm-beach-media-is-capitalizing-on-trump","en","False","politics and government","6218","Buzzfeed","http://www.buzzfeed.com","United States","","English","none","Digital Native"
"594892148","2017-03-16 14:27:17","Michael Flynn paid more than $30,000 by state-run Russian TV","http://www.nydailynews.com/news/world/michael-flynn-paid-30-000-state-run-russian-tv-article-1.3000106","en","False","politics and government, united states politics and government, armament, defense and military forces, united states international relations, international relations, suspensions, dismissals and resignations","8","Daily News","http://www.nydailynews.com/","United States","NY, USA","English","United States","Print Native"
"634763697","2017-03-14 07:00:41","Everything We Know About Trumpland's Ties To Russia, From Start To Finish | HuffPost","http://www.huffingtonpost.com/entry/trump-russia-timeline_us_58c2eec2e4b054a0ea6a744e","en","False","politics and government, united states politics and government, elections, armament, defense and military forces, united states international relations, international relations","27502","Huffington Post","http://www.huffingtonpost.com/#","United States","","English","United States",""
"762238568","2018-01-04 11:07:00","The 25 most powerful football clubs in the world, ranked by squad value, cash, and potential","http://feedproxy.google.com/~r/businessinsider/~3/yK-8OKkBob8/the-most-powerful-football-clubs-in-the-world-2018-1","en","False","finances","18710","Business Insider","http://www.businessinsider.com","United States","","English","United States","Digital Native"
"727177999","2017-11-17 08:00:21","On Soccer: French Rivals Hope P.S.G.&#x2019;s Spotlight Has Room for Them","https://www.nytimes.com/2017/11/17/sports/soccer/neymar-psg-ligue-1-france.html?partner=rss&emc=rss","en","False","coaches and managers","1","New York Times","http://nytimes.com","United States","NY, USA","English","United States","Print Native"
"858273852","2017-02-07 00:00:00","What Geneva’s Art King Lost in Battle With Russian Billionaire","https://www.bloomberg.com/news/articles/2017-02-07/geneva-free-ports-king-mulls-art-fight-s-nearly-1-billion-toll","en","False","finances, frauds and swindling, mergers, acquisitions and divestitures","40944","Bloomberg","http://bloomberg.com","United States","","English","United States","Digital Native"
"594171902","2017-03-15 07:59:12","Trump’s 2005 tax return leak leaves more questions than answers ","http://www.nydailynews.com/news/politics/trump-2005-tax-return-leak-leaves-questions-answers-article-1.2998424","en","False","politics and government, finances, united states politics and government, elections, presidents and presidency (us), taxation, election issues","8","Daily News","http://www.nydailynews.com/","United States","NY, USA","English","United States","Print Native"
"666484599","2017-03-16 08:00:00","Colbert Thoroughly Roasts Rachel Maddow Over Her ‘Big’ Trump Tax Scoop [VIDEO]","http://dailycaller.com/2017/03/16/colbert-thoroughly-roasts-rachel-maddows-delivery-of-her-big-trump-tax-scoop-video/","en","False","television","18775","Daily Caller","http://dailycaller.com","United States","","English","United States","Digital Native"
"661484900","2017-04-27 08:00:00","Advisers to the Ultra-Rich Try to Treat Art as Just Another Asset","https://www.bloomberg.com/news/articles/2017-04-27/advisors-to-the-ultra-rich-try-to-treat-art-as-just-another-asset","en","False","finances, art, prices (fares, fees and rates)","40944","Bloomberg","http://bloomberg.com","United States","","English","United States","Digital Native"
"932420137","2017-05-06 00:00:00","Billionaire Superyacht Showdown: Who's Who at the 2017 Cannes Film Festival","https://www.forbes.com/sites/jimdobson/2017/05/06/billionaire-superyacht-showdown-whos-who-at-the-2017-cannes-film-festival/#1c434286354b","en","False","","1104","Forbes","http://www.forbes.com/","United States","","English","United States","Print Native"
"907028143","2017-11-17 00:00:00","Absent Regulators and Activist Votes","https://www.bloomberg.com/view/articles/2017-11-17/absent-regulators-and-activist-votes","en","False","politics and government, finances, appointments and executive changes, ethics, suspensions, dismissals and resignations","40944","Bloomberg","http://bloomberg.com","United States","","English","United States","Digital Native"
"594417546","2017-03-15 14:23:10","15 ‘Objective’ Journalists Who Hoped Rachel Maddow Would Validate Trump-Russia Conspiracy Theories","http://feedproxy.google.com/~r/breitbart/~3/w4Zy6offqcY/","en","True","politics and government, computers and the internet, television, taxation, news and news media, media","19334","Breitbart","http://www.breitbart.com","United States","","English","United States","Digital Native"
"604205008","2016-05-03 04:00:00","Trump’s claim that ‘I have nothing to do with Russia’","https://www.washingtonpost.com/news/fact-checker/wp/2016/07/27/trumps-claim-that-i-have-nothing-to-do-with-russia/?tid=a_inl&utm_term=.10f515c6d500","en","False","politics and government, finances, united states politics and government, elections, presidents and presidency (us)","2","Washington Post","http://washingtonpost.com","United States","DC, USA","English","United States","Print Native"
"623287569","2017-05-12 12:57:45","Don’t Take Anything Trump’s Lawyers Say About His Tax Returns Seriously","http://www.huffingtonpost.com/2017/05/12/donald-trump-lawyers-taxes-russia_n_16581372.html","en","False","politics and government, finances, taxation","27502","Huffington Post","http://www.huffingtonpost.com/#","United States","","English","United States",""
"494306678","2016-07-27 16:26:28","Trump's claim that 'I have nothing to do with Russia'","https://www.washingtonpost.com/news/fact-checker/wp/2016/07/27/trumps-claim-that-i-have-nothing-to-do-with-russia/","en","False","politics and government, computers and the internet, finances, united states politics and government","2","Washington Post","http://washingtonpost.com","United States","DC, USA","English","United States","Print Native"
"670713066","2016-12-08 23:20:25","Rich Russians Have Been Super Interested in Buying U.S. Homes Since Donald Trump’s Win","http://fortune.com/2016/12/08/us-property-real-estate-trump-russian-buyers/","en","False","finances, housing","1095","CNN","http://www.cnn.com/","United States","GA, USA","English","United States","Video Broadcast"
"946172172","2017-04-06 00:00:00","Leonardo da Vinci's 'Salvator Mundi' painting sells for record $450M","https://www.nbcnews.com/pop-culture/pop-culture-news/leonardo-da-vinci-s-salvator-mundi-painting-sells-record-450m-n821271","en","True","art, auctions","25499","NBC News","http://www.nbcnews.com","United States","","English","United States",""
"726211842","2017-11-15 20:29:52","Once bought for $59, Da Vinci painting fetches record $450M","http://rss.cnn.com/~r/rss/cnn_topstories/~3/7SEMSo7VmB8/index.html","en","False","art, auctions","1095","CNN","http://www.cnn.com/","United States","GA, USA","English","United States","Video Broadcast"
"946192695","2016-02-08 00:00:00","The Art-World Insider Who Went Too Far","https://www.newyorker.com/magazine/2016/02/08/the-bouvier-affair","en","False","travel and vacations","1101","New Yorker","http://www.newyorker.com/","United States","","English","United States","Print Native"
"709477610","2017-10-20 09:30:22","The High End: On the Upper West Side, New Digs for Old Souls","https://www.nytimes.com/2017/10/20/realestate/on-the-upper-west-side-new-digs-for-old-souls.html?partner=rss&emc=rss","en","False","housing","1","New York Times","http://nytimes.com","United States","NY, USA","English","United States","Print Native"
"623251738","2017-05-12 11:20:00","Trump lawyers push back against Russia ties in letter","http://feeds.foxnews.com/~r/foxnews/politics/~3/uYSZims1zP4/trump-lawyers-push-back-against-russia-ties-in-letter.html","en","True","politics and government, finances, taxation","1092","FOX News","http://www.foxnews.com/","United States","GA, USA","English","United States","Video Broadcast"
"588160470","2017-03-02 06:49:48","As Klimt Painting Sells for $59 Million, Auction Houses Cross Their Fingers","http://www.nytimes.com/2017/03/02/arts/gustav-klimt-bauerngarten-sothebys-auction.html?partner=rss&emc=rss","en","False","finances, art, auctions, collectors and collections","1","New York Times","http://nytimes.com","United States","NY, USA","English","United States","Print Native"
"684286277","2017-02-23 13:49:00","A $100 Million Art Mystery","https://www.bloomberg.com/news/features/2017-02-23/a-100-million-mystery-a-russian-his-art-and-his-big-losses","en","False","finances, suits and litigation, prices (fares, fees and rates)","40944","Bloomberg","http://bloomberg.com","United States","","English","United States","Digital Native"
"553320252","2016-12-11 14:13:15","An Artistic Discovery Makes a Curator&#x2019;s Heart Pound","http://www.nytimes.com/2016/12/11/arts/design/leonardo-da-vinci-lost-drawing-discovered.html?partner=rss&emc=rss","en","False","art","1","New York Times","http://nytimes.com","United States","NY, USA","English","United States","Print Native"
"591402432","2017-03-09 05:19:33","London Art Auctions May Herald a Market on the Upswing","http://www.nytimes.com/2017/03/09/arts/london-sothebys-christies-auctions.html?partner=rss&emc=rss","en","False","art, prices (fares, fees and rates), auctions","1","New York Times","http://nytimes.com","United States","NY, USA","English","United States","Print Native"
"660000914","2017-07-19 14:00:57","With Trump and Russia, it's all about the money","https://www.washingtonpost.com/blogs/plum-line/wp/2017/07/19/with-trump-and-russia-its-all-about-the-money/","en","False","politics and government, finances, ethics","2","Washington Post","http://washingtonpost.com","United States","DC, USA","English","United States","Print Native"
"747370244","2017-03-11 07:00:00","'No foundation in fact': Russian billionaire responds to accusations about his ties to Trump","http://www.businessinsider.in/no-foundation-in-fact-russian-billionaire-responds-to-accusations-about-his-ties-to-trump/articleshow/57585648.cms","en","False","politics and government, united states politics and government, airlines and airplanes, travel and vacations","18710","Business Insider","http://www.businessinsider.com","United States","","English","United States","Digital Native"
"494222094","2016-07-27 11:58:55","The Trump-Russia-money question, in 24 steps","https://www.washingtonpost.com/news/the-fix/wp/2016/07/27/the-trump-russia-money-question-in-24-steps/","en","False","politics and government, finances, united states politics and government, elections, presidents and presidency (us), presidential elections (us), primaries, news and news media, media, presidential election of 2004, biographical information","2","Washington Post","http://washingtonpost.com","United States","DC, USA","English","United States","Print Native"
"585389489","2017-02-24 02:59:47","London Sales Will Gauge Art Market&#x2019;s Health in Trump Era","http://www.nytimes.com/2017/02/24/arts/design/art-sales-london-sothebys-christies.html?partner=rss&emc=rss","en","False","art, auctions","1","New York Times","http://nytimes.com","United States","NY, USA","English","United States","Print Native"
"663692958","2017-05-08 08:27:55","Sports Writer: Eric Trump Told Me Family's Golf Courses Had Russian Investors | HuffPost","http://www.huffingtonpost.com/entry/eric-trump-russia-golf_us_590fd976e4b0e7021e98d1a4","en","False","correction stories, golf","27502","Huffington Post","http://www.huffingtonpost.com/#","United States","","English","United States",""
"582129811","2017-02-16 17:27:43","Donald Trump Can Clear Up Questions About His Ties To Russia By Releasing His Tax Returns","http://www.huffingtonpost.com/2017/02/16/trump-russia-tax-returns_n_14801492.html","en","False","politics and government, united states politics and government, elections, presidents and presidency (us), taxation, election issues, ethics, international relations","27502","Huffington Post","http://www.huffingtonpost.com/#","United States","","English","United States",""
"664932218","2017-07-27 18:51:13","Russia probe could reveal Trump's closest-held secrets","http://rssfeeds.usatoday.com/~/413158970/0/usatoday-newstopstories~Russia-probe-could-reveal-Trumps-closestheld-secrets/","en","False","politics and government, finances, taxation","64866","USAToday","http://usatoday.com/","United States","Ohio, United States","English","United States","Print Native"
"747369969","2017-03-10 20:22:14","'No foundation in fact': Russian billionaire issues first response to theories about his ties to Trump","http://www.businessinsider.com/russian-billionaire-rybolovlev-responds-to-accusations-about-ties-to-trump-2017-3","en","False","politics and government, airlines and airplanes","18710","Business Insider","http://www.businessinsider.com","United States","","English","United States","Digital Native"
"506133009","2016-08-27 11:11:45","Inside Wealth: Only in Palm Beach: The $95 Million Tear-Down","http://www.nytimes.com/2016/08/28/business/only-in-palm-beach-the-95-million-tear-down.html?partner=rss&emc=rss","en","False","finances, prices (fares, fees and rates), housing, mergers, acquisitions and divestitures, bankruptcies","1","New York Times","http://nytimes.com","United States","NY, USA","English","United States","Print Native"
"520126558","2016-09-30 12:00:15","Big Ticket: A Park Avenue Penthouse in the Clouds","http://www.nytimes.com/2016/10/02/realestate/a-park-avenue-penthouse-in-the-clouds.html?partner=rss&emc=rss","en","False","finances, housing, condominiums","1","New York Times","http://nytimes.com","United States","NY, USA","English","United States","Print Native"
"623253653","2017-05-12 11:47:00","Trump lawyers push back against Russia ties in letter","http://feeds.latimes.com/~r/latimes/asia/~3/KZTHdGzb8Rc/la-na-essential-washington-updates-trump-lawyers-push-back-against-russia-1494604065-htmlstory.html","en","True","politics and government, finances, taxation","6","LA Times","http://www.latimes.com/","United States","California, United States","English","United States","Print Native"
"663224112","2017-03-07 15:32:00","Russian Billionaire Loses $150 Million on Four Artworks","https://www.bloomberg.com/news/articles/2017-03-07/russian-billionaire-loses-150-million-on-sale-of-four-artworks","en","False","finances, suits and litigation, art","40944","Bloomberg","http://bloomberg.com","United States","","English","United States","Digital Native"
"747371358","2016-05-03 08:00:00","Trump and the oligarch","http://www.politico.eu/article/donad-trump-and-the-oligarch-russia-dmitry-rybolovlev-house-vladimir-putin-us-presidential-election-america-2016/","en","False","finances, travel and vacations, housing","18268","Politico","http://politico.com","United States","","English","United States","Print Native"
"594296439","2017-03-15 12:17:17","Meet Dmitry Rybolovlev, the oligarch believed to be tied to Trump","http://www.nydailynews.com/news/national/meet-dmitry-rybolovlev-oligarch-believed-tied-trump-article-1.2998754","en","False","politics and government, finances","8","Daily News","http://www.nydailynews.com/","United States","NY, USA","English","United States","Print Native"
"725989920","2017-11-15 11:06:00","How this $100M da Vinci masterpiece flew under the radar for centuries","http://www.foxnews.com/science/2017/11/15/how-this-100m-da-vinci-masterpiece-flew-under-radar-for-centuries.html","en","False","art, auctions","1092","FOX News","http://www.foxnews.com/","United States","GA, USA","English","United States","Video Broadcast"
"946330398","2017-11-16 00:00:00","Da Vinci Christ Portrait Becomes the Most Expensive Artwork Ever Sold","https://www.bloomberg.com/news/articles/2017-11-16/da-vinci-s-christ-portrait-shatters-art-record-at-450-million","en","False","art, auctions, records and achievements","40944","Bloomberg","http://bloomberg.com","United States","","English","United States","Digital Native"
"767925255","2018-01-11 08:23:00","The 10 most expensive divorce settlements in history","http://feedproxy.google.com/~r/businessinsider/~3/SNQpYhoVb8k/most-expensive-divorce-settlements-2018-1","en","False","television","18710","Business Insider","http://www.businessinsider.com","United States","","English","United States","Digital Native"
"795106903","2018-02-11 12:18:47","Senator wants docs from estate Trump sold to Russian billionaire","http://feeds.nydailynews.com/~r/nydnrss/latino/~3/FtNetakdxI8/senator-docs-estate-trump-sold-russian-billionaire-article-1.3814034","en","False","politics and government, finances, ethics","8","Daily News","http://www.nydailynews.com/","United States","NY, USA","English","United States","Print Native"
"879320382","2018-05-19 15:21:51","NY Times: Gulf Emissary, Israeli Expert Offered Trump Election Help","https://www.Newsmax.com/newsfront/donald-trump-jr-2016-presidential-election-israel-arab-princes/2018/05/19/id/861337","en","False","politics and government, united states politics and government, biographical information","25349","NewsMax","http://www.newsmax.com","United States","","English","United States","Digital Native"
"868551667","2018-05-07 16:22:16","Here's another big revelation about Trump's finances. How about those tax returns?","https://www.washingtonpost.com/blogs/plum-line/wp/2018/05/07/heres-another-big-revelation-about-trumps-finances-how-about-those-tax-returns/","en","False","finances, taxation, banks and banking","2","Washington Post","http://washingtonpost.com","United States","DC, USA","English","United States","Print Native"
"870297814","2018-05-09 10:45:00","Billionaire Superyacht Showdown: Who's Who at the 2018 Cannes Film Festival","https://www.forbes.com/sites/jimdobson/2018/05/09/billionaire-superyacht-showdown-whos-who-at-the-2018-cannes-film-festival/","en","False","motion pictures, festivals","1104","Forbes","http://www.forbes.com/","United States","","English","United States","Print Native"
"784621768","2018-01-30 12:23:49","These Russian oligarchs are now on Washington's watchlist","http://rss.cnn.com/~r/rss/cnn_latest/~3/XWOpVZiZUSo/index.html","en","False","politics and government, finances, united states politics and government, international trade and world market","1095","CNN","http://www.cnn.com/","United States","GA, USA","English","United States","Video Broadcast"
"931524984","2018-07-18 18:57:02","Why won't Republicans finally demand Trump release his tax returns?","https://www.washingtonpost.com/blogs/post-partisan/wp/2018/07/18/why-wont-republicans-finally-demand-trump-release-his-tax-returns/","en","False","politics and government, united states politics and government, taxation, united states international relations, international relations","2","Washington Post","http://washingtonpost.com","United States","DC, USA","English","United States","Print Native"
"934826258","2018-07-23 05:37:00","Le vacanze dei Billionaires","https://www.forbes.com/sites/it/2018/07/23/vacanze-billionaires-obama-armani-bezos-gates-italia/","it","False","","1104","Forbes","http://www.forbes.com/","United States","","English","United States","Print Native"
"665926991","2017-01-25 18:01:00","Geneva Art World Pens Anti-Money-Laundering Guide","https://www.bloomberg.com/news/articles/2017-01-25/geneva-art-world-pens-anti-money-laundering-guide-amid-scandals","en","False","crime and criminals, art","40944","Bloomberg","http://bloomberg.com","United States","","English","United States","Digital Native"
"975977691","2018-09-07 10:58:51","The Billionaire Who Bought Trump&#x2019;s Mansion Faces Scrutiny in Monaco","https://www.nytimes.com/2018/09/07/arts/design/dmitry-rybolovlev-monaco-investigation.html?partner=rss&emc=rss","en","False","soccer, travel and vacations","1","New York Times","http://nytimes.com","United States","NY, USA","English","United States","Print Native"
"605582236","2016-05-03 00:00:00","Dmitry Rybolovlev","https://www.forbes.com/profile/dmitry-rybolovlev/","en","False","finances, mergers, acquisitions and divestitures, condominiums","1104","Forbes","http://www.forbes.com/","United States","","English","United States","Print Native"
"808907887","2018-02-26 20:40:44","The legacy of Gustav Klimt and his enduring 'Kiss'","http://rss.cnn.com/~r/rss/cnn_latest/~3/qd3gMxkvhB0/index.html","en","False","art, reviews","1095","CNN","http://www.cnn.com/","United States","GA, USA","English","United States","Video Broadcast"
"946222687","2016-11-22 00:00:00","Dispute Over $127.5 Million Leonardo Painting Draws in Sotheby’s","https://www.bloomberg.com/news/articles/2016-11-22/dispute-over-127-5-million-leonardo-painting-draws-in-sotheby-s","en","False","suits and litigation, art, auctions","40944","Bloomberg","http://bloomberg.com","United States","","English","United States","Digital Native"
"826630719","2017-12-06 00:00:00","A Saudi Prince Is the Mystery Buyer of the $450 Million Da Vinci","https://www.bloomberg.com/news/articles/2017-12-06/louvre-abu-dhabi-is-getting-the-450-million-da-vinci-painting","en","False","art","40944","Bloomberg","http://bloomberg.com","United States","","English","United States","Digital Native"
"784801595","2018-01-30 16:43:00","Treasury Department's Russia's Oligarchs List Is Copied From Forbes","https://www.forbes.com/sites/igorbosilkovski/2018/01/30/treasury-departments-russias-oligarchs-list-is-copied-from-forbes/","en","False","politics and government, finances","1104","Forbes","http://www.forbes.com/","United States","","English","United States","Print Native"
"718373212","2017-11-02 13:29:59","A history of Donald Trump’s business dealings in Russia","https://www.washingtonpost.com/opinions/a-history-of-donald-trumps-business-dealings-in-russia/2017/11/02/fb8eed22-ba9e-11e7-be94-fabb0f1e9ffb_story.html","en","False","politics and government, ethics","2","Washington Post","http://washingtonpost.com","United States","DC, USA","English","United States","Print Native"
"806392664","2018-02-10 00:00:00","Sen. Ron Wyden seeking admin records on Trump's sale of mansion to Russian - CNNPolitics","https://www.cnn.com/2018/02/10/politics/russia-trump-real-estate-deal-wyden/","en","False","politics and government, finances, united states politics and government, ethics, frauds and swindling","1095","CNN","http://www.cnn.com/","United States","GA, USA","English","United States","Video Broadcast"
"802946435","2018-02-20 06:00:07","Mueller&apos;s potential investigation options are increasing. But they&apos;re still &apos;potential.&apos;","http://rssfeeds.usatoday.com/~/527569228/0/usatoday-newstopstories~Muelleraposs-potential-investigation-options-are-increasing-But-theyaposre-still-apospotentialapos/","en","False","politics and government","64866","USAToday","http://usatoday.com/","United States","Ohio, United States","English","United States","Print Native"
"943046034","2016-07-28 00:00:00","Trump and the Oligarch","https://www.politico.com/magazine/story/2016/07/donald-trump-2016-russian-ties-214116","en","False","","18268","Politico","http://politico.com","United States","","English","United States","Print Native"
