stories_id,publish_date,title,url,language,ap_syndicated,themes,media_id,media_name,media_url,media_pub_country,media_pub_state,media_language,media_about_country,media_media_type
"726220296","2017-11-15 21:05:00","At Auction, Russian Billionaire Sells Da Vinci Painting For The Most Money Ever In History","https://www.forbes.com/sites/angelauyeung/2017/11/15/at-auction-russian-billionaire-sells-da-vinci-painting-for-the-most-money-ever-in-history/","en","False","finances, art, prices (fares, fees and rates), auctions, collectors and collections","1104","Forbes","http://www.forbes.com/","United States","","English","United States","Print Native"
"726231398","2017-11-15 21:19:00","Da Vinci's 'Salvator Mundi' painting sells for record $450M","https://www.nbcnews.com/pop-culture/pop-culture-news/leonardo-da-vinci-s-salvator-mundi-painting-sells-record-450m-n821271?cid=public-rss_20171116","en","True","art, auctions","25499","NBC News","http://www.nbcnews.com","United States","","English","United States",""
"726234363","2017-11-15 21:11:43","UPDATE 1-Da Vinci portrait of Christ sells for record $450.3 mln in New York","http://feeds.reuters.com/~r/reuters/companyNews/~3/XpLBxJ0VINw/update-1-da-vinci-portrait-of-christ-sells-for-record-450-3-mln-in-new-york-idUSL1N1NM046","en","False","art, auctions","4442","Reuters","http://www.reuters.com","United States","PA, USA","English","none","Other"
"726266285","2017-11-15 23:39:24","UPDATE 2-Da Vinci portrait of Christ sells for record $450.3 mln in New York","http://feeds.reuters.com/~r/reuters/companyNews/~3/KfdXCm9qzyg/update-2-da-vinci-portrait-of-christ-sells-for-record-450-3-mln-in-new-york-idUSL1N1NM046","en","False","art, auctions","4442","Reuters","http://www.reuters.com","United States","PA, USA","English","none","Other"
"726283263","2017-11-16 00:05:06","Painting of Jesus by Leonardo da Vinci sells for record $450M","http://feeds.nydailynews.com/~r/NydnRss/~3/glKzMRFHhYo/painting-jesus-leonardo-da-vinci-sells-record-450m-article-1.3635926","en","True","finances, suits and litigation, art, auctions","8","Daily News","http://www.nydailynews.com/","United States","NY, USA","English","United States","Print Native"
"726817110","2017-11-16 18:33:49","Why rich people spend millions on art","http://rss.cnn.com/~r/rss/cnn_topstories/~3/uYm9UAhnZ6o/index.html","en","False","art, prices (fares, fees and rates), auctions","1095","CNN","http://www.cnn.com/","United States","GA, USA","English","United States","Video Broadcast"
"727350461","2017-11-17 14:38:51","STASI: You don't need to be an art whiz to doubt da Vinci's Jesus","http://www.nydailynews.com/new-york/stasi-don-art-whiz-doubt-da-vinci-jesus-article-1.3640131","en","False","art, auctions","8","Daily News","http://www.nydailynews.com/","United States","NY, USA","English","United States","Print Native"
"728690376","2017-11-20 11:01:23","Artistic license? Experts doubt Leonardo da Vinci painted $450m Salvator Mundi","https://www.theguardian.com/artanddesign/2017/nov/20/artistic-license-experts-doubt-leonardo-da-vinci-painted-450m-salvator-mundi","en","False","art, auctions","623382","Guardian - United States","http://www.theguardian.com/us","United States","","English","","Print Native"
"731109840","2017-11-24 08:43:28","How This Leonardo&#x2019;s Mind-Blowing Price Will Change the Art Market","https://www.nytimes.com/2017/11/24/arts/design/salvator-mundi-leonardo.html?partner=rss&emc=rss","en","False","art, restoration and rehabilitation","1","New York Times","http://nytimes.com","United States","NY, USA","English","United States","Print Native"
"583821200","2017-02-21 00:01:22","A.S. Monaco: From Billionaire&#x2019;s Plaything to Soccer Prodigies&#x2019; Hub","http://www.nytimes.com/2017/02/21/sports/soccer/as-monaco-vadim-vasilyev-.html?partner=rss&emc=rss","en","False","","1","New York Times","http://nytimes.com","United States","NY, USA","English","United States","Print Native"
"737273008","2017-12-05 06:23:07","Donald Trump's personal banking information handed over to Robert Mueller","https://www.theguardian.com/us-news/2017/dec/05/donald-trump-bank-records-handed-over-robert-mueller","en","False","politics and government, finances, united states politics and government, ethics, banks and banking, frauds and swindling, securities and commodities violations","623382","Guardian - United States","http://www.theguardian.com/us","United States","","English","","Print Native"
"737589876","2017-11-15 00:00:00","'Dossier' author Christopher Steele: Trump's hotel and land deals with Russians need to be examined","http://www.businessinsider.com/christopher-steele-trump-hotel-land-deals-russia-dossier-2017-11#comments","en","False","politics and government, finances","18710","Business Insider","http://www.businessinsider.com","United States","","English","United States","Digital Native"
"738665725","2017-12-06 22:13:42","The Buyer of a Record-Breaking Leonardo Da Vinci Painting Has Been Revealed as a Saudi Prince","http://feedproxy.google.com/~r/time/topstories/~3/xIXvDGe2TBc/","en","False","art","4419","Time","http://time.com","United States","","English","United States",""
"738799039","2017-12-07 01:44:08","Louvre Abu Dhabi to exhibit 'Salvator Mundi,' the world's most expensive painting","http://rss.cnn.com/~r/rss/cnn_latest/~3/dqh3GFeGN0U/index.html","en","False","finances, art","1095","CNN","http://www.cnn.com/","United States","GA, USA","English","United States","Video Broadcast"
"739065526","2017-12-06 19:10:45","World-record Da Vinci painting to be exhibited at Louvre Abu Dhabi","https://www.theguardian.com/artanddesign/2017/dec/07/world-record-da-vinci-painting-to-be-exhibited-at-louvre-abu-dhabi","en","False","art, auctions","623382","Guardian - United States","http://www.theguardian.com/us","United States","","English","","Print Native"
"739185609","2017-12-07 08:14:54","Was a Saudi Prince the mystery buyer of $450 million Leonardo Da Vinci painting?","http://rssfeeds.usatoday.com/~/506844626/0/usatodaycomnation-topstories~Was-a-Saudi-Prince-the-mystery-buyer-of-million-Leonardo-Da-Vinci-painting/","en","False","finances, art, auctions","64866","USAToday","http://usatoday.com/","United States","Ohio, United States","English","United States","Print Native"
"739195080","2017-12-07 08:14:46","Salvator Mundi: Da Vinci painting that sold for $450 million headed to Louvre Abu Dhabi","http://rssfeeds.usatoday.com/~/506848614/0/usatodaycomworld-topstories~Salvator-Mundi-Da-Vinci-painting-that-sold-for-million-headed-to-Louvre-Abu-Dhabi/","en","False","art, auctions","64866","USAToday","http://usatoday.com/","United States","Ohio, United States","English","United States","Print Native"
"743679703","2017-12-12 06:00:32","Mueller's investigation is closing in on Trump. Congress must protect him | Max Bergmann and Max Boot","https://www.theguardian.com/commentisfree/2017/dec/12/robert-mueller-trump-congress-protect-investigation","en","False","politics and government, united states politics and government, armament, defense and military forces, crime and criminals, ethics, international relations","623382","Guardian - United States","http://www.theguardian.com/us","United States","","English","","Print Native"
"623243655","2017-05-12 11:19:02","Trump's tax lawyer says past 10 years show no Russian income","http://feeds.nydailynews.com/~r/nydnrss/sports/hockey/devils/~3/25OMgDS7XHg/trump-tax-lawyer-10-years-show-no-russian-income-article-1.3159355","en","True","politics and government, finances, taxation","8","Daily News","http://www.nydailynews.com/","United States","NY, USA","English","United States","Print Native"
"698711961","2017-05-12 00:00:00","Trump's tax returns from past 10 years show he received money from Russia twice — for Miss Universe pageant and property sold to a Russian billionaire","http://www.businessinsider.com/trump-tax-returns-show-no-income-of-any-type-from-russian-sources-with-exceptions-2017-5","en","True","politics and government, finances, taxation","18710","Business Insider","http://www.businessinsider.com","United States","","English","United States","Digital Native"
"726091930","2017-11-15 14:49:44","'Dossier' author Christopher Steele: Trump's hotel and land deals with Russians 'need' to be examined","http://feedproxy.google.com/~r/businessinsider/~3/Y0bEG84fSJw/christopher-steele-trump-hotel-land-deals-russia-dossier-2017-11","en","False","politics and government, finances","18710","Business Insider","http://www.businessinsider.com","United States","","English","United States","Digital Native"
"759214047","2017-12-31 07:00:29","The top US news stories of 2017: postcards from Trump's America","https://www.theguardian.com/us-news/2017/dec/31/the-top-us-news-stories-of-2017-postcards-from-trumps-america","en","False","politics and government, united states politics and government, hurricanes and tropical storms, fires and firefighters","623382","Guardian - United States","http://www.theguardian.com/us","United States","","English","","Print Native"
"726828699","2017-11-16 19:03:03","A Leonardo da Vinci Painting Just Sold for $450 Million. Here’s How Experts Figured Out It Was Real","http://feedproxy.google.com/~r/time/topstories/~3/c73ugm6IWnA/","en","False","art","4419","Time","http://time.com","United States","","English","United States",""
"661216206","2017-07-21 11:46:01","When Will President Trump Fire Robert Mueller?","http://feedproxy.google.com/~r/TheAtlantic/~3/RVNfqiCmI_4/","en","False","politics and government, united states politics and government, armament, defense and military forces, united states armament and defense","1110","The Atlantic","http://www.theatlantic.com/","United States","","English","United States","Print Native"
"687837437","2017-08-28 08:00:00","Analysis | Trump’s long history of seeking a politically inconvenient business deal in Russia","https://www.washingtonpost.com/news/politics/wp/2017/08/28/trumps-long-history-of-seeking-a-politically-inconvenient-business-deal-in-russia/?utm_term=.290e042a9e3d","en","False","politics and government, finances, united states politics and government, elections","2","Washington Post","http://washingtonpost.com","United States","DC, USA","English","United States","Print Native"
"620779931","2017-05-08 08:27:55","Sports Writer: Eric Trump Told Me Family's Golf Courses Had Russian Investors","http://www.huffingtonpost.com/2017/05/07/eric-trump-russia-golf_n_16485238.html","en","False","politics and government, finances","27502","Huffington Post","http://www.huffingtonpost.com/#","United States","","English","United States",""
"726743465","2017-11-16 15:13:00","How a lost Leonardo da Vinci painting went from $59 to $450 million","http://feedproxy.google.com/~r/businessinsider/~3/AWlublTI86g/how-a-lost-leonardo-da-vinci-painting-went-from-69-to-450-million-2017-11","en","False","art","18710","Business Insider","http://www.businessinsider.com","United States","","English","United States","Digital Native"
"806473115","2016-11-30 00:00:00","Sotheby’s, a Prized Art Client and His $47.5 Million da Vinci Markup","https://www.bloomberg.com/news/articles/2016-11-30/sotheby-s-a-prized-client-and-his-47-5-million-leonardo-markup","en","False","art, housing","40944","Bloomberg","http://bloomberg.com","United States","","English","United States","Digital Native"
"695310758","2017-03-10 09:20:09","Report Details Potential Ties Between Trump, Russian Oligarch","http://www.newsmax.com/Newsfront/Russian-Oligarch-Trump/2017/03/10/id/778092/","en","False","finances, suits and litigation, housing","25349","NewsMax","http://www.newsmax.com","United States","","English","United States","Digital Native"
"634807544","2017-05-12 08:00:00","Trump Lawyers Say He Had No Russian Income or Debt, With Some Exceptions","https://www.nytimes.com/2017/05/12/us/politics/trump-russia-tax-returns.html?_r=1","en","False","finances, housing","1","New York Times","http://nytimes.com","United States","NY, USA","English","United States","Print Native"
"695460333","2017-01-11 07:00:00","These are Donald Trump's ties to Russia","https://amp.cnn.com/cnn/2017/01/11/politics/trump-ties-with-russia/index.html","en","False","politics and government, finances, united states politics and government","1095","CNN","http://www.cnn.com/","United States","GA, USA","English","United States","Video Broadcast"
"586696709","2017-02-27 09:34:00","Everything We Know—and Don’t Know—About Trump’s Ties to Russia","http://www.slate.com/blogs/the_slatest/2017/02/27/flynn_the_dossier_regular_contact_what_exactly_do_we_know_about_trump_s.html","en","False","politics and government, computers and the internet, united states politics and government, united states international relations, international relations","19643","Slate.com","http://www.slate.com","United States","","English","United States","Digital Native"
"667766008","2017-08-02 01:51:25","Departures force Monaco to rebuild for bid at title defense","http://rssfeeds.usatoday.com/~/419245718/0/usatoday-newstopstories~Departures-force-Monaco-to-rebuild-for-bid-at-title-defense/","en","True","soccer, athletics and sports","64866","USAToday","http://usatoday.com/","United States","Ohio, United States","English","United States","Print Native"
"807062372","2017-11-28 16:45:07","Putin's daughter is linked to Trump commerce secretary Wilbur Ross","http://www.newsweek.com/trump-russia-investigation-wilbur-ross-putin-daughter-business-724417?utm_campaign=NewsweekTwitter&utm_source=Twitter&utm_medium=Social","en","False","","2","Washington Post","http://washingtonpost.com","United States","DC, USA","English","United States","Print Native"
"692204602","2017-07-20 00:00:00","Mueller has expanded the Russia probe to include Trump's business dealings — here's what he's looking at","http://www.businessinsider.com/mueller-russia-investigation-trump-business-follow-money-2017-7","en","False","politics and government, finances, elections, ethics, frauds and swindling, organized crime","18710","Business Insider","http://www.businessinsider.com","United States","","English","United States","Digital Native"
"821987063","2018-03-13 15:15:42","High-end art sales boom in 2017, but it's only a partial market rebound","http://feeds.reuters.com/~r/news/artsculture/~3/J0HAiWvlu2Y/high-end-art-sales-boom-in-2017-but-its-only-a-partial-market-rebound-idUSKCN1GP2IQ","en","False","finances, art, sales, prices (fares, fees and rates), records and achievements","4442","Reuters","http://www.reuters.com","United States","PA, USA","English","none","Other"
"797134116","2017-05-12 00:00:00","Trump's $100 Million 'Exceptions' in Russian Income","https://www.theatlantic.com/politics/archive/2017/05/trumps-100-million-in-russian-income/526530/?utm_source=twb","en","False","finances","1110","The Atlantic","http://www.theatlantic.com/","United States","","English","United States","Print Native"
"592109550","2017-03-10 13:54:56","This Palm Beach Post story is peak Trump-Russia media frenzy","https://www.washingtonpost.com/news/the-fix/wp/2017/03/10/this-palm-beach-post-story-is-peak-trump-russia-media-frenzy/","en","False","politics and government, finances, united states politics and government, news and news media, media","2","Washington Post","http://washingtonpost.com","United States","DC, USA","English","United States","Print Native"
"806409034","2017-11-15 00:00:00","'Dossier' author Christopher Steele: Trump's hotel and land deals with Russians need to be examined","https://amp.businessinsider.com/christopher-steele-trump-hotel-land-deals-russia-dossier-2017-11","en","False","finances, books and literature","18710","Business Insider","http://www.businessinsider.com","United States","","English","United States","Digital Native"
"827524150","2018-03-20 02:00:31","Russian Roulette review: as Joe Biden said, 'If this is true, it's treason'","https://www.theguardian.com/books/2018/mar/20/russian-roulette-review-donald-trump-joe-biden-treason","en","False","politics and government, books and literature, united states politics and government","623382","Guardian - United States","http://www.theguardian.com/us","United States","","English","","Print Native"
"807018169","2017-02-24 07:59:50","London Sales Will Gauge Art Market’s Health in Trump Era","https://www.nytimes.com/2017/02/24/arts/design/art-sales-london-sothebys-christies.html?partner=rss&emc=rss&utm_source=dlvr.it&utm_medium=twitter","en","False","finances, art, mergers, acquisitions and divestitures, auctions","1","New York Times","http://nytimes.com","United States","NY, USA","English","United States","Print Native"
"588895165","2017-03-03 16:15:45","The GOP test: Trump&#8217;s taxes","http://www.washingtonpost.com/blogs/right-turn/wp/2017/03/03/the-gop-test-trumps-taxes/","en","False","politics and government, law and legislation, finances, united states politics and government, taxation","2","Washington Post","http://washingtonpost.com","United States","DC, USA","English","United States","Print Native"
"630534631","2017-05-25 15:17:14","Wilbur Ross has links to Russia that he won't answer questions about","http://www.businessinsider.com/trump-russia-connection-and-wilbur-ross-2017-5","en","False","politics and government, united states politics and government, elections, ethics, international relations, biographical information","18710","Business Insider","http://www.businessinsider.com","United States","","English","United States","Digital Native"
"713114786","2016-07-30 11:55:59","British Newspaper Reports Tangled Web of Connections Linking Trump, Putin","http://www.Newsmax.com/Newsfront/Trump-Putin-hacking-russia/2016/07/30/id/741347","en","False","politics and government, computers and the internet, united states politics and government, elections, news and news media, media","25349","NewsMax","http://www.newsmax.com","United States","","English","United States","Digital Native"
"596592945","2017-03-10 07:00:00","The Daily 202: Trump team taking more and more credit for Obama successes","https://www.washingtonpost.com/news/powerpost/paloma/daily-202/2017/03/10/daily-202-trump-team-taking-more-and-more-credit-for-obama-successes/58c2661ae9b69b1406c75d59/?utm_term=.a08a823d4222&wpisrc=nl_daily202&wpmm=1","en","False","politics and government, united states politics and government, armament, defense and military forces, united states armament and defense","2","Washington Post","http://washingtonpost.com","United States","DC, USA","English","United States","Print Native"
"835341589","2018-03-29 10:36:33","Buyers vs. Sellers as PSG faces Monaco in League Cup final","http://rssfeeds.usatoday.com/~/535853368/0/usatodaycomsports-topstories~Buyers-vs-Sellers-as-PSG-faces-Monaco-in-League-Cup-final/","en","True","finances, soccer, mergers, acquisitions and divestitures, athletics and sports","64866","USAToday","http://usatoday.com/","United States","Ohio, United States","English","United States","Print Native"
"784845335","2018-01-30 18:16:24","The 25 richest Russian oligarchs on the 'Putin list' that the US just released","http://feedproxy.google.com/~r/businessinsider/~3/0ngfGmM2lqY/richest-russian-oligarchs-putin-list-2018-1","en","False","politics and government, finances, united states politics and government, ethics","18710","Business Insider","http://www.businessinsider.com","United States","","English","United States","Digital Native"
"797474062","2017-05-12 14:45:39","Trump lawyers push back against Russia ties in letter","https://www.cnbc.com/2017/05/12/trump-lawyer-says-tax-returns-from-past-10-years-show-no-income-of-any-type-from-russian-souces-with-few-exceptions-report.html","en","True","politics and government, finances, taxation","1755","CNBC","http://www.cnbc.com/","United States","","English","United States","Video Broadcast"
"695003295","2017-03-01 12:24:57","(WATCH) Trump's Russia Connections: 30+ Of Them | HuffPost","http://www.huffingtonpost.com/entry/watch-trumps-russia-connections-30-of-them_us_58b6fe4be4b015675cf65af5","en","False","politics and government, united states politics and government","27502","Huffington Post","http://www.huffingtonpost.com/#","United States","","English","United States",""
"512694347","2016-09-12 19:51:53","Trump loves Vladmir Putin. Could his tax returns explain why?","https://www.washingtonpost.com/opinions/trump-loves-vladmir-putin-could-his-tax-returns-explain-why/2016/09/12/fe797fb0-7923-11e6-beac-57a4a412e93a_story.html","en","False","politics and government, computers and the internet, finances, united states politics and government, elections, taxation, news and news media, ethics, frauds and swindling","2","Washington Post","http://washingtonpost.com","United States","DC, USA","English","United States","Print Native"
"554774973","2016-12-14 15:35:18","A penthouse at one of New York's most billionaire-packed towers has listed for $59 million","http://feedproxy.google.com/~r/businessinsider/~3/fnZufX-1EQw/penthouse-at-15-cpw-on-sale-for-59-million-2016-12","en","False","finances, housing, condominiums","18710","Business Insider","http://www.businessinsider.com","United States","","English","United States","Digital Native"
"862998631","2018-04-30 23:12:35","Leaked questions reveal what Mueller wants to ask Trump about Russia","https://www.theguardian.com/us-news/2018/apr/30/robert-mueller-donald-trump-russia-investigation-interview-questions","en","False","politics and government, united states politics and government, elections, presidents and presidency (us), ethics, frauds and swindling","623382","Guardian - United States","http://www.theguardian.com/us","United States","","English","","Print Native"
"863189195","2016-01-15 00:00:00","Meet the big shots who live at 15 Central Park West, the world's most powerful address","http://www.businessinsider.com/15-central-park-west-residents-2016-1/?utm_source=feedburner&utm_medium=referral","en","False","housing, agriculture, condominiums","18710","Business Insider","http://www.businessinsider.com","United States","","English","United States","Digital Native"
"700429561","2017-02-08 11:00:00","Oprah Was Behind One of the Biggest Private Art Deals of 2016, Source Says","https://www.bloomberg.com/news/articles/2017-02-08/oprah-said-to-snag-150-million-selling-klimt-to-chinese-buyer","en","False","finances, art, auctions, collectors and collections","40944","Bloomberg","http://bloomberg.com","United States","","English","United States","Digital Native"
"725789596","2017-11-15 06:15:39","'Unimaginable discovery': Long-lost da Vinci painting to fetch at least $100 million at auction","https://www.washingtonpost.com/news/morning-mix/wp/2017/11/15/unimaginable-discovery-long-lost-da-vinci-painting-to-fetch-at-least-100-million-at-auction/","en","False","art, auctions","2","Washington Post","http://washingtonpost.com","United States","DC, USA","English","United States","Print Native"
"774418864","2018-01-18 17:37:45","Fusion GPS interview with House panel leaves huge pile of breadcrumbs for Trump-Russia investigators","http://feedproxy.google.com/~r/businessinsider/~3/QIlqGhsG2-Y/read-fusion-gps-glenn-simpson-interview-with-house-intelligence-committee-2018-1","en","False","politics and government, united states politics and government, crime and criminals, ethics","18710","Business Insider","http://www.businessinsider.com","United States","","English","United States","Digital Native"
"494924371","2016-07-29 06:28:11","Here’s what we know about Donald Trump and his ties to Russia","https://www.washingtonpost.com/politics/heres-what-we-know-about-donald-trump-and-his-ties-to-russia/2016/07/29/1268b5ec-54e7-11e6-88eb-7dda4e2f2aec_story.html","en","False","politics and government, finances, united states politics and government, elections, taxation","2","Washington Post","http://washingtonpost.com","United States","DC, USA","English","United States","Print Native"
"551875574","2016-12-08 06:40:12","Russians flock to U.S. real estate after Trump victory","http://rss.cnn.com/~r/rss/cnn_latest/~3/3IlQD4egUhQ/index.html","en","False","","1095","CNN","http://www.cnn.com/","United States","GA, USA","English","United States","Video Broadcast"
"603852488","2016-05-03 04:00:00","Trump says he has ‘nothing to do with Russia.’ The past 30 years show otherwise.","https://www.washingtonpost.com/politics/trump-says-he-has-nothing-to-do-with-russia-thirty-years-of-history-shows-otherwise/2017/01/11/b7f20c5a-d829-11e6-b8b2-cb5164beba6b_story.html?tid=pm_politics_pop&utm_term=.530c1aa703aa","en","False","politics and government, finances, elections","2","Washington Post","http://washingtonpost.com","United States","DC, USA","English","United States","Print Native"
"592492050","2017-03-11 10:54:42","FAA: Expect VIP movement near Hagerstown, Maryland, tomorrow -- POTUS to House chairs on passing health care bill: “A GOOD JOB, AMAZING” -- SPRING FORWARD at 2 a.m. -- THE SHOWS and weekend reads -- B’DAY: Rupert Murdoch","http://www.politico.com/tipsheets/playbook/2017/03/faa-expect-vip-movement-near-hagerstown-maryland-tomorrow-potus-to-house-chairs-on-passing-health-care-bill-a-good-job-amazing-spring-forward-at-2-am-the-shows-and-weekend-reads-bday-rupert-murdoch-219169","en","False","medicine and health","18268","Politico","http://politico.com","United States","","English","United States","Print Native"
"623253906","2017-05-12 11:52:38","Trump Lawyers Say Tax Returns Show Little Income From Russians","https://www.bloomberg.com/politics/articles/2017-05-12/trump-lawyers-say-tax-returns-show-little-income-from-russians","en","False","politics and government, finances, taxation, sales","40944","Bloomberg","http://bloomberg.com","United States","","English","United States","Digital Native"
