stories_id,publish_date,title,url,language,ap_syndicated,themes,media_id,media_name,media_url,media_pub_country,media_pub_state,media_language,media_about_country,media_media_type
"490625819","2016-07-18 13:39:47","UPDATE 1-Ukraine fertiliser plant attracts no bids, derailing privatisation","http://feeds.reuters.com/~r/reuters/financialsNews/~3/3-C6FOn7HBU/ukraine-crisis-privatisation-opz-idUSL8N1A44XL","en","False","finances, taxation, mergers, acquisitions and divestitures","4442","Reuters","http://www.reuters.com","United States","PA, USA","English","none","Other"
"499230020","2016-08-01 08:00:00","How Paul Manafort Wielded Power in Ukraine Before Advising Donald Trump","http://www.nytimes.com/2016/08/01/us/paul-manafort-ukraine-donald-trump.html?&_r=0","en","False","politics and government, united states politics and government, elections","1","New York Times","http://nytimes.com","United States","NY, USA","English","United States","Print Native"
"503777674","2016-08-22 04:06:52","RPT-Promised prosperity never arrived in Russian-held Crimea, locals say","http://feeds.reuters.com/~r/news/usmarkets/~3/Z-kGOESErHA/ukraine-crisis-crimea-idUSL8N1B318K","en","False","politics and government, labor, wages and salaries, prices (fares, fees and rates)","4442","Reuters","http://www.reuters.com","United States","PA, USA","English","none","Other"
"469721754","2016-05-23 11:21:21","Trump Presidency Will Be Another Disaster","http://www.huffingtonpost.com/diane-m-francis/trump-presidency-will-be-_b_10081712.html","en","False","politics and government, united states politics and government, elections, presidents and presidency (us), news and news media, media","27502","Huffington Post","http://www.huffingtonpost.com/#","United States","","English","United States",""
"551444600","2016-12-07 08:12:01","UPDATE 1-Major Ukraine privatisation flops as plant attracts no bids","http://feeds.reuters.com/~r/reuters/basicmaterialsNews/~3/qXcjhPhtnfg/ukraine-crisis-privatisation-idUSL5N1E234J","en","False","politics and government, finances, privatization, economic conditions and trends, mergers, acquisitions and divestitures","4442","Reuters","http://www.reuters.com","United States","PA, USA","English","none","Other"
"584420658","2017-02-21 16:28:55","Austria Approves Ukrainian's Extradition to U.S.","https://www.wsj.com/articles/austria-approves-ukrainian-dmytro-firtashs-extradition-to-u-s-1487696693?mod=fox_australian","en","False","politics and government, extradition","18839","blogs.wsj.com","http://blogs.wsj.com","United States","","English","United States","Print Native"
"625545063","2017-05-16 08:51:00","Manafort got $3.5 million mystery mortgage, paid no tax","http://www.cnbc.com/2017/05/16/manafort-got-mystery-mortgage-paid-no-tax.html","en","False","politics and government, finances, taxation, mortgages","1755","CNBC","http://www.cnbc.com/","United States","","English","United States","Video Broadcast"
"692868194","2017-05-17 00:00:00","Feds subpoena records for $3.5M mystery mortgage on Manafort's home","https://www.nbcnews.com/news/us-news/manafort-got-3-5m-mystery-mortgage-paid-no-tax-n759866?cid=sm_npd_ms_tw_ma","en","False","","25499","NBC News","http://www.nbcnews.com","United States","","English","United States",""
"636862278","2015-12-02 13:59:57","Ukrainian mogul Firtash predicts Kiev government will fall next year","http://feeds.reuters.com/~r/Reuters/worldNews/~3/z6rwtJ9_TNY/story01.htm","en","False","politics and government, finances","4442","Reuters","http://www.reuters.com","United States","PA, USA","English","none","Other"
"528175121","2016-10-14 11:55:00","How Corruption Corrodes Ukraine's Economy","http://www.forbes.com/sites/kenrapoza/2016/10/14/how-corruption-corrodes-ukraines-economy/","en","False","politics and government, finances, ethics, banks and banking, economic conditions and trends, credit","1104","Forbes","http://www.forbes.com/","United States","","English","United States","Print Native"
"692280257","2017-03-22 00:00:00","Manafort once worked to 'benefit the Putin government': Report","https://www.nbcnews.com/politics/donald-trump/paul-manafort-once-worked-benefit-putin-government-report-n736881?cid=public-rss_20170322","en","False","politics and government, finances","25499","NBC News","http://www.nbcnews.com","United States","","English","United States",""
"549447750","2016-12-02 15:27:34","Signal for SOS, Heather Podesta for PepsiCo","http://www.politico.com/tipsheets/politico-influence/2016/12/signal-for-sos-heather-podesta-for-pepsico-217681","en","False","politics and government, no index terms from nytimes, united states politics and government, lobbying and lobbyists, armament, defense and military forces, taxation","18268","Politico","http://politico.com","United States","","English","United States","Print Native"
"762158346","2017-12-05 12:56:17","Star Wars in Ukraine: Poroshenko vs Kolomoisky","https://www.politico.eu/article/star-wars-in-ukraine-poroshenko-vs-kolomoisky/","en","False","politics and government","18268","Politico","http://politico.com","United States","","English","United States","Print Native"
"797451972","2017-10-04 00:00:00","Ex-Trump adviser Paul Manafort conspired to mislead bankruptcy court, son-in-law charges","https://www.usatoday.com/story/money/2017/10/04/ex-trump-adviser-paul-manafort-conspired-mislead-bankruptcy-court-son-in-law-charges/723689001/?utm_source=feedblitz&utm_medium=FeedBlitzRss&utm_campaign=usatodaycommoney-topstories","en","False","finances, crime and criminals, ethics, banks and banking, frauds and swindling, housing, organized crime, bankruptcies","64866","USAToday","http://usatoday.com/","United States","Ohio, United States","English","United States","Print Native"
"800813431","2017-04-12 00:00:00","After Campaign Exit, Manafort Borrowed From Businesses With Trump Ties - The New York Times","https://mobile.nytimes.com/2017/04/12/us/politics/paul-manafort-donald-trump.html?emc=edit_na_20170412&nl=breaking-news&nlid=64804304&ref=cta&_r=0&referer=","en","False","politics and government, finances, united states politics and government, elections, presidents and presidency (us), ethics, biographical information, credit","1","New York Times","http://nytimes.com","United States","NY, USA","English","United States","Print Native"
"713049088","2016-08-01 10:42:25","Manafort Built Political, Business Resume in Ukraine Before Advising Trump","http://www.Newsmax.com/Politics/Paul-Manafort-Political-Resume-Ukraine-Trump/2016/08/01/id/741514","en","False","politics and government, united states politics and government, elections, united states international relations, international relations, biographical information","25349","NewsMax","http://www.newsmax.com","United States","","English","United States","Digital Native"
"584144658","2017-02-21 13:43:41","Austrian court sends Ukrainian oligarch to U.S.","http://www.politico.com/www.politico.eu/article/austrian-court-oks-extradition-ukrainian-oligarch-dmitri-firtash/","en","False","politics and government, decisions and verdicts, ethics, extradition, bribery","18268","Politico","http://politico.com","United States","","English","United States","Print Native"
"664240837","2017-07-26 15:21:00","Ex-Manafort Associate Is Top-Tier Comrade of Russian Mobsters, DOJ Says","http://www.nbcnews.com/news/us-news/doj-ex-manafort-associate-firtash-top-tier-comrade-russian-mobsters-n786806?cid=public-rss_20170726","en","False","politics and government, finances, crime and criminals, ethics, organized crime, bribery, racketeering and racketeers","25499","NBC News","http://www.nbcnews.com","United States","","English","United States",""
"713057684","2017-07-26 21:44:14","NBC News: DOJ Says Ex-Manafort Associate Is Linked to Russian Mobsters","http://www.Newsmax.com/Politics/nbc-justice-department-manafort/2017/07/26/id/804028","en","False","politics and government, finances, crime and criminals, ethics, organized crime, bribery","25349","NewsMax","http://www.newsmax.com","United States","","English","United States","Digital Native"
"600589949","2017-03-28 19:56:00","Ex-Trump Aide Manafort Bought New York Homes With Cash","http://www.nbcnews.com/news/us-news/trump-aide-manafort-bought-new-york-homes-cash-n739796?cid=public-rss_20170329","en","False","politics and government, finances, ethics, banks and banking, frauds and swindling, economic conditions and trends, housing","25499","NBC News","http://www.nbcnews.com","United States","","English","United States",""
"584234238","2017-02-21 17:02:23","Austrian court backs extradition of Ukraine businessman Firtash to U.S.","http://feeds.reuters.com/~r/Reuters/worldNews/~3/DkwV9pgfoAs/us-ukraine-firtash-idUSKBN1602OW","en","False","politics and government, decisions and verdicts, crime and criminals, ethics, frauds and swindling, extradition, bribery","4442","Reuters","http://www.reuters.com","United States","PA, USA","English","none","Other"
"664302429","2017-07-26 18:07:49","Feds call ex-Manafort associate Dmytro Firtash a top-tier player in Russian organized crime","http://rssfeeds.usatoday.com/~/412002394/0/usatoday-newstopstories~Feds-call-exManafort-associate-Dmytro-Firtash-a-toptier-player-in-Russian-organized-crime/","en","False","crime and criminals, extradition, organized crime","64866","USAToday","http://usatoday.com/","United States","Ohio, United States","English","United States","Print Native"
"506664479","2016-05-27 07:51:17","Trump campaign brings in lobbyists for key posts","http://www.politico.com/story/2016/04/trump-turns-over-his-campaign-to-lobbyists-222242#ixzz49jeRgCDb","en","False","politics and government, finances, united states politics and government, elections, homosexuality, suits and litigation, lobbying and lobbyists","18268","Politico","http://politico.com","United States","","English","United States","Print Native"
"495873935","2016-08-01 06:15:58","Top Trump Aide Previously Wielded Influence in Ukraine","http://www.nytimes.com/2016/08/01/us/paul-manafort-ukraine-donald-trump.html?hp&action=click&pgtype=Homepage&clickSource=story-heading&module=a-lede-package-region&region=top-news&WT.nav=top-news&partner=rss&emc=rss","en","False","politics and government, united states politics and government, elections","1","New York Times","http://nytimes.com","United States","NY, USA","English","United States","Print Native"
"584425961","2017-02-21 16:28:55","Austria Approves Ukrainian's Extradition to U.S.","https://www.wsj.com/articles/austria-approves-ukrainian-dmytro-firtashs-extradition-to-u-s-1487696693?mod=fox_australian","en","False","politics and government, extradition","1150","Wall Street Journal","http://online.wsj.com/","United States","New York, United States","English","United States","Print Native"
"807064115","2017-02-21 00:00:00","Austrian court approves extradition of Ukrainian oligarch tied to Trump campaign adviser","https://www.washingtonpost.com/world/europe/austria-approves-extradition-of-ukrainian-oligarch-tied-to-trump-campaign-aides/2017/02/21/13c71542-f83d-11e6-aa1e-5f735ee31334_story.html?utm_term=.c73903c07c66&tid=sm_tw","en","False","politics and government, finances, ethics, extradition","2","Washington Post","http://washingtonpost.com","United States","DC, USA","English","United States","Print Native"
"584088084","2017-02-21 11:19:17","Austria approves extradition of Ukrainian oligarch tied to Trump campaign aides","https://www.washingtonpost.com/world/europe/austria-approves-extradition-of-ukrainian-oligarch-tied-to-trump-campaign-aides/2017/02/21/13c71542-f83d-11e6-aa1e-5f735ee31334_story.html","en","False","politics and government, ethics, extradition, bribery","2","Washington Post","http://washingtonpost.com","United States","DC, USA","English","United States","Print Native"
"683657479","2017-02-21 17:09:04","Austrian court backs extradition of Ukraine businessman Firtash to U.S.","http://uk.reuters.com/article/uk-ukraine-firtash-idUKKBN1601JV","en","False","politics and government, decisions and verdicts, ethics, legislatures and parliaments, extradition, bribery","4442","Reuters","http://www.reuters.com","United States","PA, USA","English","none","Other"
"572707789","2017-01-26 21:05:37","Ukraine: Reflections on the Maidan Revolution, a Voyage to Odessa, Donald Trump, Trans-Atlantic Disarray and Ironies of ""Western Modernity""","http://www.huffingtonpost.com/nikolas-kozloff/ukraine-reflections-on-th_b_14424790.html","en","False","politics and government","27502","Huffington Post","http://www.huffingtonpost.com/#","United States","","English","United States",""
"503529429","2016-08-21 07:24:54","Promised prosperity never arrived in Russian-held Crimea, locals say","http://feeds.reuters.com/~r/Reuters/worldNews/~3/E_Pxx3Qb7bo/us-ukraine-crisis-crimea-idUSKCN10W0EM","en","False","politics and government, labor, wages and salaries, economic conditions and trends","4442","Reuters","http://www.reuters.com","United States","PA, USA","English","none","Other"
"664434369","2017-02-21 07:00:00","Austrian court approves extradition of Ukrainian oligarch tied to Trump campaign adviser","https://www.washingtonpost.com/world/europe/austria-approves-extradition-of-ukrainian-oligarch-tied-to-trump-campaign-aides/2017/02/21/13c71542-f83d-11e6-aa1e-5f735ee31334_story.html?utm_term=.23d4cff42587","en","False","politics and government, ethics, frauds and swindling, extradition, bribery","2","Washington Post","http://washingtonpost.com","United States","DC, USA","English","United States","Print Native"
"928400181","2017-04-04 00:00:00","Feds Subpoena Records for $3.5M Mystery Mortgage on Manafort's Home","https://www.nbcnews.com/news/us-news/...no-tax-n759866","en","False","politics and government, finances, ethics, housing, mortgages","25499","NBC News","http://www.nbcnews.com","United States","","English","United States",""
"621266079","2016-08-19 06:10:22","Paul Manafort Quits Trump Campaign","http://www.newsmax.com/Newsfront/manafort-resign-trump-campaign/2016/08/19/id/744304/","en","False","politics and government, united states politics and government, elections, presidents and presidency (us), presidential elections (us), appointments and executive changes, ethics, biographical information, conventions, national (us), conventions and conferences, suspensions, dismissals and resignations","25349","NewsMax","http://www.newsmax.com","United States","","English","United States","Digital Native"
"721486335","2017-10-30 10:11:32","What You Need To Know About Paul Manafort And Rick Gates | HuffPost","https://www.huffingtonpost.com/entry/paul-manafort-need-to-know_us_59f71872e4b03cd20b82dfcb?utm_medium=email&utm_campaign=__TheMorningEmail__103117&utm_content=__TheMorningEmail__103117+CID_f5906a8691028df6ead8f0f9a53be89b&utm_source=Email%20marketing%20software&utm_term=HuffPost&ncid=newsltushpmgnews__TheMorningEmail__103117","en","False","politics and government, united states politics and government, lobbying and lobbyists, taxation, ethics","27502","Huffington Post","http://www.huffingtonpost.com/#","United States","","English","United States",""
"784702666","2017-08-30 16:11:30","Austrian court rejects Spanish extradition request for Ukrainian tycoo","https://www.reuters.com/article/us-ukraine-firtash-austria-extradition-idUSKCN1BA23W","en","False","politics and government, ethics, extradition, bribery","4442","Reuters","http://www.reuters.com","United States","PA, USA","English","none","Other"
"634733608","2017-05-17 00:00:00","Feds subpoena records for $3.5M mystery mortgage on Manafort's home","http://www.nbcnews.com/news/us-news/feds-subpoena-records-3-5m-mortgage-manaforts-home-n759866","en","False","politics and government, finances, ethics, housing, mortgages","25499","NBC News","http://www.nbcnews.com","United States","","English","United States",""
"493560263","2016-07-25 21:11:18","To Democrats, Email Hack Suggests Trump Has New Supporter: Putin","http://www.nytimes.com/2016/07/26/us/politics/kremlin-donald-trump-vladimir-putin.html?partner=rss&emc=rss","en","False","politics and government, united states politics and government, elections, united states international relations, international relations","1","New York Times","http://nytimes.com","United States","NY, USA","English","United States","Print Native"
"871945902","2018-05-11 05:21:11.788723","DOJ: Ex-Manafort Associate Firtash Is Top-Tier Comrade of Russian Mobsters","https://www.nbcnews.com/news/us-news/doj-ex-manafort-associate-firtash-top-tier-comrade-russian-mobsters-n786806?cid=sm_npd_nn_tw_np","en","True","politics and government, finances, news and news media, crime and criminals, ethics, organized crime, bribery, racketeering and racketeers","25499","NBC News","http://www.nbcnews.com","United States","","English","United States",""
"612162785","2016-08-21 09:54:24","Promised Prosperity Never Arrived in Russian-Held Crimea, Locals Say","http://fortune.com/2016/08/21/russia-crimea-prosperity/","en","False","politics and government, labor, wages and salaries","1095","CNN","http://www.cnn.com/","United States","GA, USA","English","United States","Video Broadcast"
"648837348","2017-06-27 06:13:57","What Did Ex-Trump Aide Paul Manafort Really Do in Ukraine?","http://www.nbcnews.com/news/us-news/what-did-ex-trump-aide-paul-manafort-really-do-ukraine-n775431?cid=public-rss_20170627","en","False","politics and government, united states politics and government, elections, united states international relations, international relations","25499","NBC News","http://www.nbcnews.com","United States","","English","United States",""
"447728540","2016-04-20 23:24:31","Trump campaign brings in lobbyists for key posts","http://www.politico.com/story/2016/04/trump-turns-over-his-campaign-to-lobbyists-222242","en","False","politics and government, finances, united states politics and government, elections, homosexuality, suits and litigation, lobbying and lobbyists, ethics","18268","Politico","http://politico.com","United States","","English","United States","Print Native"
"1001554194","2017-10-30 14:11:32","What You Need To Know About Paul Manafort And Rick Gates","https://www.huffingtonpost.com.au/2017/10/30/what-you-need-to-know-about-paul-manafort-and-rick-gates_a_23260676/","en","False","politics and government, finances, united states politics and government, lobbying and lobbyists, taxation, ethics, frauds and swindling","27502","Huffington Post","http://www.huffingtonpost.com/#","United States","","English","United States",""
"596630859","2017-03-20 18:24:00","Timeline: Trump Associates and Aides And Their Brushes With Russia","http://www.nbcnews.com/news/us-news/timeline-trump-associates-aides-their-brushes-russia-n736106?cid=public-rss_20170320","en","False","politics and government, united states politics and government, united states international relations, international relations","25499","NBC News","http://www.nbcnews.com","United States","","English","United States",""
"987993725","2018-09-14 15:42:15.740677","What did ex-Trump aide Paul Manafort really do in Ukraine?","https://www.nbcnews.com/news/amp/ncna775431","en","False","politics and government, united states politics and government, united states international relations, international relations","25499","NBC News","http://www.nbcnews.com","United States","","English","United States",""
"834103871","2018-03-28 04:43:00","An unheard-of problem: The President can't find a lawyer","http://rss.cnn.com/~r/rss/cnn_latest/~3/O6e31y7XiQQ/index.html","en","False","politics and government, finances, united states politics and government, suits and litigation, ethics, legal profession","1095","CNN","http://www.cnn.com/","United States","GA, USA","English","United States","Video Broadcast"
"495729137","2016-07-31 21:23:04","How Paul Manafort Wielded Power in Ukraine Before Advising Donald Trump","http://www.nytimes.com/2016/08/01/us/paul-manafort-ukraine-donald-trump.html?partner=rss&emc=rss","en","False","politics and government, united states politics and government, elections","1","New York Times","http://nytimes.com","United States","NY, USA","English","United States","Print Native"
"502474639","2016-08-18 07:23:00","'Deeply Disturbing': Trump Aide's Russia Ties Under Scrutiny","http://www.nbcnews.com/news/us-news/donald-trump-aide-paul-manafort-scrutinized-russian-business-ties-n631241","en","False","politics and government, united states politics and government, elections","25499","NBC News","http://www.nbcnews.com","United States","","English","United States",""
"961937363","2018-08-23 17:27:25","Lanny Davis, the ultimate Clinton loyalist, is now Michael Cohen’s lawyer. But don’t call it revenge.","https://www.washingtonpost.com/lifestyle/style/lanny-davis-the-ultimate-clinton-loyalist-is-now-michael-cohens-lawyer-but-dont-call-it-revenge/2018/08/23/e1550056-a6b9-11e8-97ce-cc9042272f07_story.html","en","False","politics and government, blacks, news and news media, biographical information","2","Washington Post","http://washingtonpost.com","United States","DC, USA","English","United States","Print Native"
"530989126","2016-10-20 12:28:47","Next U.S. President Has A Ukrainian Problem","http://www.huffingtonpost.com/mark-pfeifle/post_13311_b_12186552.html","en","False","politics and government, united states politics and government, armament, defense and military forces, united states international relations, international relations, embargoes and economic sanctions, war and revolution, civil war and guerrilla warfare","27502","Huffington Post","http://www.huffingtonpost.com/#","United States","","English","United States",""
"664595819","2017-07-27 07:28:40","The Daily 202: Growing GOP backlash to transgender troop ban underscores Trump’s political miscalculation","https://www.washingtonpost.com/news/powerpost/paloma/daily-202/2017/07/27/daily-202-growing-gop-backlash-to-transgender-troop-ban-underscores-trump-s-political-miscalculation/5979535630fb0436795432a6/","en","False","politics and government, united states politics and government, armament, defense and military forces, united states armament and defense","2","Washington Post","http://washingtonpost.com","United States","DC, USA","English","United States","Print Native"
"1056324893","2018-11-05 21:44:35.768099","Donald Trump Aide Paul Manafort Scrutinized for Russian Business Ties","https://www.nbcnews.com/news/us-news/donald-trump-aide-paul-manafort-scrutinized-russian-business-ties-n631241?utm_campaign=crowdfire&utm_content=crowdfire&utm_medium=social&utm_source=twitter#2178746659-tw#1488659634355","en","False","politics and government, united states politics and government, elections","25499","NBC News","http://www.nbcnews.com","United States","","English","United States",""
"1119819130","2018-12-14 18:46:56","To combat dirty money, Britain asks: How did you pay for that mansion?","https://www.washingtonpost.com/business/economy/to-combat-dirty-money-britain-asks-how-did-you-pay-for-that-mansion/2018/12/14/33062c5e-ec38-11e8-baac-2a674e91502b_story.html","en","True","finances, economic conditions and trends, travel and vacations, housing","2","Washington Post","http://washingtonpost.com","United States","DC, USA","English","United States","Print Native"
