stories_id,publish_date,title,url,language,ap_syndicated,themes,media_id,media_name,media_url,media_pub_country,media_pub_state,media_language,media_about_country,media_media_type
"814930947","2018-03-05 18:40:58","The Fix: After speaking with The Post, Nunberg talks to MSNBC, CNN in even more unfiltered interviews","https://www.washingtonpost.com/news/the-fix/wp/2018/03/05/ex-trump-aide-trump-may-very-well-have-done-something-during-the-election-with-the-russians/","en","False","politics and government, united states politics and government, elections, television, news and news media, media, international relations","2","Washington Post","http://washingtonpost.com","United States","DC, USA","English","United States","Print Native"
"803117911","2018-02-20 12:33:53","Trump's cozy past with Russia after 'much tougher' claim ","http://www.nydailynews.com/news/politics/trump-relaxing-russians-claiming-tougher-article-1.3831294","en","False","politics and government, united states politics and government, united states international relations, international relations, international trade and world market, embargoes and economic sanctions","8","Daily News","http://www.nydailynews.com/","United States","NY, USA","English","United States","Print Native"
"924638692","2018-07-10 17:09:29","Donald Trump Jr. said he didn't recall talking to Emin Agalarov. Agalarov remembers it.","https://www.washingtonpost.com/news/politics/wp/2018/07/10/donald-trump-jr-said-he-didnt-recall-talking-to-emin-agalarov-agalarov-remembers-it/","en","False","music, biographical information","2","Washington Post","http://washingtonpost.com","United States","DC, USA","English","United States","Print Native"
"775161777","2018-01-19 12:21:32","Russians under every rock","https://www.washingtonpost.com/blogs/right-turn/wp/2018/01/19/russians-under-every-rock/","en","False","politics and government, finances, elections, ethics","2","Washington Post","http://washingtonpost.com","United States","DC, USA","English","United States","Print Native"
"912641899","2018-06-26 16:07:44","Trump's Russian pop-star ally releases a music video Trump will hate","https://www.washingtonpost.com/news/the-fix/wp/2018/06/26/trumps-russian-pop-star-ally-releases-a-music-video-trump-will-hate/","en","False","recordings (audio), music","2","Washington Post","http://washingtonpost.com","United States","DC, USA","English","United States","Print Native"
"815034544","2018-03-05 22:08:22","Fired Trump Aide Speculates Wildly About Trump, And The Mainstream Media Laps It Up","http://dailycaller.com/2018/03/05/sam-nunberg-mainstream-media/","en","False","politics and government, united states politics and government, news and news media, media","18775","Daily Caller","http://dailycaller.com","United States","","English","United States","Digital Native"
"856888823","2018-04-23 17:18:00","Flight records undercut Trump's claims to Comey about controversial 2013 Moscow trip: Report","https://www.cnbc.com/2018/04/23/flight-records-contradict-trump-on-2013-moscow-trip-report.html","en","False","","1755","CNBC","http://www.cnbc.com/","United States","","English","United States","Video Broadcast"
"944568362","2018-08-02 22:33:05","Singer's lawyer addresses racy video mocking Trump","http://rss.cnn.com/~r/rss/cnn_topstories/~3/mEjJFGhgXjo/pop-star-emin-agalarov-trump-music-video-dossier-sot-ebof-vpx.cnn","en","False","recordings (audio), music","1095","CNN","http://www.cnn.com/","United States","GA, USA","English","United States","Video Broadcast"
"913635120","2018-06-27 15:19:51","John Bolton just did a complete 180 on his Russia stance after meeting with Putin","http://feedproxy.google.com/~r/businessinsider/~3/rd_YHW1bg3c/john-bolton-putin-meeting-russia-policy-shift-2018-6","en","False","politics and government, united states politics and government, elections, united states international relations, international relations","18710","Business Insider","http://www.businessinsider.com","United States","","English","United States","Digital Native"
"912770063","2018-06-26 19:28:48","Russian pop star trolls Trump in music video","http://rss.cnn.com/~r/rss/cnn_topstories/~3/jHNpQxrYwng/emin-agalarov-trump-music-video-murray-dnt-tsr-vpx.cnn","en","False","recordings (audio), music","1095","CNN","http://www.cnn.com/","United States","GA, USA","English","United States","Video Broadcast"
"913839490","2018-06-27 17:35:31","Russian Pop Star Makes Music Video About Trump Collusion","https://www.huffingtonpost.com/entry/russian-pop-star-makes-music-video-about-trump-collusion_us_5b3403ace4b053b0e340a26b","en","False","politics and government, united states politics and government, recordings (audio), music","27502","Huffington Post","http://www.huffingtonpost.com/#","United States","","English","United States",""
"884615047","2018-05-16 00:00:00","‘The gorilla in the room’: Inside Trump’s failed efforts to meet Putin in 2013","https://www.washingtonpost.com/politics/the-gorilla-in-the-room-inside-trumps-failed-efforts-to-meet-putin-in-2013/2018/05/16/1b88fd8c-5920-11e8-b656-a5f8c2a9295d_story.html?utm_term=.7dfd03f89269","en","False","politics and government, united states politics and government, united states international relations, international relations, biographical information","2","Washington Post","http://washingtonpost.com","United States","DC, USA","English","United States","Print Native"
"884770494","2018-05-16 00:00:00","Analysis | 54 things Donald Trump Jr. couldn’t ‘recall’ or ‘remember’ in his testimony","https://www.washingtonpost.com/news/the-fix/wp/2018/05/16/54-things-donald-trump-jr-couldnt-recall-or-remember-in-his-testimony/?utm_term=.94a8f00b0816","en","False","politics and government","2","Washington Post","http://washingtonpost.com","United States","DC, USA","English","United States","Print Native"
"944309373","2018-08-02 18:09:58","Happy Hour Roundup","https://www.washingtonpost.com/blogs/plum-line/wp/2018/08/02/happy-hour-roundup-1410/","en","False","law and legislation, finances, environment, automobiles, air pollution, regulation and deregulation of industry","2","Washington Post","http://washingtonpost.com","United States","DC, USA","English","United States","Print Native"
"817401000","2018-03-08 08:51:13","Trump had presidential ambitions during 2013 Miss Universe trip","http://www.nydailynews.com/news/world/trump-presidential-ambitions-2013-universe-trip-article-1.3862819","en","False","politics and government, books and literature, united states politics and government, presidents and presidency (us)","8","Daily News","http://www.nydailynews.com/","United States","NY, USA","English","United States","Print Native"
"876397002","2018-05-16 09:48:00","Trump Tower meeting was 'bad idea,' Rob Goldstone tells Senate","https://www.nbcnews.com/news/us-news/rob-goldstone-told-senate-trump-tower-meeting-russians-was-bad-n874586?cid=public-rss_20180516","en","True","politics and government, united states politics and government, elections, biographical information","25499","NBC News","http://www.nbcnews.com","United States","","English","United States",""
"851383603","2018-03-05 00:00:00","A Former Trump Adviser Denied Drinking After A Series Of Jaw-Dropping TV Interviews","https://www.buzzfeed.com/zoetillman/former-trump-adviser-says-screw-mueller-subpoena-in-intense?utm_term=.vx6jZ0ma0D#.dl06okBxkL","en","False","politics and government, united states politics and government, television, news and news media, media, ethics","6218","Buzzfeed","http://www.buzzfeed.com","United States","","English","none","Digital Native"
"913702820","2018-06-27 16:17:45","Manafort had $10 million loan from Russian oligarch: court filing","http://feeds.reuters.com/~r/Reuters/PoliticsNews/~3/FcRrGVS6IDQ/manafort-had-10-million-loan-from-russian-oligarch-court-filing-idUSKBN1JN2YF","en","False","politics and government, finances, united states politics and government, frauds and swindling","4442","Reuters","http://www.reuters.com","United States","PA, USA","English","none","Other"
"944480198","2018-08-02 23:31:23","Mueller wants to talk to Russian who set up Trump Tower meeting","https://www.msnbc.com/brian-williams/watch/mueller-wants-to-talk-to-russian-who-set-up-trump-tower-meeting-1291385923778","en","False","","25499","NBC News","http://www.nbcnews.com","United States","","English","United States",""
"912816542","2018-06-26 20:36:37","Russian pop star tied to Trump pokes fun at collusion in new music video","http://rssfeeds.usatoday.com/~/554823434/0/usatoday-newstopstories~Russian-pop-star-tied-to-Trump-pokes-fun-at-collusion-in-new-music-video/","en","False","recordings (audio), music","64866","USAToday","http://usatoday.com/","United States","Ohio, United States","English","United States","Print Native"
"941292160","2018-07-30 18:34:25","‘Never happened’: Giuliani walks back confusing claim of secret Trump Tower meeting","https://www.politico.com/story/2018/07/30/giuliani-trump-tower-meeting-749871","en","False","politics and government, united states politics and government, elections","18268","Politico","http://politico.com","United States","","English","United States","Print Native"
"951958529","2018-08-12 07:02:21","The Donald Trump Cinematic Universe","https://www.politico.com/magazine/story/2018/08/12/movies-donald-trump-cinematic-universe-219348","en","False","motion pictures, sex, reviews, biographical information","18268","Politico","http://politico.com","United States","","English","United States","Print Native"
"876458236","2018-05-16 11:18:00","Music promoter Goldstone offered Trump a meeting with Putin if he visited Moscow in 2015","https://www.cnbc.com/2018/05/16/rob-goldstone-offered-candidate-trump-meeting-with-putin-in-2015.html","en","False","politics and government, united states politics and government, elections","1755","CNBC","http://www.cnbc.com/","United States","","English","United States","Video Broadcast"
"854547371","2018-04-20 12:52:21","The New York Post: DNC sues Trump campaign, Russia, alleging election conspiracy      ","http://www.marketwatch.com/news/story.asp?guid=%7B7EE5EACE-44B8-11E8-97C1-F43298990BC2%7D&siteid=rss&rss=1","en","False","politics and government, computers and the internet, united states politics and government, elections, presidents and presidency (us), suits and litigation","1150","Wall Street Journal","http://online.wsj.com/","United States","New York, United States","English","United States","Print Native"
"909230109","2018-04-27 00:00:00","Trump Jr. And Emin Agalarov Stayed In Touch Throughout The Transition","https://www.buzzfeed.com/chrisgeidner/trump-jr-and-emin-agalarov-stayed-in-touch-during-the?utm_term=.ymeo5rAMk#.nr6MmYOwR","en","False","politics and government, united states politics and government, lobbying and lobbyists","6218","Buzzfeed","http://www.buzzfeed.com","United States","","English","none","Digital Native"
"909303660","2018-05-16 00:00:00","It’s increasingly hard to believe that the Trump Tower meeting wasn’t common knowledge","https://www.washingtonpost.com/news/politics/wp/2018/05/16/its-increasingly-hard-to-believe-that-the-trump-tower-meeting-wasnt-common-knowledge/?gap&utm_term=.a7db71527aaf","en","False","politics and government, united states politics and government","2","Washington Post","http://washingtonpost.com","United States","DC, USA","English","United States","Print Native"
"854823518","2018-04-20 18:56:00","Did Trump stay overnight in Russia in 2013? Evidence points to yes","https://www.nbcnews.com/politics/donald-trump/did-trump-stay-overnight-russia-2013-evidence-points-yes-n867951?cid=public-rss_20180421","en","False","politics and government, news and news media","25499","NBC News","http://www.nbcnews.com","United States","","English","United States",""
"912709215","2018-06-26 17:35:57","The Russian Pop Star Who Played a Role in the Trump Tower Meeting Has a Music Video About It","http://feedproxy.google.com/~r/time/topstories/~3/GncPT5pUe54/","en","False","politics and government, recordings (audio)","4419","Time","http://time.com","United States","","English","United States",""
"891218900","2018-02-05 00:00:00","Analysis | A (so far) complete timeline of the investigation into Trump and Russia","https://www.washingtonpost.com/news/politics/wp/2018/02/05/a-so-far-complete-timeline-of-the-investigation-into-trump-and-russia/?utm_term=.0298265fe684","en","False","politics and government","2","Washington Post","http://washingtonpost.com","United States","DC, USA","English","United States","Print Native"
"912583274","2018-06-26 14:05:00","New video by Russian pop star connected to Trump Tower meeting depicts Trump surrounded by bikini-clad women, Stormy Daniels, Hillary Clinton","http://www.nydailynews.com/entertainment/ny-ent-emin-music-video-trump-20180626-story.html","en","False","politics and government, united states politics and government","8","Daily News","http://www.nydailynews.com/","United States","NY, USA","English","United States","Print Native"
"913193148","2018-06-27 07:15:19","Russian singer trolls US election saga in music video","https://www.washingtonpost.com/entertainment/music/russian-singer-trolls-us-election-saga-in-music-video/2018/06/27/cdeed832-79ed-11e8-ac4e-421ef7165923_story.html","en","True","politics and government, recordings (audio), music","2","Washington Post","http://washingtonpost.com","United States","DC, USA","English","United States","Print Native"
"740332240","2017-12-08 06:15:14","The politics of pop music in 2017","http://rss.cnn.com/~r/rss/cnn_latest/~3/R0WsUCYNEX4/index.html","en","False","politics and government, united states politics and government, elections, music","1095","CNN","http://www.cnn.com/","United States","GA, USA","English","United States","Video Broadcast"
"975260680","2018-07-16 00:00:00","Putin dismisses question about whether Russia has compromising information on Trump","https://www.washingtonpost.com/politics/putin-dismisses-question-about-whether-russia-has-compromising-information-on-trump/2018/07/16/19e29f90-8915-11e8-85ae-511bc1146b0b_story.html?utm_term=.dbc7c61d8416","en","False","politics and government, finances, contests and prizes","2","Washington Post","http://washingtonpost.com","United States","DC, USA","English","United States","Print Native"
"845163727","2018-04-10 08:12:33","Search warrant reveals Mueller's interest in Manafort's actions during Trump campaign","http://rss.cnn.com/~r/rss/cnn_latest/~3/kOhFkpqr-7M/index.html","en","False","politics and government, finances","1095","CNN","http://www.cnn.com/","United States","GA, USA","English","United States","Video Broadcast"
"821670174","2018-03-13 11:58:15","A Trump Trip to Las Vegas Adds Intrigue to the Steele Dossier","https://www.newyorker.com/news/news-desk/a-trump-trip-to-las-vegas-adds-intrigue-to-the-steele-dossier","en","False","politics and government, united states politics and government, presidents and presidency (us), news and news media","1101","New Yorker","http://www.newyorker.com/","United States","","English","United States","Print Native"
"479748782","2016-06-19 15:45:47","Donald Trump, the Russians, and Trump’s Real Enemy, The Bezos Post","http://feedproxy.google.com/~r/breitbart/~3/dGLcPytVc7k/","en","False","politics and government, united states politics and government, elections, presidents and presidency (us), presidential elections (us), news and news media, media","19334","Breitbart","http://www.breitbart.com","United States","","English","United States","Digital Native"
"912703330","2018-06-26 17:14:33","The Russian pop star Emin Agalarov just dropped an insane music video trolling Trump, Clinton, Facebook, and Stormy Daniels","http://feedproxy.google.com/~r/businessinsider/~3/ASaLJoleoB4/emin-agalarov-music-video-trolls-trump-russia-steele-dossier-2018-6","en","False","politics and government, united states politics and government, elections, recordings (audio)","18710","Business Insider","http://www.businessinsider.com","United States","","English","United States","Digital Native"
"657929880","2017-07-15 10:20:29","Trump Jr. associate Rob Goldstone's odd night out in NYC","http://feeds.nydailynews.com/~r/NydnRss/~3/En6HQz2RRgI/trump-jr-associate-rob-goldstone-odd-night-nyc-article-1.3327208","en","False","music","8","Daily News","http://www.nydailynews.com/","United States","NY, USA","English","United States","Print Native"
"655985780","2017-07-11 19:31:41","Timeline of Trump Family Comments on Russia Since June 2016","https://www.wsj.com/articles/timeline-of-trump-family-comments-on-russia-since-june-2016-1499814426?mod=rss_Politics_And_Policy","en","False","politics and government, united states politics and government, elections, presidents and presidency (us)","1150","Wall Street Journal","http://online.wsj.com/","United States","New York, United States","English","United States","Print Native"
"695459542","2017-07-11 08:00:00","How Trump’s ‘Miss Universe’ in Russia Became Ensnared in a Political Inquiry - The New York Times","https://www.nytimes.com/2017/07/11/us/politics/how-trumps-miss-universe-in-russia-became-ensnared-in-a-political-inquiry.html?partner=rss&emc=rss&smid=tw-nytimes&smtyp=cur","en","False","politics and government","1","New York Times","http://nytimes.com","United States","NY, USA","English","United States","Print Native"
"912452699","2017-07-13 11:35:46","Your Evening Briefing","https://www.bloomberg.com/news/articles/2017-07-13/evening-briefing-europe-macron-repeal-agalarov-airbus-yandex","en","False","politics and government","40944","Bloomberg","http://bloomberg.com","United States","","English","United States","Digital Native"
"655152614","2017-07-10 14:56:00","Senate Intel Committee Wants to Talk to Trump Jr., Source Says","http://www.nbcnews.com/politics/donald-trump/senate-intel-committee-wants-talk-donald-trump-jr-source-says-n781381?cid=public-rss_20170710","en","False","politics and government, united states politics and government, elections, presidents and presidency (us), biographical information","25499","NBC News","http://www.nbcnews.com","United States","","English","United States",""
"673040003","2017-08-09 08:00:00","Trump campaign’s Russia ties: Who’s involved - Washington Post","https://www.washingtonpost.com/graphics/national/trump-russia/?utm_term=.ebd1d1bd4598","en","False","politics and government, smoking and tobacco","2","Washington Post","http://washingtonpost.com","United States","DC, USA","English","United States","Print Native"
"634883031","2017-03-20 08:00:00","Exclusive: Powerful Russian Partner Boasts Of Ongoing Access To Trump Family","https://www.forbes.com/sites/noahkirsch/2017/03/20/russian-billionaire-family-trump-ties-ongoing/#3b6027cb69b3","en","False","politics and government, finances","1104","Forbes","http://www.forbes.com/","United States","","English","United States","Print Native"
"998224953","2018-09-20 02:29:19.663051","Did Trump stay overnight in Russia in 2013? Evidence points to yes","https://www.nbcnews.com/politics/donald-trump/did-trump-stay-overnight-russia-2013-evidence-points-yes-n867951?cid=sm_npd_nn_tw_np","en","False","politics and government, united states politics and government, news and news media, media","25499","NBC News","http://www.nbcnews.com","United States","","English","United States",""
"657061119","2017-07-13 22:13:21","The Putin Obsession That Led to Trump Jr.’s Meeting","http://www.politico.com/magazine/story/2017/07/13/the-putin-obsession-that-led-to-trump-jrs-meeting-215374","en","False","politics and government, law and legislation, united states politics and government, united states international relations, international relations, freedom and human rights","18268","Politico","http://politico.com","United States","","English","United States","Print Native"
"494951356","2016-07-29 10:28:19","Despite denial, Trump's connection to Russia go back years","http://www.cbsnews.com/news/election-2016-donald-trump-ties-to-russia-go-back-years-dnc-email-hack/","en","False","politics and government, united states politics and government, elections, presidents and presidency (us), presidential elections (us), biographical information","1752","cbs news","http://www.cbsnews.com/","United States","NY, USA","English","United States","Video Broadcast"
"718373212","2017-11-02 13:29:59","A history of Donald Trump’s business dealings in Russia","https://www.washingtonpost.com/opinions/a-history-of-donald-trumps-business-dealings-in-russia/2017/11/02/fb8eed22-ba9e-11e7-be94-fabb0f1e9ffb_story.html","en","False","politics and government, ethics","2","Washington Post","http://washingtonpost.com","United States","DC, USA","English","United States","Print Native"
"819454510","2018-02-26 00:00:00","Trump’s Miss Universe Gambit","https://www.newyorker.com/magazine/2018/02/26/trumps-miss-universe-gambit?currentPage=all","en","False","contests and prizes","1101","New Yorker","http://www.newyorker.com/","United States","","English","United States","Print Native"
"912605178","2018-06-26 14:56:09","Russian pop star at center of 2016 Trump Tower meeting story trolls US","http://rss.cnn.com/~r/rss/cnn_latest/~3/zI2k9Qqg7bI/index.html","en","False","recordings (audio)","1095","CNN","http://www.cnn.com/","United States","GA, USA","English","United States","Video Broadcast"
"909375763","2018-06-23 00:14:11.996318","Did Trump stay overnight in Russia in 2013? Evidence points to yes","https://www.nbcnews.com/politics/donald-trump/did-trump-stay-overnight-russia-2013-evidence-points-yes-n867951","en","False","politics and government, news and news media","25499","NBC News","http://www.nbcnews.com","United States","","English","United States",""
"984830698","2018-04-20 00:00:00","Democratic Party files lawsuit against Trump campaign, Russia, and WikiLeaks — and it mirrors a move from the Nixon era","https://www.businessinsider.com/democratic-party-lawsuit-trump-russia-wikileaks-2018-4?utm_source=feedburner&utm_medium=referral","en","False","politics and government, united states politics and government, elections, news and news media, media, biographical information","18710","Business Insider","http://www.businessinsider.com","United States","","English","United States","Digital Native"
"1001328806","2018-08-20 00:00:00","How Bill Browder Became Russia’s Most Wanted Man","https://www.newyorker.com/magazine/2018/08/20/how-bill-browder-became-russias-most-wanted-man?mbid=nl_Magazine%20Daily%20list%20081318&CNDID=46142047&utm_source=Silverpop&utm_medium=email&utm_campaign=Magazine%20Daily%20list%20081318&utm_content=&spMailingID=14055783&spUserID=MTY3ODU4OTYwMjk0S0&spJobID=1461199514&spReportId=MTQ2MTE5OTUxNAS2","en","False","politics and government, united states politics and government, news and news media, media, united states international relations, international relations, espionage","1101","New Yorker","http://www.newyorker.com/","United States","","English","United States","Print Native"
"805784991","2017-11-09 00:00:00","Trump's ex-bodyguard nixed offer of Russian women for Trump - CNNPolitics","https://www.cnn.com/2017/11/09/politics/keith-schiller-russian-offer-women-2013-moscow/index.html","en","False","politics and government, united states politics and government, news and news media, ethics, prostitution, united states international relations, international relations","1095","CNN","http://www.cnn.com/","United States","GA, USA","English","United States","Video Broadcast"
"1000469670","2018-09-22 12:23:34","Rob Goldstone Speaks Out On Trump Jr.-Russia Email &#8212; &#8216;It Was Puffed Up&#8217;","https://dailycaller.com/2018/09/22/rob-goldstone-trump-jr-email-puffed-up/","en","False","politics and government, books and literature","18775","Daily Caller","http://dailycaller.com","United States","","English","United States","Digital Native"
"983065082","2018-06-26 00:00:00","Analysis | The Trump-Russia story reaches a ridiculous new zenith, in a Russian music video","https://www.washingtonpost.com/news/the-fix/wp/2018/06/26/trumps-russian-pop-star-ally-releases-a-music-video-trump-will-hate/?utm_term=.45482b125d54","en","False","politics and government, recordings (audio), music","2","Washington Post","http://washingtonpost.com","United States","DC, USA","English","United States","Print Native"
"876862326","2018-05-16 21:24:16","Senate Transcripts Show That Trump, Jr., Wanted to Collude with Russians","https://www.newyorker.com/news/our-columnists/senate-transcripts-show-that-trump-jr-wanted-to-collude-with-russians","en","False","","1101","New Yorker","http://www.newyorker.com/","United States","","English","United States","Print Native"
"667097336","2017-07-31 08:44:31","WATCH – Ex-Obama Official Marie Harf on Anti-Trump Dossier: ‘We Thought It Was a Funny Salacious Thing’","http://feedproxy.google.com/~r/breitbart/~3/Iwl7asBifSo/","en","False","politics and government, united states politics and government, elections, presidents and presidency (us), presidential elections (us), armament, defense and military forces, news and news media, election issues, media, united states international relations, international relations, presidential election of 2004","19334","Breitbart","http://www.breitbart.com","United States","","English","United States","Digital Native"
"999816032","2018-05-16 00:00:00","Donald Trump Jr. couldn't remember who was at the other end of a mystery 4-minute phone call — Mueller might have the answer","https://www.businessinsider.com/donald-trump-jr-mystery-4-minute-call-mueller-russia-trump-tower-2018-5?utm_source=feedburner&utm_medium=referral","en","False","politics and government, united states politics and government, biographical information","18710","Business Insider","http://www.businessinsider.com","United States","","English","United States","Digital Native"
