stories_id,publish_date,title,url,language,ap_syndicated,themes,media_id,media_name,media_url,media_pub_country,media_pub_state,media_language,media_about_country,media_media_type
"938993021","2018-07-27 13:13:21","The fantastical tale Trump wants you to believe about collusion","https://www.washingtonpost.com/blogs/plum-line/wp/2018/07/27/the-fantastical-tale-trump-wants-you-to-believe-about-collusion/","en","False","politics and government, united states politics and government","2","Washington Post","http://washingtonpost.com","United States","DC, USA","English","United States","Print Native"
"818808850","2018-03-09 20:09:21","In a personal letter, Trump invited Putin to the 2013 Miss Universe pageant","https://www.washingtonpost.com/world/national-security/in-a-personal-letter-trump-invited-putin-to-the-2013-miss-universe-pageant/2018/03/09/a3404358-23d2-11e8-a589-763893265565_story.html","en","False","politics and government","2","Washington Post","http://washingtonpost.com","United States","DC, USA","English","United States","Print Native"
"944218069","2018-08-02 15:51:44","Mueller seeks interview with Russian pop star who encouraged Trump Tower meeting","http://rss.cnn.com/~r/rss/cnn_latest/~3/6jAJrUpzbKk/index.html","en","False","","1095","CNN","http://www.cnn.com/","United States","GA, USA","English","United States","Video Broadcast"
"656043067","2017-07-12 07:40:56","Kremlin denies reaching out to Trump Jr. via developer","https://www.washingtonpost.com/world/europe/kremlin-denies-reaching-out-to-trump-jr-via-developer/2017/07/12/88435f04-66f4-11e7-94ab-5b1f0ff459df_story.html","en","True","politics and government","2","Washington Post","http://washingtonpost.com","United States","DC, USA","English","United States","Print Native"
"669424765","2017-07-17 17:26:09","What the Heck Is a Russian 'Crown Prosecutor'?","https://www.theatlantic.com/international/archive/2017/07/russian-crown-prosecutor/533295/","en","False","politics and government, news and news media, media, ethics","1110","The Atlantic","http://www.theatlantic.com/","United States","","English","United States","Print Native"
"876584689","2018-05-16 14:20:41","What the latest Russia revelations mean","https://www.washingtonpost.com/blogs/right-turn/wp/2018/05/16/what-the-latest-russia-revelations-mean/","en","False","politics and government, united states politics and government, elections","2","Washington Post","http://washingtonpost.com","United States","DC, USA","English","United States","Print Native"
"876538718","2018-05-16 10:00:00","Trump Tower meeting transcripts: Donald Jr., Russia lawyer downplay session, rip ‘apocalyptic Hollywood’ narrative","http://feeds.foxnews.com/~r/foxnews/politics/~3/iigG4PNzbNY/trump-tower-meeting-transcripts-donald-jr-russia-lawyer-downplay-session-rip-apocalyptic-hollywood-narrative.html","en","True","politics and government, united states politics and government, elections","1092","FOX News","http://www.foxnews.com/","United States","GA, USA","English","United States","Video Broadcast"
"656384270","2017-07-12 16:15:41","June 2-13, 2016: Donald Jr.'s controversial meeting came at a pivotal point for the Trump campaign","http://feedproxy.google.com/~r/businessinsider/~3/oZUtOP8xvCE/donald-trump-jr-email-timeline-2017-7","en","False","politics and government, united states politics and government, elections, presidents and presidency (us), presidential elections (us), primaries, presidential election of 2004, conventions and conferences","18710","Business Insider","http://www.businessinsider.com","United States","","English","United States","Digital Native"
"746857213","2017-12-15 07:14:50","Report: Music Promoter Offered To Set Up Putin, Trump Meeting During Campaign","https://www.huffingtonpost.com/entry/music-promoter-putin-trump-meet_us_5a336a53e4b040881be9342f?utm_hp_ref=donald-trump","en","False","politics and government, united states politics and government, elections, presidents and presidency (us), presidential elections (us), news and news media","27502","Huffington Post","http://www.huffingtonpost.com/#","United States","","English","United States",""
"715454817","2017-10-27 16:13:40","What we know about Yuri Chaika — the Kremlin's 'master of kompromat' who's behind the notorious Trump Tower meeting","http://feedproxy.google.com/~r/businessinsider/~3/JtRhd-euIQI/who-is-yuri-chaika-2017-7","en","False","politics and government, law and legislation, united states politics and government, lobbying and lobbyists, ethics, international relations, international trade and world market, embargoes and economic sanctions, freedom and human rights","18710","Business Insider","http://www.businessinsider.com","United States","","English","United States","Digital Native"
"667396787","2017-07-11 00:00:00","THE EMAILS: Trump Jr. posts exchange that promised dirt on Clinton as 'part of Russia and its government's support for Mr. Trump'","http://www.businessinsider.com/donald-trump-jr-posted-rob-goldstone-emails-russia-2017-7","en","False","politics and government, united states politics and government, elections, presidents and presidency (us), presidential elections (us)","18710","Business Insider","http://www.businessinsider.com","United States","","English","United States","Digital Native"
"686495476","2017-09-07 12:03:32","Donald Trump Jr.: I met with the Russians to learn about Clinton's 'fitness' for office","http://feedproxy.google.com/~r/businessinsider/~3/2ONR0ObVvxI/donald-trump-jr-explains-why-he-met-with-russians-at-trump-tower-2017-9","en","False","politics and government, united states politics and government, elections","18710","Business Insider","http://www.businessinsider.com","United States","","English","United States","Digital Native"
"909159744","2017-08-01 00:00:00","Donald Trump Jr.'s meeting revelations: A timeline - CNNPolitics","https://www.cnn.com/2017/08/01/politics/timeline-donald-trump-jr-/index.html","en","False","politics and government, united states politics and government","1095","CNN","http://www.cnn.com/","United States","GA, USA","English","United States","Video Broadcast"
"747415564","2017-07-11 11:43:38","Donald Trump Jr Releases Emails Proving Russia Was Supporting His Father | HuffPost UK","http://www.huffingtonpost.co.uk/entry/donald-trump-jr-emails_uk_5964eb36e4b09b587d62398b?utm_hp_ref=uk-donald-trump","en","False","politics and government, computers and the internet, united states politics and government, ethics","27502","Huffington Post","http://www.huffingtonpost.com/#","United States","","English","United States",""
"665446459","2017-07-10 00:00:00","Donald Trump Jr.'s 'staggering admissions' about meeting with a Russian lawyer are skirting a huge question","http://www.businessinsider.com/donald-trump-jr-meeting-with-russian-lawyer-collusion-2017-7?utm_source=feedburner&utm_medium=referral","en","False","politics and government, united states politics and government, elections","18710","Business Insider","http://www.businessinsider.com","United States","","English","United States","Digital Native"
"840612448","2018-03-05 00:00:00","Former Trump aide refusing Mueller subpoena: 'Screw that' - CNNPolitics","https://www.cnn.com/2018/03/05/politics/sam-nunberg-robert-mueller/index.html?sr=twCNN030518sam-nunberg-robert-mueller0338PMStory","en","False","politics and government, blacks, ethics","1095","CNN","http://www.cnn.com/","United States","GA, USA","English","United States","Video Broadcast"
"739660573","2017-12-07 15:58:46","Exclusive: Previously undisclosed emails show follow-up after Trump Tower meeting","http://rss.cnn.com/~r/rss/cnn_latest/~3/Fog2pWzQYZ4/index.html","en","False","politics and government, united states politics and government","1095","CNN","http://www.cnn.com/","United States","GA, USA","English","United States","Video Broadcast"
"655216997","2017-07-10 15:52:53","Trump's team is skirting a huge question on Donald Trump Jr.'s 'staggering admissions' about meeting with a Russian lawyer","http://feedproxy.google.com/~r/businessinsider/~3/vg6MbiUYn40/donald-trump-jr-meeting-with-russian-lawyer-collusion-2017-7","en","False","politics and government, united states politics and government, elections","18710","Business Insider","http://www.businessinsider.com","United States","","English","United States","Digital Native"
"877637745","2018-05-17 15:23:43","Trump Jr. called a blocked number before and after the Trump Tower meeting. Whom did he call?","http://rss.cnn.com/~r/rss/cnn_latest/~3/_p42ONM892M/index.html","en","False","politics and government, united states politics and government, armament, defense and military forces, terrorism","1095","CNN","http://www.cnn.com/","United States","GA, USA","English","United States","Video Broadcast"
"755869933","2017-12-26 19:19:29","U.S. lawmakers question businessman at 2016 Trump Tower meeting: sources","http://feeds.reuters.com/~r/Reuters/PoliticsNews/~3/hYAM-SRSNyU/u-s-lawmakers-question-businessman-at-2016-trump-tower-meeting-sources-idUSKBN1EL009","en","False","politics and government, united states politics and government","4442","Reuters","http://www.reuters.com","United States","PA, USA","English","none","Other"
"999643539","2018-09-21 14:45:07","Documents Show Suspicious Transfers Began Six Days Before Infamous Meeting","https://www.buzzfeednews.com/article/anthonycormier/mueller-investigation-money-trump-tower-meeting","en","False","politics and government, finances, united states politics and government, elections, ethics","6218","Buzzfeed","http://www.buzzfeed.com","United States","","English","none","Digital Native"
"983662464","2018-09-12 13:51:29","A Series Of Suspicious Money Transfers Followed The Trump Tower Meeting","https://www.buzzfeednews.com/article/anthonycormier/trump-tower-meeting-suspicious-transactions-agalarov","en","False","politics and government, finances","6218","Buzzfeed","http://www.buzzfeed.com","United States","","English","none","Digital Native"
"656433503","2017-07-12 21:04:35","Who Is Emin Agalarov, the Russian Pop Star Behind the Donald Trump Jr. Meeting?","https://www.nytimes.com/2017/07/12/arts/music/emin-agalarov-russian-pop-singer-trump.html?partner=rss&emc=rss","en","False","books and literature, music, biographical information","1","New York Times","http://nytimes.com","United States","NY, USA","English","United States","Print Native"
"1017586698","2018-09-21 00:00:00","How a British music publicist ended up in the middle of the Russia storm","https://www.washingtonpost.com/politics/how-a-british-music-publicist-ended-up-in-the-middle-of-the-russia-storm/2018/09/21/d1449a40-ba83-11e8-a8aa-860695e7f3fc_story.html?noredirect=on&utm_term=.2619f2a6bf25","en","False","politics and government, recordings (audio), crime and criminals","2","Washington Post","http://washingtonpost.com","United States","DC, USA","English","United States","Print Native"
"997771537","2017-12-29 00:00:00","Is Donald Trump’s dark Russian secret hiding in Deutsche Bank’s vaults?","https://www.newsweek.com/2017/12/29/donald-trump-russia-secret-deutsche-bank-753780.html","en","False","finances, suits and litigation, banks and banking, economic conditions and trends, credit","2","Washington Post","http://washingtonpost.com","United States","DC, USA","English","United States","Print Native"
"959483500","2018-08-21 03:00:05","Rudy Giuliani’s Pinocchio-laden interview on NBC’s ‘Meet the Press’","https://www.washingtonpost.com/politics/rudy-giulianis-pinocchio-laden-interview-on-nbcs-meet-the-press/2018/08/21/dbfbcc98-bb60-4e5e-9084-9d5232c735dc_story.html","en","False","politics and government","2","Washington Post","http://washingtonpost.com","United States","DC, USA","English","United States","Print Native"
"860806786","2018-04-27 19:57:10","Russians reached out to Trump team about Magnitsky Act sanctions after election, Democrats say","http://rss.cnn.com/~r/rss/cnn_latest/~3/G6IlVsOP8ec/index.html","en","False","politics and government, united states politics and government, united states international relations, international relations, freedom and human rights","1095","CNN","http://www.cnn.com/","United States","GA, USA","English","United States","Video Broadcast"
"655600899","2017-07-11 12:10:05","Donald Trump Jr. was told campaign meeting would be with ‘Russian government lawyer,’ according to emails","https://www.washingtonpost.com/politics/donald-trump-jr-was-told-campaign-meeting-would-be-with-russian-government-lawyer-according-to-emails/2017/07/11/70b957e2-664c-11e7-9928-22d00a47778f_story.html","en","False","politics and government, united states politics and government, elections, united states international relations, international relations","2","Washington Post","http://washingtonpost.com","United States","DC, USA","English","United States","Print Native"
"655731359","2017-07-11 13:43:00","Donald Trump Jr. attended meeting to get info on Clinton: Who was involved?","http://feeds.foxnews.com/~r/foxnews/politics/~3/KUKUN7L8HwE/donald-trump-jr-attended-meeting-to-get-info-on-clinton-who-was-involved.html","en","False","politics and government, united states politics and government, biographical information","1092","FOX News","http://www.foxnews.com/","United States","GA, USA","English","United States","Video Broadcast"
"805258509","2018-02-22 14:13:29","2016 Presidential Election Investigation Fast Facts","http://rss.cnn.com/~r/rss/cnn_latest/~3/ex1xsSjXX84/index.html","en","False","politics and government, united states politics and government, elections, armament, defense and military forces, terrorism, crime and criminals, ethics, united states international relations, international relations","1095","CNN","http://www.cnn.com/","United States","GA, USA","English","United States","Video Broadcast"
"912598213","2018-06-26 14:30:02","Russian pop star who arranged Trump Tower meeting makes music video about colluding with Trump","https://www.vox.com/2018/6/26/17506586/emin-agalarov-music-video-trump-russia","en","False","politics and government, recordings (audio), music","104828","Vox","http://www.vox.com","United States","","English","United States","Digital Native"
"656140258","2017-07-12 10:36:25","Trump Jr. Emails Prove Russia Collusion Story Is Even Dumber Than You Thought","http://dailycaller.com/2017/07/12/trump-jr-emails-prove-russia-collusion-story-is-even-dumber-than-you-thought/","en","False","politics and government, news and news media, media","18775","Daily Caller","http://dailycaller.com","United States","","English","United States","Digital Native"
"878152298","2018-05-18 05:45:06","A Comprehensive List Of Everything Don Jr. Doesn't Know About That Infamous Meeting","https://www.huffingtonpost.com/entry/everything-donald-trump-jr-doesnt-know-about-meeting_us_5afc5fd4e4b0779345d52258","en","False","politics and government, crime and criminals, biographical information","27502","Huffington Post","http://www.huffingtonpost.com/#","United States","","English","United States",""
"958887279","2018-08-20 09:05:31","Giuliani wasted no time applying his &#8216;truth isn&#8217;t truth&#8217; mantra to the Trump Tower meeting","https://www.washingtonpost.com/news/politics/wp/2018/08/20/giuliani-wasted-no-time-applying-his-truth-isnt-truth-mantra-to-the-trump-tower-meeting/","en","False","politics and government, united states politics and government","2","Washington Post","http://washingtonpost.com","United States","DC, USA","English","United States","Print Native"
"657584778","2017-07-14 16:02:00","Russian pop singer's attorney attacks publicist in Trump Jr. email saga","http://feeds.foxnews.com/~r/foxnews/politics/~3/8aPEBVQ-eBU/russian-pop-singers-attorney-attacks-publicist-in-trump-jr-email-saga.html","en","False","politics and government, united states politics and government","1092","FOX News","http://www.foxnews.com/","United States","GA, USA","English","United States","Video Broadcast"
"877279258","2018-05-17 08:28:20","The Cybersecurity 202: Google wants to help political groups fight these cheap but disruptive cyberattacks","https://www.washingtonpost.com/news/powerpost/paloma/the-cybersecurity-202/2018/05/17/the-cybersecurity-202-google-wants-to-help-political-groups-fight-these-cheap-but-destructive-cyberattacks/5afc6e8830fb04258879954d/","en","False","politics and government, computers and the internet, united states politics and government, elections","2","Washington Post","http://washingtonpost.com","United States","DC, USA","English","United States","Print Native"
"686540175","2017-09-07 13:23:00","Trump Jr. says he wanted to know about Clinton's 'fitness' for office in Russian lawyer meeting","http://feeds.foxnews.com/~r/foxnews/politics/~3/k8gQF8ZgOV8/trump-jr-says-wanted-to-know-about-clintons-fitness-for-office-in-russian-lawyer-meeting.html","en","False","politics and government, united states politics and government, united states international relations, international relations","1092","FOX News","http://www.foxnews.com/","United States","GA, USA","English","United States","Video Broadcast"
"655689916","2017-07-11 15:05:09","Buzzword emerges as Trump Jr. Russia scandal deepens: Treason","http://www.politico.com/story/2017/07/11/donald-trump-jr-treason-buzzword-240406","en","False","politics and government, united states politics and government, ethics, frauds and swindling","18268","Politico","http://politico.com","United States","","English","United States","Print Native"
"885227487","2018-05-26 06:52:29","Week 53: Trump Goes Spy Hunting and Gets Skunked","https://www.politico.com/magazine/story/2018/05/26/swamp-diary-trump-spy-hunter-218545","en","False","politics and government, united states politics and government, armament, defense and military forces, news and news media, media, united states international relations, international relations","18268","Politico","http://politico.com","United States","","English","United States","Print Native"
"960968995","2018-08-22 17:13:45","On three separate issues, what Trump knew when emerges as critical","https://www.washingtonpost.com/news/politics/wp/2018/08/22/on-three-separate-issues-what-trump-knew-when-emerges-as-critical/","en","False","politics and government, finances, elections, ethics","2","Washington Post","http://washingtonpost.com","United States","DC, USA","English","United States","Print Native"
"655685138","2017-07-11 15:12:38","The Trump Internet's defense of Donald Trump Jr.'s tweets shows how quickly messaging falls into place","https://www.washingtonpost.com/news/the-intersect/wp/2017/07/11/the-trump-internets-defense-of-donald-trump-jr-s-tweets-shows-how-quickly-messaging-falls-into-place/","en","False","politics and government, computers and the internet, news and news media","2","Washington Post","http://washingtonpost.com","United States","DC, USA","English","United States","Print Native"
"656377419","2017-07-12 18:30:32","When a Witch Hunt Finds Real Witches","http://www.politico.com/magazine/story/2017/07/12/when-a-witch-hunt-finds-real-witches-215368","en","False","politics and government, united states politics and government","18268","Politico","http://politico.com","United States","","English","United States","Print Native"
"823946445","2018-03-15 16:34:03","Why hasn't Mueller talked to Donald Trump Jr. yet?","https://www.washingtonpost.com/news/politics/wp/2018/03/15/why-hasnt-mueller-talked-to-donald-trump-jr-yet/","en","False","politics and government, united states politics and government, ethics","2","Washington Post","http://washingtonpost.com","United States","DC, USA","English","United States","Print Native"
"655273715","2017-07-10 22:36:55","Timeline of a story about Donald Trump Jr. and Russia that keeps getting worse","https://www.washingtonpost.com/news/the-fix/wp/2017/07/10/timeline-of-a-story-about-donald-trump-jr-and-russia-that-keeps-getting-worse/","en","False","politics and government, united states politics and government","2","Washington Post","http://washingtonpost.com","United States","DC, USA","English","United States","Print Native"
"660774387","2017-07-20 19:11:05","Trump's public Russia comments could cause legal headaches for him—and his kids","http://www.politico.com/story/2017/07/20/trumps-public-russia-comments-could-cause-legal-problems-240775","en","False","politics and government, united states politics and government, news and news media, media, ethics","18268","Politico","http://politico.com","United States","","English","United States","Print Native"
"659408891","2017-07-18 13:34:00","Eighth participant in Trump Tower meeting identified","http://feeds.foxnews.com/~r/foxnews/politics/~3/IrIDlUMovGI/eighth-participant-in-trump-tower-meeting-identified.html","en","False","politics and government","1092","FOX News","http://www.foxnews.com/","United States","GA, USA","English","United States","Video Broadcast"
"912676844","2018-06-26 16:34:00","Russian pop star linked to Trump family releases bizarre music video","https://www.nbcnews.com/politics/donald-trump/russian-pop-star-linked-trump-family-releases-bizarre-music-video-n886696?cid=public-rss_20180626","en","False","politics and government, recordings (audio), music","25499","NBC News","http://www.nbcnews.com","United States","","English","United States",""
"657520712","2017-07-14 14:46:55","A brief review of Donald Trump Jr.'s explanations of his meeting with a Russian lawyer","https://www.washingtonpost.com/news/politics/wp/2017/07/14/a-brief-review-of-donald-trump-jr-s-explanations-of-his-meeting-with-a-russian-lawyer/","en","False","politics and government","2","Washington Post","http://washingtonpost.com","United States","DC, USA","English","United States","Print Native"
"659390531","2017-07-18 13:19:05","Employee of Russian Real Estate Company Was Eighth Person at Trump Tower Meeting","https://www.nytimes.com/2017/07/18/us/politics/trump-meeting-russia.html?partner=rss&emc=rss","en","False","politics and government, computers and the internet","1","New York Times","http://nytimes.com","United States","NY, USA","English","United States","Print Native"
"957481663","2018-08-18 03:47:07.332599","CNN.com - Transcripts","http://transcripts.cnn.com/TRANSCRIPTS/1707/12/acd.01.html","en","False","politics and government, united states politics and government, television","1095","CNN","http://www.cnn.com/","United States","GA, USA","English","United States","Video Broadcast"
"925261367","2018-07-11 10:02:57","The Daily 202: Leaked recordings of Ga. governor candidate highlight why people mistrust politicians","https://www.washingtonpost.com/news/powerpost/paloma/daily-202/2018/07/11/daily-202-leaked-recordings-of-ga-governor-candidate-highlight-why-people-mistrust-politicians/5b456db11b326b3348adde28/","en","False","politics and government, united states politics and government, elections, primaries, governors (us)","2","Washington Post","http://washingtonpost.com","United States","DC, USA","English","United States","Print Native"
"805618694","2017-07-11 00:00:00","Donald Trump Jr. was told campaign meeting would be with ‘Russian government attorney,’ according to emails","https://www.washingtonpost.com/politics/donald-trump-jr-was-told-campaign-meeting-would-be-with-russian-government-lawyer-according-to-emails/2017/07/11/70b957e2-664c-11e7-9928-22d00a47778f_story.html?utm_term=.88cbcc20bb74","en","False","politics and government, united states politics and government","2","Washington Post","http://washingtonpost.com","United States","DC, USA","English","United States","Print Native"
"1000398391","2018-09-22 08:00:00","How a British music publicist ended up in the middle of the Russia storm","https://www.washingtonpost.com/politics/how-a-british-music-publicist-ended-up-in-the-middle-of-the-russia-storm/2018/09/21/d1449a40-ba83-11e8-a8aa-860695e7f3fc_story.html","en","False","politics and government, united states politics and government","2","Washington Post","http://washingtonpost.com","United States","DC, USA","English","United States","Print Native"
"661598744","2017-07-22 05:11:25","The man who drives Trump’s Russia connection","https://www.washingtonpost.com/world/europe/the-man-who-drives-trumps-russia-connection/2017/07/21/43485a0e-6c98-11e7-abbc-a53480672286_story.html","en","False","politics and government, united states politics and government, lobbying and lobbyists","2","Washington Post","http://washingtonpost.com","United States","DC, USA","English","United States","Print Native"
"686888360","2017-09-08 07:30:30","The Daily 202: Leading moderate announces retirement from House with parting shot at direction of GOP","https://www.washingtonpost.com/news/powerpost/paloma/daily-202/2017/09/08/daily-202-leading-moderate-announces-retirement-from-house-with-parting-shot-at-direction-of-gop/59b1bf4e30fb045176650bc5/","en","False","politics and government, united states politics and government, elections","2","Washington Post","http://washingtonpost.com","United States","DC, USA","English","United States","Print Native"
"1000715748","2018-09-22 22:42:09.139134","CNN.com - Transcripts","http://transcripts.cnn.com/TRANSCRIPTS/1803/17/smer.01.html","en","False","politics and government, computers and the internet","1095","CNN","http://www.cnn.com/","United States","GA, USA","English","United States","Video Broadcast"
"860584354","2018-04-27 14:52:24","The House GOP report on Russia is revealing. But not in a good way for Trump.","https://www.washingtonpost.com/blogs/plum-line/wp/2018/04/27/the-new-house-gop-report-on-russia-is-revealing-but-not-in-a-good-way-for-trump/","en","False","politics and government, united states politics and government, elections, armament, defense and military forces, united states international relations, international relations","2","Washington Post","http://washingtonpost.com","United States","DC, USA","English","United States","Print Native"
