stories_id,publish_date,title,url,language,ap_syndicated,themes,media_id,media_name,media_url,media_pub_country,media_pub_state,media_language,media_about_country,media_media_type
"823055080","2018-03-14 19:31:36","House intelligence Democrats outline how to keep their Russia investigation alive","http://rss.cnn.com/~r/rss/cnn_latest/~3/XR4PhmX0hoM/index.html","en","False","politics and government, united states politics and government, armament, defense and military forces, united states international relations, international relations","1095","CNN","http://www.cnn.com/","United States","GA, USA","English","United States","Video Broadcast"
"913225475","2018-06-27 07:11:31","Russian pop star with ties to Trump trolls U.S. election saga in video","https://www.cbsnews.com/news/russian-pop-star-with-ties-to-trump-trolls-u-s-election-saga-in-music-video/","en","False","politics and government, united states politics and government, elections, music","1752","cbs news","http://www.cbsnews.com/","United States","NY, USA","English","United States","Video Broadcast"
"876455860","2018-05-16 11:47:58","It's increasingly hard to believe that the Trump Tower meeting wasn't common knowledge","https://www.washingtonpost.com/news/politics/wp/2018/05/16/its-increasingly-hard-to-believe-that-the-trump-tower-meeting-wasnt-common-knowledge/","en","False","politics and government, united states politics and government, elections","2","Washington Post","http://washingtonpost.com","United States","DC, USA","English","United States","Print Native"
"800930618","2017-07-19 00:00:00","Russian lawyer at Trump Tower meeting 'ready to testify' - CNNPolitics","http://www.cnn.com/2017/07/19/politics/russia-lawyer-us-senate/index.html?utm_source=dlvr.it&utm_medium=twitter","en","False","politics and government, united states politics and government, ethics","1095","CNN","http://www.cnn.com/","United States","GA, USA","English","United States","Video Broadcast"
"746460273","2017-12-14 21:13:26","Publicist's email suggested Putin-Trump meeting during campaign","http://www.nydailynews.com/news/national/publicist-email-suggested-putin-trump-meeting-campaign-article-1.3699122","en","False","politics and government, united states politics and government, elections","8","Daily News","http://www.nydailynews.com/","United States","NY, USA","English","United States","Print Native"
"854569902","2018-04-20 13:31:58","DNC Files Lawsuit Alleging Collusion Between Trump Campaign And Russian Government","http://dailycaller.com/2018/04/20/dnc-sues-trump-campaign-associates/","en","False","politics and government, computers and the internet, united states politics and government, elections, suits and litigation","18775","Daily Caller","http://dailycaller.com","United States","","English","United States","Digital Native"
"655696054","2017-07-11 14:52:59","Trump Jr.'s Smoking Gun Email","http://www.huffingtonpost.com/entry/trump-jrs-smoking-gun-email_us_59651e23e4b0deab7c646c2e?utm_hp_ref=donald-trump","en","False","crime and criminals","27502","Huffington Post","http://www.huffingtonpost.com/#","United States","","English","United States",""
"655415049","2017-07-11 05:18:39","Trump Jr. Admits He Wanted Info on Hillary Clinton from Russian Lawyer","http://feedproxy.google.com/~r/time/topstories/~3/kocwZdu6ALc/","en","False","politics and government, united states politics and government, elections, presidents and presidency (us)","4419","Time","http://time.com","United States","","English","United States",""
"739908078","2017-12-07 19:44:10","Report: Organizer Of Trump Jr.’s Russia Meeting Continued Emailing With Russians","https://www.huffingtonpost.com/entry/trump-jr-russia-meeting-emails_us_5a29c0f2e4b0a290f04f5cb5?ncid=inblnkushpmg00000009","en","False","politics and government, united states politics and government, elections, news and news media","27502","Huffington Post","http://www.huffingtonpost.com/#","United States","","English","United States",""
"998489223","2018-09-20 08:38:21.227580","Russian pop star linked to Trump family releases bizarre music video","https://www.nbcnews.com/politics/donald-trump/russian-pop-star-linked-trump-family-releases-bizarre-music-video-n886696","en","False","politics and government, united states politics and government, recordings (audio)","25499","NBC News","http://www.nbcnews.com","United States","","English","United States",""
"693517600","2017-09-20 18:47:23","Oligarch family in Trump Russia dealings sells New York apartment","http://www.nydailynews.com/news/national/oligarch-family-trump-russia-dealings-sells-new-york-apartment-article-1.3509744","en","False","politics and government, ethics, biographical information, housing","8","Daily News","http://www.nydailynews.com/","United States","NY, USA","English","United States","Print Native"
"913258108","2018-06-27 06:28:46","Russian Pop Star Behind Trump Tower Meeting Releases Music Video With ‘Trump’","https://www.huffingtonpost.com/entry/emin-agalarov-music-video-trump-got-me-good_us_5b334edde4b0b745f17914c0","en","False","politics and government, united states politics and government, recordings (audio)","27502","Huffington Post","http://www.huffingtonpost.com/#","United States","","English","United States",""
"1001658802","2018-09-24 05:00:04","Rob Goldstone, publicist behind Trump Tower meeting with Russians, describes &apos;devastating&apos; personal toll in new book","http://rssfeeds.usatoday.com/~/571160232/0/usatodaycomwashington-topstories~Rob-Goldstone-publicist-behind-Trump-Tower-meeting-with-Russians-describes-aposdevastatingapos-personal-toll-in-new-book/","en","False","politics and government, united states politics and government, elections, presidents and presidency (us)","64866","USAToday","http://usatoday.com/","United States","Ohio, United States","English","United States","Print Native"
"946442024","2018-08-05 15:16:54","Fake News: Trump Tweet Does Not Contradict Statement on Trump Tower Meeting","http://feedproxy.google.com/~r/breitbart/~3/zYMi-ItMMZ0/","en","False","politics and government, united states politics and government, news and news media, media","19334","Breitbart","http://www.breitbart.com","United States","","English","United States","Digital Native"
"1000494213","2018-09-22 13:02:17","Mueller Witness Who Was With Trump In Moscow Says Dossier&#8217;s &#8216;Pee Tape&#8217; Allegations Are &#8216;Unlikely&#8217;","https://dailycaller.com/2018/09/22/trump-golden-showers-unlikely/","en","False","politics and government, biographical information","18775","Daily Caller","http://dailycaller.com","United States","","English","United States","Digital Native"
"876449267","2018-05-16 11:23:01","The Trump Tower meeting at the center of the Russia investigation, explained","https://www.vox.com/2018/2/26/16964328/trump-tower-meeting-mueller-russia","en","False","politics and government, united states politics and government, ethics","104828","Vox","http://www.vox.com","United States","","English","United States","Digital Native"
"656168011","2017-07-12 11:12:15","Assessing how 'open' and 'transparent' Donald Trump Jr. was in his Hannity appearance","https://www.washingtonpost.com/news/politics/wp/2017/07/12/assessing-how-open-and-transparent-donald-trump-jr-was-in-his-hannity-appearance/","en","False","politics and government, united states politics and government","2","Washington Post","http://washingtonpost.com","United States","DC, USA","English","United States","Print Native"
"876644402","2018-05-16 19:35:26","5 Things the New Trump Tower Meeting Documents Tell Us","https://www.nytimes.com/2018/05/16/us/politics/trump-tower-meeting-donald-trump-jr-senate-judiciary-documents.html","en","False","politics and government, united states politics and government","1","New York Times","http://nytimes.com","United States","NY, USA","English","United States","Print Native"
"655771200","2017-07-11 19:03:00","Meet the pop star at the center of the Donald Trump Jr. uproar","http://www.cnbc.com/2017/07/11/meet-the-pop-star-at-the-center-of-the-donald-trump-jr-uproar.html","en","False","politics and government, recordings (audio), music","1755","CNBC","http://www.cnbc.com/","United States","","English","United States","Video Broadcast"
"657321070","2017-07-14 08:28:02","NBC News: Ex-Soviet intel officer was also present at Trump Tower meeting","http://rssfeeds.usatoday.com/~/397522018/0/usatoday-newstopstories~NBC-News-ExSoviet-intel-officer-was-also-present-at-Trump-Tower-meeting/","en","False","politics and government, united states politics and government, news and news media, media","64866","USAToday","http://usatoday.com/","United States","Ohio, United States","English","United States","Print Native"
"659834652","2017-07-19 08:24:56","A cover story, a cut-out, and a 'green light': Trump Jr.'s meeting bears all the hallmarks of a Russian intelligence operation","http://feedproxy.google.com/~r/businessinsider/~3/twIjNhPJ3l0/was-trump-jr-russia-meeting-an-intelligence-operation-spies-2017-7","en","False","politics and government, united states politics and government","18710","Business Insider","http://www.businessinsider.com","United States","","English","United States","Digital Native"
"999724827","2018-05-16 00:00:00","Trump Tower transcripts detail quest for dirt on Hillary Clinton - CNNPolitics","https://edition.cnn.com/2018/05/16/politics/senate-judiciary-committee-trump-tower-transcripts/index.html","en","False","politics and government, united states politics and government","1095","CNN","http://www.cnn.com/","United States","GA, USA","English","United States","Video Broadcast"
"655898001","2017-07-12 00:57:48","Trump Jr. releases emails about Russia's plan to help his father","http://feeds.nydailynews.com/~r/NydnRss/~3/4nS0-M7s24A/trump-jr-dems-media-show-desperation-russia-story-article-1.3317342","en","False","politics and government, united states politics and government, elections","8","Daily News","http://www.nydailynews.com/","United States","NY, USA","English","United States","Print Native"
"876706971","2018-05-16 16:09:00","Senate Intel concurs: Kremlin looked to boost Trump","http://feeds.foxnews.com/~r/foxnews/politics/~3/yrHILc30TD0/senate-intel-concurs-kremlin-looked-to-boost-trump.html","en","False","politics and government, united states politics and government, crime and criminals","1092","FOX News","http://www.foxnews.com/","United States","GA, USA","English","United States","Video Broadcast"
"806564056","2017-11-06 10:17:00","Russian Lawyer Who Met With Donald Trump Jr. Claims He Offered A Quid Pro Quo | HuffPost","https://www.huffingtonpost.com/entry/donald-trump-jr-russian-lawyer-meeting_us_5a006330e4b04cdbeb34c397?ncid=tweetlnkushpmg00000067","en","False","politics and government, law and legislation, united states politics and government, elections, lobbying and lobbyists, freedom and human rights","27502","Huffington Post","http://www.huffingtonpost.com/#","United States","","English","United States",""
"655801550","2017-07-11 20:18:00","This Is the Man Who Connected Trump Jr. to Russian Lawyer","http://www.nbcnews.com/politics/donald-trump/rob-goldstone-man-behind-trump-jr-meeting-music-publicist-ties-n781931?cid=public-rss_20170712","en","False","politics and government, elections, news and news media, media, ethics, biographical information","25499","NBC News","http://www.nbcnews.com","United States","","English","United States",""
"876321665","2018-05-16 09:10:00","Senate panel releases transcripts on Trump Tower meeting","http://www.foxnews.com/politics/2018/05/16/senate-panel-releases-transcripts-on-trump-tower-meeting.html","en","False","politics and government","1092","FOX News","http://www.foxnews.com/","United States","GA, USA","English","United States","Video Broadcast"
"681309206","2017-08-28 13:37:12","Trump's long history of seeking a politically inconvenient business deal in Russia","https://www.washingtonpost.com/news/politics/wp/2017/08/28/trumps-long-history-of-seeking-a-politically-inconvenient-business-deal-in-russia/","en","False","politics and government, finances, united states politics and government, elections","2","Washington Post","http://washingtonpost.com","United States","DC, USA","English","United States","Print Native"
"763318265","2018-01-05 15:18:04","The Steele dossier, explained","https://www.vox.com/2018/1/5/16845704/steele-dossier-russia-trump","en","False","politics and government, united states politics and government, elections, international relations","104828","Vox","http://www.vox.com","United States","","English","United States","Digital Native"
"670632912","2017-07-10 08:00:00","How a Pageant Led to a Trump Son’s Meeting With a Russian Lawyer","https://www.nytimes.com/2017/07/10/us/politics/rob-goldstone-russia-trump.html?_r=0","en","False","contests and prizes","1","New York Times","http://nytimes.com","United States","NY, USA","English","United States","Print Native"
"957305030","2017-07-12 00:00:00","Rob Goldstone, Trump Intermediary, Likes Silly Hats and Facebook - The New York Times","https://www.nytimes.com/2017/07/12/style/rob-goldstone-russia-trump.html?mcubz=0&_r=0","en","False","politics and government, computers and the internet, news and news media, media","1","New York Times","http://nytimes.com","United States","NY, USA","English","United States","Print Native"
"952973333","2018-08-13 09:59:59","Publicist Who Arranged Trump Tower Meeting Admits ‘I Didn’t Know What I Was Even Talking About’","http://feedproxy.google.com/~r/breitbart/~3/6sjwCLKnv_s/","en","False","politics and government, united states politics and government","19334","Breitbart","http://www.breitbart.com","United States","","English","United States","Digital Native"
"876385044","2018-05-16 10:28:45","Donald Trump Jr. Said He Doesn’t Remember If He Told His Father About the Trump Tower Meeting","http://feedproxy.google.com/~r/time/topstories/~3/S6BR-1rgVsc/","en","False","politics and government, united states politics and government, elections, international relations","4419","Time","http://time.com","United States","","English","United States",""
"939185434","2018-07-27 18:35:08","What We Know About the Controversial 2016 Trump Tower Meeting With Russian Officials","http://feedproxy.google.com/~r/time/topstories/~3/6LnBGYL6O3U/","en","False","politics and government, united states politics and government, elections, biographical information","4419","Time","http://time.com","United States","","English","United States",""
"841045271","2018-04-05 08:34:36","Here are the oligarchs connected to Trump and his campaign","http://feeds.nydailynews.com/~r/NydnRss/~3/rnwsXnKMrJs/oligarchs-connected-trump-campaign-article-1.3915846","en","False","politics and government, recordings (audio)","8","Daily News","http://www.nydailynews.com/","United States","NY, USA","English","United States","Print Native"
"876520955","2018-05-16 12:58:32","Analysis: 31 key lines from Trump Jr.'s Russia testimony","http://rss.cnn.com/~r/rss/cnn_topstories/~3/1UR3PTDbhLM/index.html","en","False","politics and government, united states politics and government","1095","CNN","http://www.cnn.com/","United States","GA, USA","English","United States","Video Broadcast"
"890887628","2017-07-11 00:00:00","Who is Rob Goldstone? - CNNPolitics","https://edition.cnn.com/2017/07/11/politics/who-is-rob-goldstone-donald-trump-jr/index.html","en","False","computers and the internet","1095","CNN","http://www.cnn.com/","United States","GA, USA","English","United States","Video Broadcast"
"662058633","2017-07-11 07:58:35","Trump Jr. was told of Russian effort to help father's campaign: NY Times","http://www.reuters.com/article/us-usa-trump-russia-idUSKBN19V2DO","en","False","politics and government, united states politics and government, elections, ethics","4442","Reuters","http://www.reuters.com","United States","PA, USA","English","none","Other"
"854745463","2018-04-20 21:05:26","The DNC Filed A Lawsuit Alleging A Vast Trump-Russia Conspiracy","https://www.buzzfeed.com/zoetillman/dnc-trump-russia-lawsuit","en","False","politics and government, united states politics and government, elections, suits and litigation","6218","Buzzfeed","http://www.buzzfeed.com","United States","","English","none","Digital Native"
"983685535","2018-09-12 16:58:09.501213","Team Trump still isn't telling the truth about that 2016 Trump Tower meeting","https://www.nbcnews.com/politics/first-read/team-trump-still-isn-t-telling-truth-about-2016-trump-n902146","en","False","politics and government, united states politics and government, international relations","25499","NBC News","http://www.nbcnews.com","United States","","English","United States",""
"807018496","2017-11-19 00:00:00","Publicist who set up Trump Jr. meeting ready to talk to Mueller - CNNPolitics","https://www.cnn.com/2017/11/19/politics/goldstone-sunday-times-mueller/index.html","en","False","politics and government, united states politics and government, elections, news and news media, media, ethics, united states international relations, international relations","1095","CNN","http://www.cnn.com/","United States","GA, USA","English","United States","Video Broadcast"
"962751200","2018-08-24 16:47:21","Roger Stone Predicts Mueller Will Indict Donald Trump Jr. on Process Crime","http://feedproxy.google.com/~r/breitbart/~3/IcuVHNDs3r0/","en","False","politics and government, united states politics and government, terrorism, crime and criminals","19334","Breitbart","http://www.breitbart.com","United States","","English","United States","Digital Native"
"878369549","2018-05-18 10:01:20","Did Trump Jr. call the blocked number, or vice versa?","https://www.washingtonpost.com/news/politics/wp/2018/05/18/did-trump-jr-call-the-blocked-number-or-vice-versa/","en","False","politics and government, united states politics and government, elections","2","Washington Post","http://washingtonpost.com","United States","DC, USA","English","United States","Print Native"
"876406510","2018-05-16 10:55:41","Trump Jr. told investigators he can&apos;t recall if he discussed Russian meeting with his father","http://rssfeeds.usatoday.com/~/546161710/0/usatoday-newstopstories~Trump-Jr-told-investigators-he-canapost-recall-if-he-discussed-Russian-meeting-with-his-father/","en","False","politics and government, united states politics and government, elections, presidents and presidency (us), biographical information","64866","USAToday","http://usatoday.com/","United States","Ohio, United States","English","United States","Print Native"
"667704109","2017-07-18 08:00:00","Guest List at Donald Trump Jr.’s Meeting With Russian Expands Again","https://www.nytimes.com/2017/07/18/us/politics/trump-meeting-russia.html?hp&action=click&pgtype=Homepage&clickSource=story-heading&module=first-column-region&region=top-news&WT.nav=top-news","en","False","politics and government, united states politics and government, elections","1","New York Times","http://nytimes.com","United States","NY, USA","English","United States","Print Native"
"655572725","2017-07-11 11:33:03","Donald Trump Jr. Posts Emails Leading to Meeting for Hillary Clinton Info","http://feedproxy.google.com/~r/time/topstories/~3/6v-IYuIwmww/","en","False","politics and government, united states politics and government","4419","Time","http://time.com","United States","","English","United States",""
"854597106","2018-04-20 14:10:02","The DNC just sued Russia and the Trump campaign for 2016 election meddling","https://www.vox.com/2018/4/20/17262080/dnc-lawsuit-russia-trump-elections-hacking-emails","en","False","privacy, politics and government, computers and the internet, united states politics and government, elections, suits and litigation, international relations","104828","Vox","http://www.vox.com","United States","","English","United States","Digital Native"
"656209353","2017-07-12 12:15:00","The Kremlin continued to deny association with the Russian lawyer who met with Donald Trump Jr.","http://feeds.latimes.com/~r/latimes/sports/motorracing/~3/nc4DKWK9tQ0/la-na-essential-washington-updates-kremlin-compares-the-trump-jr-email-1499872852-htmlstory.html","en","False","politics and government, united states politics and government, television, news and news media, media, international relations","6","LA Times","http://www.latimes.com/","United States","California, United States","English","United States","Print Native"
"798630868","2017-10-09 00:00:00","Russians' lawyer says new documents show Trump Tower meeting not about Clinton - CNNPolitics","http://www.cnn.com/2017/10/09/politics/russia-trump-tower-meeting-new-documents/index.html?CNNPolitics=Tw","en","False","politics and government, united states politics and government, lobbying and lobbyists","1095","CNN","http://www.cnn.com/","United States","GA, USA","English","United States","Video Broadcast"
"914497505","2018-06-28 12:09:25","Trump's pop star associate features Trump lookalike in music video","http://feeds.reuters.com/~r/reuters/lifestyle/~3/zX1My-2zmso/trumps-pop-star-associate-features-trump-lookalike-in-music-video-idUSKBN1JO2GE","en","False","recordings (audio), news and news media","4442","Reuters","http://www.reuters.com","United States","PA, USA","English","none","Other"
"656077274","2017-07-12 08:06:08","Russia Denies Connections to People Who Set Up Meeting With Donald Trump Jr.","http://feedproxy.google.com/~r/time/topstories/~3/nH2tW8c7mX0/","en","False","politics and government","4419","Time","http://time.com","United States","","English","United States",""
"860866529","2018-04-28 03:09:48","Trump Jr. And Emin Agalarov Stayed In Touch Throughout The Transition","https://www.buzzfeed.com/chrisgeidner/trump-jr-and-emin-agalarov-stayed-in-touch-during-the","en","False","politics and government, united states politics and government, elections","6218","Buzzfeed","http://www.buzzfeed.com","United States","","English","none","Digital Native"
"660006709","2017-07-18 16:33:40","Less than half of Trump voters believe Donald Jr. met with Russians about Clinton dirt","https://finance.yahoo.com/news/over-50-trump-voters-dont-203340895.html","en","False","politics and government, united states politics and government, elections, public opinion","18840","finance.yahoo.com","http://finance.yahoo.com","United States","","English","United States","Digital Native"
"999156337","2018-05-16 10:06:00","The Senate just released roughly 1,800 pages of interviews about Donald Trump Jr.'s 2016 Trump Tower meeting with a Russian lawyer — here are the highlights","https://www.businessinsider.com/trump-tower-meeting-transcripts-senate-judiciary-committee-donald-trump-jr-2018-5","en","False","politics and government, united states politics and government, elections, lobbying and lobbyists","18710","Business Insider","http://www.businessinsider.com","United States","","English","United States","Digital Native"
"655993535","2017-07-12 05:02:13","Russian at Trump Tower Is Said to Have Gathered Details on Ziffs","https://www.bloomberg.com/politics/articles/2017-07-12/russian-at-trump-tower-is-said-to-have-gathered-details-on-ziffs","en","False","politics and government, finances, united states politics and government, elections, ethics","40944","Bloomberg","http://bloomberg.com","United States","","English","United States","Digital Native"
"739852216","2017-12-07 18:35:26","Emails show the man who set up a meeting between the Trump campaign and a Russian lawyer reportedly contacted a Trump staffer afterward","http://feedproxy.google.com/~r/businessinsider/~3/LbpK6LDRjnQ/rob-goldstone-trump-tower-meeting-follow-up-emails-2017-12","en","False","politics and government, computers and the internet","18710","Business Insider","http://www.businessinsider.com","United States","","English","United States","Digital Native"
"656213353","2017-07-12 11:35:47","Rob Goldstone, Trump Intermediary, Likes Silly Hats and Facebook","https://www.nytimes.com/2017/07/12/style/rob-goldstone-russia-trump.html?partner=rss&emc=rss","en","False","politics and government","1","New York Times","http://nytimes.com","United States","NY, USA","English","United States","Print Native"
"1000125936","2018-09-22 01:19:12.760803","Trump Jr. told Senate he didn't recall telling father about Russian meeting","https://www.nbcnews.com/news/us-news/rob-goldstone-told-senate-trump-tower-meeting-russians-was-bad-n874586","en","False","politics and government, united states politics and government, united states international relations, international relations, biographical information","25499","NBC News","http://www.nbcnews.com","United States","","English","United States",""
"655678387","2017-07-11 12:37:05","The Donald Trump Jr. emails change everything","https://www.vox.com/2017/7/11/15953204/donald-trump-jr-emails-russia","en","False","politics and government, united states politics and government, ethics","104828","Vox","http://www.vox.com","United States","","English","United States","Digital Native"
"656232996","2017-07-12 12:52:19","Here's the Putin-connected Russian billionaire who offered Trump Jr. dirt on Hillary","http://rssfeeds.usatoday.com/~/395254630/0/usatoday-newstopstories~Heres-the-Putinconnected-Russian-billionaire-who-offered-Trump-Jr-dirt-on-Hillary/","en","False","politics and government, united states politics and government, elections","64866","USAToday","http://usatoday.com/","United States","Ohio, United States","English","United States","Print Native"
"655217190","2017-07-10 12:20:44","Meet the music publicist taking credit for setting up Donald Trump Jr.'s meeting with a Russian lawyer","http://feedproxy.google.com/~r/businessinsider/~3/dwSXedZcY40/who-is-rob-goldstone-donald-trump-jr-russia-2017-7","en","False","politics and government, united states politics and government","18710","Business Insider","http://www.businessinsider.com","United States","","English","United States","Digital Native"
