stories_id,publish_date,title,url,language,ap_syndicated,themes,media_id,media_name,media_url,media_pub_country,media_pub_state,media_language,media_about_country,media_media_type
"763519450","2017-05-07 00:00:00","These are the 25 richest people in Britain","http://www.businessinsider.com/sunday-times-rich-list-2017-richest-people-uk-britain-2017-4?r=UK&IR=T","en","False","finances","18710","Business Insider","http://www.businessinsider.com","United States","","English","United States","Digital Native"
"846924195","2018-04-12 03:10:02","Warner Bros. Co-Financing Deal With Brett Ratner Is Finished","https://slate.com/culture/2018/04/warner-bros-co-financing-deal-with-brett-ratner-is-finished.html","en","False","finances, motion pictures","19643","Slate.com","http://www.slate.com","United States","","English","United States","Digital Native"
"851119413","2018-04-17 04:24:00","Kensington Palace Gardens, la strada dei Billionaires","https://www.forbes.com/sites/it/2018/04/17/kensington-palace-gardens-londra-via-ricchi/","it","False","","1104","Forbes","http://www.forbes.com/","United States","","English","United States","Print Native"
"849628078","2017-11-15 00:00:00","These are the 50 richest people in the world right now","http://www.businessinsider.com/richest-people-world-billionaires-list-2017-11/?r=UK&IR=T","en","False","finances, international trade and world market, economic conditions and trends","18710","Business Insider","http://www.businessinsider.com","United States","","English","United States","Digital Native"
"857761584","2018-04-24 17:04:30","The Wall Street Journal: Weinstein Co. executives cashed in ahead of bankruptcy filing, records show","http://www.marketwatch.com/news/story.asp?guid=%7BA3F2194A-4801-11E8-80B9-0B99C9131CE5%7D&siteid=rss&rss=1","en","False","finances, suits and litigation, ethics, bankruptcies","1150","Wall Street Journal","http://online.wsj.com/","United States","New York, United States","English","United States","Print Native"
"862783233","2016-05-10 17:06:44","£14m Donors To Pro-EU 'Britain Stronger In Europe' Campaign Revealed","http://www.breitbart.com/london/2016/05/10/14m-donors-britain-stronger-europe/","en","False","politics and government, finances, elections, referendums","19334","Breitbart","http://www.breitbart.com","United States","","English","United States","Digital Native"
"863320622","2018-05-01 09:36:29","Harry Potter and the Cursed Child, Angels in America Score Big at 2018 Tony Nominations","https://slate.com/culture/2018/05/2018-tony-nominations-complete-list.html","en","False","awards, decorations and honors, theater","19643","Slate.com","http://www.slate.com","United States","","English","United States","Digital Native"
"881518327","2018-05-22 12:28:05","Sony, the world's largest music publisher, has acquired a huge stake in EMI Music Publishing for $2.3 billion","http://feedproxy.google.com/~r/businessinsider/~3/awBY7NXoPL4/sony-acquires-60-stake-in-emi-music-publishing-for-23-billion-2018-5","en","False","finances, mergers, acquisitions and divestitures","18710","Business Insider","http://www.businessinsider.com","United States","","English","United States","Digital Native"
"883553574","2018-05-24 13:10:00","Alan Faena Expands Faena Brand With New Global Agenda","https://www.forbes.com/sites/carolinetell/2018/05/24/alan-faena-expands-faena-brand-with-new-global-agenda/","en","False","travel and vacations, hotels and motels","1104","Forbes","http://www.forbes.com/","United States","","English","United States","Print Native"
"646211206","2017-06-20 17:36:22","Mnuchin Says He Divested Hollywood Financing Company Stake","https://www.bloomberg.com/politics/articles/2017-06-20/mnuchin-completes-ethics-divestitures-without-naming-buyers","en","False","finances, ethics, mergers, acquisitions and divestitures","40944","Bloomberg","http://bloomberg.com","United States","","English","United States","Digital Native"
"543041947","2016-10-04 08:00:00","More Than 10% Of The Forbes 400 Are Immigrants, 14 Of Whom Are Richer Than Trump","http://www.forbes.com/sites/jenniferwang/2016/10/04/more-than-10-percent-of-the-forbes-400-are-immigrants-14-of-whom-are-richer-than-trump/#77734fcb33ad","en","False","no index terms from nytimes","1104","Forbes","http://www.forbes.com/","United States","","English","United States","Print Native"
"543935245","2016-11-20 09:09:00","Powerful taxi boss fears Uber, likes de Blasio","http://www.politico.com/states/new-york/city-hall/story/2015/02/powerful-taxi-boss-fears-uber-likes-de-blasio-019393","en","False","","18268","Politico","http://politico.com","United States","","English","United States","Print Native"
"811946061","2016-01-01 10:00:00","Bloomberg Billionaires Index - Mikhail Fridman","https://www.bloomberg.com/billionaires/profiles/mikhail-m-fridman/","en","False","finances","40944","Bloomberg","http://bloomberg.com","United States","","English","United States","Digital Native"
"812075039","2016-01-01 10:00:00","Bloomberg Billionaires Index - Len Blavatnik","https://www.bloomberg.com/billionaires/profiles/len-blavatnik/","en","False","education and schools","40944","Bloomberg","http://bloomberg.com","United States","","English","United States","Digital Native"
"858199405","2018-04-25 06:34:57","Tangled Rusal Ownership Thwarts Easy End to Sanctions: QuickTake","https://www.washingtonpost.com/business/tangled-rusal-ownership-thwarts-easy-end-to-sanctions-quicktake/2018/04/25/11c9aafc-4873-11e8-8082-105a446d19b8_story.html","en","False","finances, mergers, acquisitions and divestitures","2","Washington Post","http://washingtonpost.com","United States","DC, USA","English","United States","Print Native"
"817495365","2018-03-08 10:55:00","Dr. Dre's $3 Billion Monster: The Secret History Of Beats","https://www.forbes.com/sites/zackomalleygreenburg/2018/03/08/dr-dres-3-billion-monster-the-secret-history-of-beats-3-kings-book-excerpt/","en","False","","1104","Forbes","http://www.forbes.com/","United States","","English","United States","Print Native"
"821437942","2016-10-04 12:46:06","Forbes 400: The Full List Of The Richest People In America 2016","https://www.forbes.com/sites/chasewithorn/2016/10/04/forbes-400-the-full-list-of-the-richest-people-in-america-2016/#4e9784a722f4","en","False","computers and the internet, finances, no index terms from nytimes","1104","Forbes","http://www.forbes.com/","United States","","English","United States","Print Native"
"581946455","2017-02-16 09:39:30","Time launches new Time Health brand and online news hub","http://rssfeeds.usatoday.com/~/271625826/0/usatodaycommoney-topstories~Time-launches-new-Time-Health-brand-and-online-news-hub/","en","False","computers and the internet, advertising and marketing, medicine and health","64866","USAToday","http://usatoday.com/","United States","Ohio, United States","English","United States","Print Native"
"643786087","2017-06-16 17:30:00","Paul McCartney, J.K. Rowling, Blavatnik, Top U.K. Honors List","https://www.bloomberg.com/politics/articles/2017-06-16/paul-mccartney-j-k-rowling-blavatnik-top-u-k-honors-list","en","False","books and literature, women, awards, decorations and honors","40944","Bloomberg","http://bloomberg.com","United States","","English","United States","Digital Native"
"752230205","2017-12-21 09:14:15","Long Island Iced Tea Rides the Coattails of Bitcoin to Paper Riches: DealBook Briefing","https://www.nytimes.com/2017/12/21/business/dealbook/taxes-workers-att.html?partner=rss&emc=rss","en","False","computers and the internet, sales","1","New York Times","http://nytimes.com","United States","NY, USA","English","United States","Print Native"
"910148401","2016-11-28 00:00:00","Time Inc. Rejected Overtures From Bronfman-Led Group","https://www.wsj.com/articles/time-inc-rejected-overtures-from-bronfman-led-group-1480368091?mod=wsj_nview_latest","en","False","finances, mergers, acquisitions and divestitures","1150","Wall Street Journal","http://online.wsj.com/","United States","New York, United States","English","United States","Print Native"
"706404698","2017-05-04 08:00:00","Bloomberg Billionaires Index - Oleg Deripaska","https://www.bloomberg.com/billionaires/profiles/oleg-deripaska/","en","False","finances, biographical information","40944","Bloomberg","http://bloomberg.com","United States","","English","United States","Digital Native"
"541720850","2016-09-20 08:00:00","The Music Industry Is Finally Making Money on Streaming","https://www.bloomberg.com/news/articles/2016-09-20/spotify-apple-drive-u-s-music-industry-s-8-first-half-growth","en","False","computers and the internet, recordings (audio), copyrights, music, sales, prices (fares, fees and rates)","40944","Bloomberg","http://bloomberg.com","United States","","English","United States","Digital Native"
"912524788","2016-03-31 04:42:12","Sky's Soccer Dominance at Stake as Rivals Covet German TV Rights","http://www.bloomberg.com/news/articles/2016-03-31/sky-s-soccer-dominance-at-stake-as-rivals-covet-german-tv-rights","en","False","computers and the internet, finances, television, soccer, mergers, acquisitions and divestitures","40944","Bloomberg","http://bloomberg.com","United States","","English","United States","Digital Native"
"661035388","2016-03-10 07:00:00","American Dreamers: 45 Foreign-Born Billionaires Who Got Rich in the U.S.","https://www.forbes.com/sites/denizcam/2016/03/10/american-dreamers-45-foreign-born-billionaires-who-got-rich-in-the-u-s/","en","False","no index terms from nytimes, immigration and refugees, illegal aliens","1104","Forbes","http://www.forbes.com/","United States","","English","United States","Print Native"
"653387983","2017-07-06 12:00:36","Tate&#x2019;s New Leader Has &#x2018;Fresh Eyes and a Lot of Energy.&#x2019; Is That Enough?","https://www.nytimes.com/2017/07/06/arts/design/maria-balshaw-tate-museum.html?partner=rss&emc=rss","en","False","art","1","New York Times","http://nytimes.com","United States","NY, USA","English","United States","Print Native"
"734788023","2017-11-13 00:00:00","Gal Gadot's reported ultimatum to Warner Bros. over Brett Ratner's involvement in 'Wonder Woman 2' is likely moot","http://www.latimes.com/business/hollywood/la-fi-ct-gal-gadot-brett-ratner-20171113-story.html","en","False","finances, motion pictures","6","LA Times","http://www.latimes.com/","United States","California, United States","English","United States","Print Native"
"642502853","2017-06-14 06:55:16","BREAKING OVERNIGHT: Massive fire in west London -- WITH FRIENDS LIKE THESE: TRUMP slaps down House Republicans’ health care bill -- POLITICO/MORNING CONSULT POLL: Voters trust Comey over Trump -- B’DAY: Brian Fallon","http://www.politico.com/tipsheets/playbook/2017/06/14/breaking-overnight-massive-fire-in-west-london-with-friends-like-these-trump-slaps-down-house-republicans-health-care-bill-politico-morning-consult-poll-voters-trust-comey-over-trump-bday-brian-fallon-220821","en","False","politics and government, medicine and health, fires and firefighters","18268","Politico","http://politico.com","United States","","English","United States","Print Native"
"932420137","2017-05-06 00:00:00","Billionaire Superyacht Showdown: Who's Who at the 2017 Cannes Film Festival","https://www.forbes.com/sites/jimdobson/2017/05/06/billionaire-superyacht-showdown-whos-who-at-the-2017-cannes-film-festival/#1c434286354b","en","False","","1104","Forbes","http://www.forbes.com/","United States","","English","United States","Print Native"
"910654343","2017-09-26 00:00:00","Hollywood Is Scrambling to Replace Chinese Funding","https://www.bloomberg.com/news/articles/2017-09-26/hollywood-is-scrambling-to-replace-chinese-funding","en","False","finances, motion pictures, mergers, acquisitions and divestitures","40944","Bloomberg","http://bloomberg.com","United States","","English","United States","Digital Native"
"941656171","2016-05-11 15:07:57","The Maestro of Miami Beach: Alan Faena and His New Faena Hotel","https://www.forbes.com/sites/annabel/2016/05/11/the-maestro-of-miami-beach-alan-faena-and-his-new-faena-hotel/#1b82550c704e","en","False","travel and vacations, hotels and motels","1104","Forbes","http://www.forbes.com/","United States","","English","United States","Print Native"
"863298581","2018-05-01 09:19:03","Amy Schumer, Tina Fey, &apos;Harry Potter and the Cursed Child&apos; score Tony nominations","http://rssfeeds.usatoday.com/~/542865192/0/usatoday-newstopstories~Amy-Schumer-Tina-Fey-aposHarry-Potter-and-the-Cursed-Childapos-score-Tony-nominations/","en","False","theater","64866","USAToday","http://usatoday.com/","United States","Ohio, United States","English","United States","Print Native"
"944778309","2018-08-03 06:37:00","Chi è Len Blavatnik, il miliardario che ha fondato Dazn","https://www.forbes.com/sites/it/2018/08/03/len-blavatnik-fondatore-dazn-perform-group/","it","False","","1104","Forbes","http://www.forbes.com/","United States","","English","United States","Print Native"
"912453409","2017-07-14 04:07:00","Blavatnik's Netflix of Sports Is Said to Target Canada Expansion","https://www.bloomberg.com/news/articles/2017-07-14/blavatnik-s-netflix-of-sports-is-said-to-target-canada-expansion-j53kybeq","en","False","finances, mergers, acquisitions and divestitures","40944","Bloomberg","http://bloomberg.com","United States","","English","United States","Digital Native"
"947385525","2017-03-21 00:00:00","Where The Wealthiest Live: Cities With The Most Billionaires","https://www.forbes.com/sites/ryansalchert/2017/03/21/where-the-wealthiest-live-cities-with-the-most-billionaires/#7d08f4943677","en","False","finances","1104","Forbes","http://www.forbes.com/","United States","","English","United States","Print Native"
"531416750","2016-10-21 11:35:58","Review: &#x2018;The Front Page&#x2019; Is Diverting, but Don&#x2019;t Stop the Presses","http://www.nytimes.com/2016/10/22/theater/review-the-front-page-nathan-lane.html?partner=rss&emc=rss","en","False","theater","1","New York Times","http://nytimes.com","United States","NY, USA","English","United States","Print Native"
"621323797","2017-05-09 05:00:29","Buying Spree Brings Attention to Opaque Chinese Company","https://www.nytimes.com/2017/05/09/business/hna-group-hainan-airlines-china-deals.html?partner=rss&emc=rss","en","False","finances, banks and banking, economic conditions and trends, mergers, acquisitions and divestitures","1","New York Times","http://nytimes.com","United States","NY, USA","English","United States","Print Native"
"912446348","2016-06-09 09:17:58","Sky Retains Grip on German Soccer in $5.3 Billion Auction","http://www.bloomberg.com/news/articles/2016-06-09/sky-retains-grip-on-german-live-soccer-in-5-3-billion-auction","en","False","computers and the internet, finances, television, soccer, telephones and telecommunications","40944","Bloomberg","http://bloomberg.com","United States","","English","United States","Digital Native"
"823815052","2017-10-24 12:59:38","**Live Updates**: NYPD Investigating Alleged Weinstein Rape of HBO Star; Scotland Yard Probes Spacey Claims; Ratner Accused of Rape; Colbert Cancels on Jeremy Piven | Breitbart","http://www.breitbart.com/big-hollywood/2017/10/24/live-weinstein-updates-spacey-accused-netflix-suspends-house-cards-london-police-investigate/","en","False","motion pictures, crime and criminals, sex crimes, biographical information","19334","Breitbart","http://www.breitbart.com","United States","","English","United States","Digital Native"
"703083710","2016-06-23 08:00:00","With Big Gift, Carnegie to Name Tier of Boxes for Blavatnik Family","https://www.nytimes.com/2016/06/23/arts/music/with-big-gift-carnegie-to-name-tier-of-boxes-for-blavatnik-family.html","en","False","no index terms from nytimes","1","New York Times","http://nytimes.com","United States","NY, USA","English","United States","Print Native"
"536771518","2016-01-26 00:00:00","The 50 richest people on earth","http://www.businessinsider.com/50-richest-people-on-earth-2016-1/#49-tie-aliko-dangote-1","en","False","finances","18710","Business Insider","http://www.businessinsider.com","United States","","English","United States","Digital Native"
"690363336","2017-08-18 08:00:00","Billionaire Ally of Putin Socialized With Kushner, Ivanka Trump","https://www.bloomberg.com/news/articles/2017-08-18/billionaire-ally-of-putin-socialized-with-kushner-ivanka-trump?utm_content=politics&utm_campaign=socialflow-organic&utm_source=twitter&utm_medium=social&cmpid%3D=socialflow-twitter-politics","en","False","finances","40944","Bloomberg","http://bloomberg.com","United States","","English","United States","Digital Native"
"881732255","2018-05-22 17:01:00","Powerfully Creative, American Ballet Theatre Spring Gala Raises Nearly $2 Million","https://www.forbes.com/sites/bettinazilkha/2018/05/22/powerfully-creative-american-ballet-theatre-spring-gala-raises-nearly-2-million/","en","False","dancing","1104","Forbes","http://www.forbes.com/","United States","","English","United States","Print Native"
"598720595","2017-03-24 13:41:18","Earth Without Art Is Just Eh","http://www.huffingtonpost.com/jason-mraz/earth-without-art-is-just-eh_b_15584580.html","en","False","","27502","Huffington Post","http://www.huffingtonpost.com/#","United States","","English","United States",""
"925848868","2016-10-04 17:34:17","More Than 10% Of The Forbes 400 Are Immigrants, 14 Of Whom Are Richer Than Trump","https://www.forbes.com/sites/jenniferwang/2016/10/04/more-than-10-percent-of-the-forbes-400-are-immigrants-14-of-whom-are-richer-than-trump/#13eb451e4235","en","False","","1104","Forbes","http://www.forbes.com/","United States","","English","United States","Print Native"
"666117673","2017-04-19 09:00:00","Mnuchin's New Hollywood Partner Made Billions in Russian Oil","https://www.bloomberg.com/news/articles/2017-04-19/mnuchin-s-newest-hollywood-partner-made-billions-in-russian-oil","en","False","finances, motion pictures, mergers, acquisitions and divestitures","40944","Bloomberg","http://bloomberg.com","United States","","English","United States","Digital Native"
"656937667","2016-04-03 08:00:00","Opinion | The Tampon of the Future","https://www.nytimes.com/2016/04/03/opinion/sunday/the-tampon-of-the-future.html","en","False","privacy, tests and testing, medicine and health, women, drugs (pharmaceuticals), diseases and conditions, inventions and patents","1","New York Times","http://nytimes.com","United States","NY, USA","English","United States","Print Native"
"465864032","2016-05-13 19:36:00","Cannes Film Festival Celebrity amfAR Auction Features the Most Spectacular Items Ever! (Exclusive)","http://www.forbes.com/sites/jimdobson/2016/05/13/cannes-film-festival-celebrity-amfar-auction-features-the-most-spectacular-items-ever-exclusive/","en","False","motion pictures, philanthropy, travel and vacations, festivals","1104","Forbes","http://www.forbes.com/","United States","","English","United States","Print Native"
"963107922","2016-02-03 00:00:00","Why Washington Is Making It Easier For Rich Foreigners To Buy U.S. Real Estate","https://www.forbes.com/sites/kenrapoza/2016/02/03/why-washington-is-making-it-easier-for-rich-foreigners-to-buy-u-s-real-estate/#7dccada51392","en","False","finances, housing","1104","Forbes","http://www.forbes.com/","United States","","English","United States","Print Native"
"703123042","2017-08-25 00:00:00","The 28 universities that have produced the most European billionaires","http://www.businessinsider.com/28-universities-that-have-produced-the-most-european-billionaires-2017-8/?r=UK&IR=T","en","False","education and schools, finances, colleges and universities","18710","Business Insider","http://www.businessinsider.com","United States","","English","United States","Digital Native"
"871316694","2018-05-10 11:03:00","Exclusive: Extravagant amfAR Gala Auction Items At The 2018 Cannes Film Festival","https://www.forbes.com/sites/jimdobson/2018/05/10/exclusive-extravagant-amfar-gala-auction-items-at-the-2018-cannes-film-festival/","en","False","motion pictures, philanthropy, travel and vacations, festivals, photography, trade shows and fairs","1104","Forbes","http://www.forbes.com/","United States","","English","United States","Print Native"
"870297814","2018-05-09 10:45:00","Billionaire Superyacht Showdown: Who's Who at the 2018 Cannes Film Festival","https://www.forbes.com/sites/jimdobson/2018/05/09/billionaire-superyacht-showdown-whos-who-at-the-2018-cannes-film-festival/","en","False","motion pictures, festivals","1104","Forbes","http://www.forbes.com/","United States","","English","United States","Print Native"
"815842574","2018-03-06 16:58:00","Deal For The Weinstein Company Is Off Again, Says Maria Contreras-Sweet","https://www.forbes.com/sites/natalierobehmed/2018/03/06/deal-for-the-weinstein-company-is-off-again-says-maria-contreras-sweet/","en","False","finances, mergers, acquisitions and divestitures, bankruptcies","1104","Forbes","http://www.forbes.com/","United States","","English","United States","Print Native"
"829263903","2018-03-21 19:42:00","Time, Fortune and Sports Illustrated magazines are up for sale","https://www.nbcnews.com/pop-culture/lifestyle/time-fortune-sports-illustrated-magazines-are-sale-n858916?cid=public-rss_20180322","en","True","finances, news and news media, newspapers, magazines, mergers, acquisitions and divestitures","25499","NBC News","http://www.nbcnews.com","United States","","English","United States",""
"902417706","2018-06-15 02:00:00","Sports media group Perform goes on the attack with Serie A soccer","http://feeds.reuters.com/~r/reuters/companyNews/~3/BKGNB5CdriU/sports-media-group-perform-goes-on-the-attack-with-serie-a-soccer-idUSL8N1TG400","en","False","finances, soccer, mergers, acquisitions and divestitures","4442","Reuters","http://www.reuters.com","United States","PA, USA","English","none","Other"
"906389949","2018-06-19 23:00:00","Russian Oligarch Takes Over West End Theater in Record-Breaking Deal","https://www.forbes.com/sites/marchershberg/2018/06/19/russian-oligarch-takes-over-west-end-theater-in-record-breaking-deal/","en","False","theater","1104","Forbes","http://www.forbes.com/","United States","","English","United States","Print Native"
"954676600","2018-08-15 18:04:53","From Masthead to Maître D’: Gabé Doppelt at Tower Bar","https://www.nytimes.com/2018/08/15/style/tower-bar-gabe-doppelt.html","en","False","","1","New York Times","http://nytimes.com","United States","NY, USA","English","United States","Print Native"
"455051570","2016-04-28 22:00:14","Review: &#x2018;Shuffle Along&#x2019; Returns to Broadway&#x2019;s Embrace","http://www.nytimes.com/2016/04/29/theater/review-shuffle-along-returns-to-broadways-embrace.html?partner=rss&emc=rss","en","False","reviews, theater","1","New York Times","http://nytimes.com","United States","NY, USA","English","United States","Print Native"
"858183234","2018-04-25 05:23:17","Tangled Rusal Ownership Thwarts Easy End to Sanctions: QuickTake","https://www.bloomberg.com/news/articles/2018-04-25/tangled-rusal-ownership-thwarts-easy-end-to-sanctions-quicktake","en","False","finances, mergers, acquisitions and divestitures","40944","Bloomberg","http://bloomberg.com","United States","","English","United States","Digital Native"
"882814605","2018-04-24 00:00:00","As Weinstein Scandal Brewed, Studio Executives Cashed In","https://www.wsj.com/articles/as-weinstein-scandal-brewed-studio-executives-cashed-in-1524599965","en","False","finances, motion pictures, ethics, bankruptcies","1150","Wall Street Journal","http://online.wsj.com/","United States","New York, United States","English","United States","Print Native"
"550156537","2016-12-04 19:04:46","Wolff: Don't underestimate print media's value","http://rssfeeds.usatoday.com/~/238510056/0/usatodaycommoney-topstories~Wolff-Dont-underestimate-print-medias-value/","en","False","finances, news and news media, newspapers, mergers, acquisitions and divestitures","64866","USAToday","http://usatoday.com/","United States","Ohio, United States","English","United States","Print Native"
"591080221","2016-03-11 12:00:00","Bloomberg Billionaires Index - Viktor Vekselberg","https://www.bloomberg.com/billionaires/profiles/viktor-vekselberg/","en","False","biographical information","40944","Bloomberg","http://bloomberg.com","United States","","English","United States","Digital Native"
"545274055","2016-03-01 07:00:00","Forbes Billionaires: Full List Of The 500 Richest People In The World 2016","http://www.forbes.com/sites/kerenblankfeld/2016/03/01/forbes-billionaires-full-list-of-the-500-richest-people-in-the-world-2016/#d513beb6c24a","en","False","computers and the internet","1104","Forbes","http://www.forbes.com/","United States","","English","United States","Print Native"
"1004420732","2018-09-27 04:29:41.693356","Len Blavatnik","https://www.forbes.com/profile/len-blavatnik/?list=billionaires","en","False","","1104","Forbes","http://www.forbes.com/","United States","","English","United States","Print Native"
"666650631","2017-05-10 20:22:00","Len Blavatnik","https://www.forbes.com/profile/len-blavatnik/","en","False","finances, theater","1104","Forbes","http://www.forbes.com/","United States","","English","United States","Print Native"
"1004506161","2018-09-27 06:12:14.392207","Blavatnik owns AI Film, the independent film and production company that’s behind acclaimed film Lee Daniels’ The Butler and the summer 2015 release Mr. Holmes.","https://www.businessinsider.in/meet-len-blavatnik-the-richest-man-in-britain/Blavatnik-owns-AI-Film-the-independent-film-and-production-company-thats-behind-acclaimed-film-Lee-Daniels-The-Butler-and-the-summer-2015-release-Mr-Holmes-/slideshow/47790832.cms?from=mdr","en","False","biographical information","18710","Business Insider","http://www.businessinsider.com","United States","","English","United States","Digital Native"
