stories_id,publish_date,title,url,language,ap_syndicated,themes,media_id,media_name,media_url,media_pub_country,media_pub_state,media_language,media_about_country,media_media_type
"877577411","2018-05-17 14:25:03.951621","Len Blavatnik","https://www.forbes.com/profile/len-blavatnik/?list=rtb","en","False","finances, theater","1104","Forbes","http://www.forbes.com/","United States","","English","United States","Print Native"
"732241924","2017-11-26 21:46:15","Time Inc. has new owners, including the Koch brothers","http://rss.cnn.com/~r/rss/cnn_latest/~3/2y8ndzpvij4/index.html","en","False","finances, magazines, mergers, acquisitions and divestitures","1095","CNN","http://www.cnn.com/","United States","GA, USA","English","United States","Video Broadcast"
"641204504","2017-06-11 19:01:06","The World’s Unlikeliest Socialists","https://www.bloomberg.com/news/articles/2017-06-11/why-kensington-rejected-theresa-may-and-voted-for-corbyn-s-labour","en","False","politics and government, finances, economic conditions and trends","40944","Bloomberg","http://bloomberg.com","United States","","English","United States","Digital Native"
"817576172","2018-03-08 12:27:00","Bad Year For Russian Billionaires: Three Fight Over $2 Billion From Oil Deal","https://www.forbes.com/sites/kenrapoza/2018/03/08/bad-year-for-russian-billionaires-three-fight-over-2-billion-from-oil-deal/","en","False","politics and government, finances, suits and litigation, oil (petroleum) and gasoline, international trade and world market","1104","Forbes","http://www.forbes.com/","United States","","English","United States","Print Native"
"1005886519","2018-09-28 07:00:00","Russian-US tycoon boasted of ‘active’ involvement in Trump election campaign","https://www.theguardian.com/us-news/2018/sep/28/russian-us-tycoon-boasted-of-active-involvement-in-trump-election-campaign-simon-kukes","en","False","politics and government, united states politics and government, elections","623382","Guardian - United States","http://www.theguardian.com/us","United States","","English","","Print Native"
"666564194","2017-05-16 08:00:00","Robin Hood Raises $54.5 Million at New York Benefit","https://www.bloomberg.com/news/articles/2017-05-16/robin-hood-raises-55-5-million-at-benefit-aided-by-griffin","en","False","education and schools, finances","40944","Bloomberg","http://bloomberg.com","United States","","English","United States","Digital Native"
"796883125","2017-09-22 00:00:00","GOP Funds Donald Trump’s Defense in Russia Probe With Help From a Handful of Wealthy People","https://www.wsj.com/amp/articles/gop-funds-donald-trumps-defense-in-russia-probe-with-help-from-a-handful-of-wealthy-people-1506109617","en","False","politics and government, finances, united states politics and government, elections, ethics","1150","Wall Street Journal","http://online.wsj.com/","United States","New York, United States","English","United States","Print Native"
"1012590803","2018-10-04 05:45:00","From Sergey Brin to Elon Musk: Meet The 43 Immigrants On The Forbes 400","https://www.forbes.com/sites/denizcam/2018/10/04/forbes-400-immigrants-sergey-brin-elon-musk-george-soros/","en","False","politics and government, finances, labor, immigration and refugees, biographical information","1104","Forbes","http://www.forbes.com/","United States","","English","United States","Print Native"
"676189547","2017-08-18 00:00:03","Billionaire Ally of Putin Socialized With Kushner, Ivanka Trump","https://www.bloomberg.com/news/articles/2017-08-18/billionaire-ally-of-putin-socialized-with-kushner-ivanka-trump","en","False","finances","40944","Bloomberg","http://bloomberg.com","United States","","English","United States","Digital Native"
"1014685026","2018-10-05 06:45:00","A Man Of 3 Worlds: The Russian Billionaire Giving Hundreds Of Millions To U.S. and U.K. Universities","https://www.forbes.com/sites/angelauyeung/2018/10/05/len-blavatnik-philanthropy-2018-forbes-400/","en","False","education and schools, finances, colleges and universities, philanthropy, biographical information","1104","Forbes","http://www.forbes.com/","United States","","English","United States","Print Native"
"478284233","2016-06-15 09:18:20","TRUMP’S TWITTER ARMY: 90% of followers are reliable voters -- OBAMA: ‘We’ve gone through moments in our history before when we acted out of fear, and we came to regret it’","http://www.politico.com/tipsheets/playbook/2016/06/trumps-twitter-army-90-of-followers-are-reliable-voters-obama-weve-gone-through-moments-in-our-history-before-when-we-acted-out-of-fear-and-we-came-to-regret-it-214826","en","False","politics and government, united states politics and government, elections, primaries","18268","Politico","http://politico.com","United States","","English","United States","Print Native"
"1005965657","2018-09-28 07:00:10","Big donor to Trump campaign made overture to top Russian official","https://www.nbcnews.com/politics/donald-trump/big-donor-trump-campaign-made-overture-top-russian-official-boasting-n913791?cid=public-rss_20180928","en","False","politics and government, united states politics and government, elections","25499","NBC News","http://www.nbcnews.com","United States","","English","United States",""
"1018084937","2018-10-08 06:00:17","Eddie Hearn takes first tentative steps to conquering America | Sean Ingle","https://www.theguardian.com/sport/blog/2018/oct/08/eddie-hearn-conquering-america","en","False","","623382","Guardian - United States","http://www.theguardian.com/us","United States","","English","","Print Native"
"524931461","2016-10-10 19:39:03","Super PAC Megadonors Are Giving More Than Ever In 2016","http://www.huffingtonpost.com/2016/10/10/super-pac-donors-2016_n_12434242.html","en","False","politics and government, finances, united states politics and government, elections","27502","Huffington Post","http://www.huffingtonpost.com/#","United States","","English","United States",""
"1024331821","2018-10-15 12:17:00","DAZN Could Sell Opta And Other B2B Units To Fuel Sports Streaming Expansion","https://www.forbes.com/sites/stevemccaskill/2018/10/15/dazn-could-sell-opta-and-other-b2b-units-to-fuel-sports-streaming-expansion/","en","False","computers and the internet, finances, recordings (audio), mergers, acquisitions and divestitures","1104","Forbes","http://www.forbes.com/","United States","","English","United States","Print Native"
"588862631","2016-10-10 19:39:03","Super PAC Megadonors Are Giving More Than Ever In 2016 | The Huffington Post","http://www.huffingtonpost.com/entry/super-pac-donors-2016_us_57fc068de4b0e655eab6f34e","en","False","politics and government, law and legislation, finances, united states politics and government, elections, lobbying and lobbyists, editorials, ethics","27502","Huffington Post","http://www.huffingtonpost.com/#","United States","","English","United States",""
"1086336355","2018-11-22 15:59:52.892210","Big donor to Trump campaign made overture to top Russian official, boasting of connections","https://www.nbcnews.com/politics/donald-trump/big-donor-trump-campaign-made-overture-top-russian-official-boasting-n913791?cid=sm_npd_nn_tw_ma","en","False","politics and government, united states politics and government, elections","25499","NBC News","http://www.nbcnews.com","United States","","English","United States",""
"1115333377","2016-02-25 00:00:00","The rise of billionaire Len Blavatnik, one of Wall Street’s greatest dealmakers","https://www.businessinsider.com/the-rise-of-billionaire-dealmaker-len-blavatnik-2016-2#in-1986-blavatnik-founded-access-industries-a-privately-held-industrial-company-initially-ai-was-involved-in-russian-investments-but-has-since-diversified-its-portfolio-ai-now-invests-natural-resources-and-chemicals-media-and-telecommunications-technology-and-e-commerce-and-real-estate-3","en","False","finances, mergers, acquisitions and divestitures","18710","Business Insider","http://www.businessinsider.com","United States","","English","United States","Digital Native"
